,category_id,description,category_path
0,408,"david sunflower seed, barbeque flavor, 5.25-ounce bag (pack of 12)",Grocery & Gourmet Food > Snack Foods > Nuts & Seeds
1,408,indus organic raw hazelnut,Grocery & Gourmet Food > Snack Foods > Nuts & Seeds
2,408,"madi k's almonds, whole natural nonpareil, 31 count (pack of 31) quantity: 2",Grocery & Gourmet Food > Snack Foods > Nuts & Seeds
3,408,"Cashews, Whole, Raw, 320, Bulk Nuts - We Got Nuts (2 LBS.)",Grocery & Gourmet Food > Snack Foods > Nuts & Seeds
4,408,"wonderful pistachios roasted and salted pistachios,1.5 ounce, pack of 24. quantity: 2",Grocery & Gourmet Food > Snack Foods > Nuts & Seeds
5,408,dry roasted & unsalted almonds by farm fresh nuts (4 lb),Grocery & Gourmet Food > Snack Foods > Nuts & Seeds
6,408,huangfeihong spicy snack peanuts - 30 * 3.8 oz /110g 30 bags,Grocery & Gourmet Food > Snack Foods > Nuts & Seeds
7,408,soil mender yum yum mix 5 lb,Grocery & Gourmet Food > Snack Foods > Nuts & Seeds
8,408,"Bob's Red Mill Chia Seeds, 16-ounce (Package May Vary)",Grocery & Gourmet Food > Snack Foods > Nuts & Seeds
9,408,"blue diamond almonds, roasted salted, 16 oz new",Grocery & Gourmet Food > Snack Foods > Nuts & Seeds
10,408,"sahale snacks california almonds plus sea salt, 18 count",Grocery & Gourmet Food > Snack Foods > Nuts & Seeds
11,408,sugar free assorted jordan almonds (1 pound bag),Grocery & Gourmet Food > Snack Foods > Nuts & Seeds
12,408,Honey Roasted Cinnamon Pecans By Farm Fresh Nuts (1 LB),Grocery & Gourmet Food > Snack Foods > Nuts & Seeds
13,408,"wonderful almonds, roasted and salted, 7-oz bag quantity: 5",Grocery & Gourmet Food > Snack Foods > Nuts & Seeds
14,408,Bulk 6 lbs - Now and Later Bag,Grocery & Gourmet Food > Snack Foods > Nuts & Seeds
15,408,natural raw almonds (4 pound bag),Grocery & Gourmet Food > Snack Foods > Nuts & Seeds
16,408,"planters nutrition heart healthy mix (peanuts, almonds, pistachios, pecans, walnuts & hazelnuts), 9.75 oz",Grocery & Gourmet Food > Snack Foods > Nuts & Seeds
17,408,"the chia company seed, ground, 12.3 ounce",Grocery & Gourmet Food > Snack Foods > Nuts & Seeds
18,408,"blue diamond almonds, wasabi and soy, 1.5-ounce packages (pack of 24)",Grocery & Gourmet Food > Snack Foods > Nuts & Seeds
19,408,terrasoul superfoods raw,Grocery & Gourmet Food > Snack Foods > Nuts & Seeds
20,408,"virginia diner virginia peanuts, unsalted, 18-ounce",Grocery & Gourmet Food > Snack Foods > Nuts & Seeds
21,408,"food to live ® walnuts (raw, no shell) (2.5 pounds)",Grocery & Gourmet Food > Snack Foods > Nuts & Seeds
22,408,"manitoba harvest hemp hearts raw shelled hemp seeds, natural flavor, 1 pound. new",Grocery & Gourmet Food > Snack Foods > Nuts & Seeds
23,408,"Blue Diamond Bold Hot & Spicy Almonds 4Pack Bundle: 1-Sriracha, 1-Habanero BBQ,1-Wasabi & Soy Sauce, 1-Salt &",Grocery & Gourmet Food > Snack Foods > Nuts & Seeds
24,408,"food to live certified organic almonds (raw, no shell, unpasteurized) (4 pounds)",Grocery & Gourmet Food > Snack Foods > Nuts & Seeds
25,408,"nuts cashew pieces, raw, 5 pound - we got nuts",Grocery & Gourmet Food > Snack Foods > Nuts & Seeds
26,408,"food to live brazil nuts (raw, no shell) (0.5 lb)",Grocery & Gourmet Food > Snack Foods > Nuts & Seeds
27,408,"bergin nut company cashew whole raw, 16-ounce bags (pack of 2)",Grocery & Gourmet Food > Snack Foods > Nuts & Seeds
28,408,"blue diamond whole natural almonds, 6 oz",Grocery & Gourmet Food > Snack Foods > Nuts & Seeds
29,408,David Simply Seeds- Jumbo Roasted Sunflower Seeds Variety Pack- 3 Flavors Lightly,Grocery & Gourmet Food > Snack Foods > Nuts & Seeds
30,408,5 lb. bulk bag atomic,Grocery & Gourmet Food > Snack Foods > Nuts & Seeds
31,408,"BioSafe Systems 3002-8 GreenClean Granular Algaecide, 8 Pounds",Grocery & Gourmet Food > Snack Foods > Nuts & Seeds
32,408,nutiva organic chia seed,Grocery & Gourmet Food > Snack Foods > Nuts & Seeds
33,408,sincerely nuts whole cashews roasted & unsalted 1 lb,Grocery & Gourmet Food > Snack Foods > Nuts & Seeds
34,408,roasted salted ca pistachios 1 lb bulk bag,Grocery & Gourmet Food > Snack Foods > Nuts & Seeds
35,408,brazil nuts - 2 pounds - we got nuts,Grocery & Gourmet Food > Snack Foods > Nuts & Seeds
36,408,"healthworks 100% certified usda organic raw chia seeds, 3 pound",Grocery & Gourmet Food > Snack Foods > Nuts & Seeds
37,408,"manitoba harvest hemp hearts, raw shelled hemp seeds, 1 pound grocery",Grocery & Gourmet Food > Snack Foods > Nuts & Seeds
38,408,"beer nuts cashews, 12 ounce can",Grocery & Gourmet Food > Snack Foods > Nuts & Seeds
39,408,"kirkland signature variety snacking nuts, 48 ounce",Grocery & Gourmet Food > Snack Foods > Nuts & Seeds
40,408,Blue Diamond Almonds Salt N Vinegar,Grocery & Gourmet Food > Snack Foods > Nuts & Seeds
41,408,nature's intent dark chocolate enrobed mangoes,Grocery & Gourmet Food > Snack Foods > Nuts & Seeds
42,408,planters dry roasted peanuts made with sea salt 52 ounce container,Grocery & Gourmet Food > Snack Foods > Nuts & Seeds
43,408,"nutiva chia seeds,og 12 oz",Grocery & Gourmet Food > Snack Foods > Nuts & Seeds
44,408,planters unsalted dry roasted peanuts net wt 16 oz (pack of 6),Grocery & Gourmet Food > Snack Foods > Nuts & Seeds
45,408,Jumbo Reduced Sodium Sunflower Seeds (4 Pack) 5.25 oz each,Grocery & Gourmet Food > Snack Foods > Nuts & Seeds
46,408,truvibe 100% organic raw chia seeds (8 ounce),Grocery & Gourmet Food > Snack Foods > Nuts & Seeds
47,408,"Barlean's Non-GMO Organic Chia Seed, 12 Ounce",Grocery & Gourmet Food > Snack Foods > Nuts & Seeds
48,408,blue diamond bold wasabi & soy sauce almonds - 38 oz tub new,Grocery & Gourmet Food > Snack Foods > Nuts & Seeds
49,408,bitter almonds raw organic (kernels) 430g bag (15oz),Grocery & Gourmet Food > Snack Foods > Nuts & Seeds
50,408,royal oak 195228017 lump,Grocery & Gourmet Food > Snack Foods > Nuts & Seeds
51,408,Sincerely Nuts Pistachios Roasted & UnSalted Kernels 2LB Bag,Grocery & Gourmet Food > Snack Foods > Nuts & Seeds
52,408,"Anna and Sarah Organic Raw Cashews in Resealable Bag, 2 Lbs",Grocery & Gourmet Food > Snack Foods > Nuts & Seeds
53,408,DAVID Sunflower Seeds Jumbo Sweet and Salty - Bag 5.25 oz each (12 Pack),Grocery & Gourmet Food > Snack Foods > Nuts & Seeds
54,408,peanut patch green boiled peanuts cajun 3 pack,Grocery & Gourmet Food > Snack Foods > Nuts & Seeds
55,408,"mauna loa maui onion & garlic macadamia nuts, 11-ounce bag (pack of 3)",Grocery & Gourmet Food > Snack Foods > Nuts & Seeds
56,408,"cashews, whole, raw, 320, bulk nuts - we got nuts (5 lbs.)",Grocery & Gourmet Food > Snack Foods > Nuts & Seeds
57,408,planters pride rzp3056,Grocery & Gourmet Food > Snack Foods > Nuts & Seeds
58,408,no shell raw sunflower seeds (10 pound case),Grocery & Gourmet Food > Snack Foods > Nuts & Seeds
59,408,Spicy World Natural Raw Sliced Almonds - 1 Pound Bag - Fresh!,Grocery & Gourmet Food > Snack Foods > Nuts & Seeds
60,408,"nut roaster's reserve premium in-shell mixed nuts (40 ounces) -- almonds, walnuts, pecans, brazils, hazelnuts",Grocery & Gourmet Food > Snack Foods > Nuts & Seeds
61,408,"blue diamond almonds 7-100 calorie packs-lightly salted, 4.2-ounce boxes (pack of 6)",Grocery & Gourmet Food > Snack Foods > Nuts & Seeds
62,408,"food to live ® organic cashews (whole, raw) (4 pounds)",Grocery & Gourmet Food > Snack Foods > Nuts & Seeds
63,408,"planters peanuts, spanish",Grocery & Gourmet Food > Snack Foods > Nuts & Seeds
64,408,"blue diamond almond breeze, unsweetened vanilla, 32 fl oz",Grocery & Gourmet Food > Snack Foods > Nuts & Seeds
65,408,"almonds, shelled, raw, 10 lbs. bulk by its delish",Grocery & Gourmet Food > Snack Foods > Nuts & Seeds
66,408,"pumpkin, sunflower, chia, flax, hemp seed raw mix by gerbs - 2lbs - top 11 food allergen free & non gmo - vegan & kosher - made in usa",Grocery & Gourmet Food > Snack Foods > Nuts & Seeds
67,408,roasted salted ca pistachios 5 lb bulk bag,Grocery & Gourmet Food > Snack Foods > Nuts & Seeds
68,408,"blue diamond almonds habanero bbq, 6-ounce containers (pack of 6)",Grocery & Gourmet Food > Snack Foods > Nuts & Seeds
69,408,david original roasted and all natural salted sunflower seeds team bucket 1.75 ounce bags (pack of 66),Grocery & Gourmet Food > Snack Foods > Nuts & Seeds
70,408,smart protein: non gmo,Grocery & Gourmet Food > Snack Foods > Nuts & Seeds
71,408,"madi k's roasted and salted almonds, 5.5-ounce pouches (pack of 12)",Grocery & Gourmet Food > Snack Foods > Nuts & Seeds
72,408,Roasted Unsalted Cashews ~ 4 Lb. - We Got Nuts,Grocery & Gourmet Food > Snack Foods > Nuts & Seeds
73,408,raw peanuts 4lb,Grocery & Gourmet Food > Snack Foods > Nuts & Seeds
74,408,"david sunflower seeds, jumbo 4 pack bundle, 2 packs jalapeno hot salsa, 2 packs chili lime, 5.25 oz ea.",Grocery & Gourmet Food > Snack Foods > Nuts & Seeds
75,408,"blue diamond almonds, 100 calorie bags, lightly salted, 7 ea",Grocery & Gourmet Food > Snack Foods > Nuts & Seeds
76,408,"braga organic farms inshell pistachios, raw, 2 pound",Grocery & Gourmet Food > Snack Foods > Nuts & Seeds
77,408,Sincerely Nuts Pistachios Roasted & Unsalted Kernels (No Shell) - Two (2) Lb. Bag - Irresistibly Delish and Crunchy - Bursting with Antioxidants - Kosher,Grocery & Gourmet Food > Snack Foods > Nuts & Seeds
78,408,David Sunflower Seeds - 5.25 oz,Grocery & Gourmet Food > Snack Foods > Nuts & Seeds
79,408,"blue diamond oven roasted almonds, dark chocolate, 30-ounce bag",Grocery & Gourmet Food > Snack Foods > Nuts & Seeds
80,408,"emerald natural walnuts & almonds, 100 calorie pack, 3.92 ounce packages (pack of 12)",Grocery & Gourmet Food > Snack Foods > Nuts & Seeds
81,408,"food to live organic cashews (whole, raw) (2 lbs)",Grocery & Gourmet Food > Snack Foods > Nuts & Seeds
82,408,raw organic cashews (10 pound case),Grocery & Gourmet Food > Snack Foods > Nuts & Seeds
83,408,"Anthony's USDA Organic White Quinoa, 3lbs, Certified Gluten-Free, Certified Kosher",Grocery & Gourmet Food > Snack Foods > Nuts & Seeds
84,408,Lightly Sea Salted Pumpkin Seed Kernels by Gerbs - 4 LBS - Top 11 Food Allergen Free & Non GMO - Premium Dry Roasted Shelled Pepitas - COG Mexico,Grocery & Gourmet Food > Snack Foods > Nuts & Seeds
85,408,"walnut halves & pieces, raw, 10# bulk",Grocery & Gourmet Food > Snack Foods > Nuts & Seeds
86,408,"Food To Live ® Hazelnuts / Filberts (Raw, No Shell) (1 Pound)",Grocery & Gourmet Food > Snack Foods > Nuts & Seeds
87,408,the peanut shop of,Grocery & Gourmet Food > Snack Foods > Nuts & Seeds
88,408,"diamond whole almonds, 6-ounce bags (pack of 4)",Grocery & Gourmet Food > Snack Foods > Nuts & Seeds
89,408,"viva labs organic cacao nibs: raw, unsweetened and non-gmo, 1lb bag",Grocery & Gourmet Food > Snack Foods > Nuts & Seeds
90,408,raw brazil nuts (no shell) 5lb bag bulk,Grocery & Gourmet Food > Snack Foods > Nuts & Seeds
91,408,"Roasted Unsalted Jumbo Peanuts, Blanched , 5 Pound Bulk Bag - We Got Nuts",Grocery & Gourmet Food > Snack Foods > Nuts & Seeds
92,408,"blue diamond salt & vinegar almonds, bold tins, 6 oz",Grocery & Gourmet Food > Snack Foods > Nuts & Seeds
93,408,assorted jordan almonds (1,Grocery & Gourmet Food > Snack Foods > Nuts & Seeds
94,408,tukmaria (sacred basil seeds) 7oz,Grocery & Gourmet Food > Snack Foods > Nuts & Seeds
95,408,"virginia diner honey roasted peanuts, 18-ounce",Grocery & Gourmet Food > Snack Foods > Nuts & Seeds
96,408,"now foods white chia seed meal, 10-ounces",Grocery & Gourmet Food > Snack Foods > Nuts & Seeds
97,408,chacha sunflower roasted and salted seeds (all nature) 250g x 18bags,Grocery & Gourmet Food > Snack Foods > Nuts & Seeds
98,408,unsalted dry roasted cashews (4 pound bag),Grocery & Gourmet Food > Snack Foods > Nuts & Seeds
99,408,"planters dry roasted peanuts bag, 6 ounce (pack of 12)",Grocery & Gourmet Food > Snack Foods > Nuts & Seeds
100,408,"food to live walnuts (ingredients: organic walnuts) raw, no shell (2.5 pounds)",Grocery & Gourmet Food > Snack Foods > Nuts & Seeds
101,408,"Sincerely Nuts Blanched Almond Flour Meal - Two (2) Lb. Bag - Full Of Protein, Fibers, Low In Carbohydrates - Kosher",Grocery & Gourmet Food > Snack Foods > Nuts & Seeds
102,408,food to live ® brazil nuts,Grocery & Gourmet Food > Snack Foods > Nuts & Seeds
103,408,"mrs. may's crunch, cashew, 2 ounce (pack of 12)",Grocery & Gourmet Food > Snack Foods > Nuts & Seeds
104,408,turkish apricot large 10 lb bulk bag,Grocery & Gourmet Food > Snack Foods > Nuts & Seeds
105,408,"planters deluxe whole cashews canister, lightly salted, 6.844 ounce",Grocery & Gourmet Food > Snack Foods > Nuts & Seeds
106,408,cos15 kirkland signature whole fancy unsalted cashews nuts premium quality - 2.5 lb ( 1.13 kg ),Grocery & Gourmet Food > Snack Foods > Nuts & Seeds
107,408,"Blue Diamond Almond Breeze, Unsweetened Vanilla, 32 Fl Oz Blue Diamond",Grocery & Gourmet Food > Snack Foods > Nuts & Seeds
108,408,jumbo raw whole hawaiian macadamia nuts (1 pound bag) - oh! nuts,Grocery & Gourmet Food > Snack Foods > Nuts & Seeds
109,408,emily's roasted & salted premium cashews 35oz,Grocery & Gourmet Food > Snack Foods > Nuts & Seeds
110,408,raw pistachios - shelled - ( 1 lb),Grocery & Gourmet Food > Snack Foods > Nuts & Seeds
111,408,Bitter Almonds Raw Organic (Kernels) 200g Bag (7oz),Grocery & Gourmet Food > Snack Foods > Nuts & Seeds
112,408,"Healthworks Chia Seeds Raw Organic, 1lb",Grocery & Gourmet Food > Snack Foods > Nuts & Seeds
113,408,"Food To Live Certified Organic Cashews W-240 (Whole, Raw) (1 Pound)",Grocery & Gourmet Food > Snack Foods > Nuts & Seeds
114,408,christmas mix sunbursts chocolate covered sunflower seeds 1lb bag,Grocery & Gourmet Food > Snack Foods > Nuts & Seeds
115,408,"food to live ® sunflower seeds (raw, no shell) (1 pound)",Grocery & Gourmet Food > Snack Foods > Nuts & Seeds
116,408,"french burnt peanuts, 5lbs",Grocery & Gourmet Food > Snack Foods > Nuts & Seeds
117,408,health warrior premium chia,Grocery & Gourmet Food > Snack Foods > Nuts & Seeds
118,408,wonderful almonds roasted & salted - 1.5 oz. - 24 ct.,Grocery & Gourmet Food > Snack Foods > Nuts & Seeds
119,408,the raw gourmet,Grocery & Gourmet Food > Snack Foods > Nuts & Seeds
120,408,walnut halves & pieces - 5 lb.,Grocery & Gourmet Food > Snack Foods > Nuts & Seeds
121,408,"mauna loa macadamias, maui onion and garlic, 4.5 ounce containers",Grocery & Gourmet Food > Snack Foods > Nuts & Seeds
122,408,"food to live certified organic brazil nuts (raw, no shell) (1 pound)",Grocery & Gourmet Food > Snack Foods > Nuts & Seeds
123,408,California Walnuts Halves & Pieces By Farm Fresh Nuts (4 LB),Grocery & Gourmet Food > Snack Foods > Nuts & Seeds
124,408,Dry Roasted Whole Hemp Seeds - UNSALTED - by GERBS - 2LB. Deal. Certified Top 10 Allergen Free - NON-GMO- Vegan & Kosher - Country of Origin CANADA - Made in Rhode Island,Grocery & Gourmet Food > Snack Foods > Nuts & Seeds
125,408,"sincerely nuts organic sunflower seeds hulled (raw, no shell) 2 lb",Grocery & Gourmet Food > Snack Foods > Nuts & Seeds
126,408,"margaret holmes, green boiled peanuts, 13.5oz cans (pack of 6)",Grocery & Gourmet Food > Snack Foods > Nuts & Seeds
127,408,"food to live ® organic pepitas / pumpkin seeds (raw, no shell) (1 pound)",Grocery & Gourmet Food > Snack Foods > Nuts & Seeds
128,408,David Sunflower Seeds 9 Pack Variety (5.25 oz each) Includes Bonus Magnet,Grocery & Gourmet Food > Snack Foods > Nuts & Seeds
129,408,setton farms pistachio chewy bites - premium 16 pack,Grocery & Gourmet Food > Snack Foods > Nuts & Seeds
130,408,Sincerely Nuts Pistachios Roasted & Salted in Shell - Five (5) Lb. Bag - Heavenly Taste - Sealed For Freshness - Bursting with Healthy Nutrients - Kosher!,Grocery & Gourmet Food > Snack Foods > Nuts & Seeds
131,408,Whole Terra Jumbo Golden California Raisins (2 Pounds),Grocery & Gourmet Food > Snack Foods > Nuts & Seeds
132,408,"turkish pistachios antep roasted salted , in shell - we got nuts (1 lb.)",Grocery & Gourmet Food > Snack Foods > Nuts & Seeds
133,408,"wonderfully raw brussel bytes chili pumpkin seed, 2 oz (pack of 6)",Grocery & Gourmet Food > Snack Foods > Nuts & Seeds
134,408,"wonderful pistachios, roasted and salted, 32-ounce bag quantity: 2",Grocery & Gourmet Food > Snack Foods > Nuts & Seeds
135,408,"healthworks pesticide and chemical free chia seeds, 16 ounce",Grocery & Gourmet Food > Snack Foods > Nuts & Seeds
136,408,"food to live sunflower seeds (ingredients: organic sunflower kernels) (raw, no shell) (1 pound)",Grocery & Gourmet Food > Snack Foods > Nuts & Seeds
137,408,"planters honey roasted cashews, 1.5-oz. pouches (count of 18)",Grocery & Gourmet Food > Snack Foods > Nuts & Seeds
138,408,"braga organic farms sunflower seeds , raw, 2 pound quantity: 4",Grocery & Gourmet Food > Snack Foods > Nuts & Seeds
139,408,"planters nutrition wholesome nut mix pack, 7.5 ounce",Grocery & Gourmet Food > Snack Foods > Nuts & Seeds
140,408,Fiddyment Farms 5 LB. In-Shell Lightly Salted,Grocery & Gourmet Food > Snack Foods > Nuts & Seeds
141,408,"food to live ® hazelnuts / filberts (raw, no shell) (2 pounds)",Grocery & Gourmet Food > Snack Foods > Nuts & Seeds
142,408,Spanish Peanuts - Roasted & Salted - 5 lb.,Grocery & Gourmet Food > Snack Foods > Nuts & Seeds
143,408,kirkland dry roasted,Grocery & Gourmet Food > Snack Foods > Nuts & Seeds
144,408,raw whole macadamia nuts - we got nuts (5 lbs.),Grocery & Gourmet Food > Snack Foods > Nuts & Seeds
145,408,"Anthony's USDA Organic Chia Seeds Bulk (2.5lb, 40oz.) Certified Gluten-Free",Grocery & Gourmet Food > Snack Foods > Nuts & Seeds
146,408,now foods raw organic cashews,Grocery & Gourmet Food > Snack Foods > Nuts & Seeds
147,408,"healthworks hemp seeds shelled raw organic, 2lb",Grocery & Gourmet Food > Snack Foods > Nuts & Seeds
148,408,"wonderful almond roasted and salted, 24 count",Grocery & Gourmet Food > Snack Foods > Nuts & Seeds
149,408,chuckanut products 10005,Grocery & Gourmet Food > Snack Foods > Nuts & Seeds
150,408,"trader joes pistachio, dry roasted - salted, shelled halves & pieces 2 x 8oz",Grocery & Gourmet Food > Snack Foods > Nuts & Seeds
151,408,Lightly Sea Salted Roasted Pumpkin Seeds In Shell by Gerbs - 2 LB Deal - Top 10 Food Allergen Free & NON GMO - Vegan & Kosher - Seed Country of Origin USA - Premium Domestic Whole Pepitas ...,Grocery & Gourmet Food > Snack Foods > Nuts & Seeds
152,408,"nutiva organic shelled hemp seed, 12-oz. pouches (count of 2)",Grocery & Gourmet Food > Snack Foods > Nuts & Seeds
153,408,"salba chia whole seeds, 12.7 ounce bag",Grocery & Gourmet Food > Snack Foods > Nuts & Seeds
154,408,"Terrasoul Superfoods Raw Criollo Cacao Beans (Organic), 16-ounce",Grocery & Gourmet Food > Snack Foods > Nuts & Seeds
155,408,"healthworks certified organic chia seeds, 2 pound",Grocery & Gourmet Food > Snack Foods > Nuts & Seeds
156,408,birdscapes 736 upside down goldfinch feeder,Grocery & Gourmet Food > Snack Foods > Nuts & Seeds
157,408,1 lb garlic onion in-shell pistachios,Grocery & Gourmet Food > Snack Foods > Nuts & Seeds
158,408,"Sahale Snacks Glazed Nuts Almonds with Cranberries Pouches, Honey Plus Sea Salt, 4 Ounce",Grocery & Gourmet Food > Snack Foods > Nuts & Seeds
159,408,healthworks pesticide and chemical free chia seeds 6 pounds,Grocery & Gourmet Food > Snack Foods > Nuts & Seeds
160,408,"Super 5 Seed Granola (Pumpkin, Sunflower, Chia, Hemp, Flax) – 2 LBS - Top 11",Grocery & Gourmet Food > Snack Foods > Nuts & Seeds
161,408,"planters chipotle peanuts, 6-ounce packages (pack of 6)",Grocery & Gourmet Food > Snack Foods > Nuts & Seeds
162,408,"deluxe mixed nuts roasted salted, 2 lbs",Grocery & Gourmet Food > Snack Foods > Nuts & Seeds
163,408,"diamond 04231 chopped walnuts, 8 oz bag",Grocery & Gourmet Food > Snack Foods > Nuts & Seeds
164,408,"Wonderful Pistachios, Sweet Chili, 7 Ounce Wonderful Pistachios",Grocery & Gourmet Food > Snack Foods > Nuts & Seeds
165,408,sahale snacks california,Grocery & Gourmet Food > Snack Foods > Nuts & Seeds
166,408,"wonderful pistachios, roasted and salted, 32-ounce bag",Grocery & Gourmet Food > Snack Foods > Nuts & Seeds
167,408,"manitoba harvest hemp heart bites, 4 ounce",Grocery & Gourmet Food > Snack Foods > Nuts & Seeds
168,408,"hawaiian host macadamia nuts - rich dark chocolate , large 11 oz (resealable bag)",Grocery & Gourmet Food > Snack Foods > Nuts & Seeds
169,408,Anna and Sarah Organics Whole Organic Raw Pecan Halves 12 Oz,Grocery & Gourmet Food > Snack Foods > Nuts & Seeds
170,408,dry roasted sunflower seed kernels with sea salt - by gerbs - 2lb. deal. non-gmo - certified top 10 allergen free. country of origin usa,Grocery & Gourmet Food > Snack Foods > Nuts & Seeds
171,408,"planters peanuts, dry-roasted, honey roasted, 16-ounce jars (pack of 4)",Grocery & Gourmet Food > Snack Foods > Nuts & Seeds
172,408,hawaiian value pack big wave organic raw unsalted maui grown macadamia nuts 4 bags,Grocery & Gourmet Food > Snack Foods > Nuts & Seeds
173,408,trader joe's sea salt & turbinado sugar dark chocolate almonds (pack of 2),Grocery & Gourmet Food > Snack Foods > Nuts & Seeds
174,408,"planters peanuts, honey roasted, 6-ounce (pack of 12)",Grocery & Gourmet Food > Snack Foods > Nuts & Seeds
175,408,"Blue Diamond Almonds BOLD Variety Pack of 4 x 6oz Cans Lime 'n Chili, Habanero BBQ, Jalapeno Smokehouse, Wasabi",Grocery & Gourmet Food > Snack Foods > Nuts & Seeds
176,408,"planters recipe ready walnuts, 10 oz",Grocery & Gourmet Food > Snack Foods > Nuts & Seeds
177,408,"Planters Deluxe Whole Honey Roasted Cashews, 8.25 oz",Grocery & Gourmet Food > Snack Foods > Nuts & Seeds
178,408,whole raw cashews 1lb - sincerely nuts,Grocery & Gourmet Food > Snack Foods > Nuts & Seeds
179,408,Navy Blue Jordan Almonds 2 Pound Bag - Oh! Nuts,Grocery & Gourmet Food > Snack Foods > Nuts & Seeds
180,408,"Food To Live Organic Cashews (Whole, Raw) (8 Pounds)",Grocery & Gourmet Food > Snack Foods > Nuts & Seeds
181,408,david sunflower seeds jumbo sweet & salty - bag 5.25 oz each (12 in a pack),Grocery & Gourmet Food > Snack Foods > Nuts & Seeds
182,408,white jordan almonds 5lb bag,Grocery & Gourmet Food > Snack Foods > Nuts & Seeds
183,408,"bulk nuts, walnuts, conv hvs/pcs, raw, 5 lbs",Grocery & Gourmet Food > Snack Foods > Nuts & Seeds
184,408,"food to live ® walnuts (raw, no shell) (5 pounds)",Grocery & Gourmet Food > Snack Foods > Nuts & Seeds
185,408,sincerely nuts whole macadamia nuts raw 3 lb,Grocery & Gourmet Food > Snack Foods > Nuts & Seeds
186,408,"healthworks certified organic goji berries, 32 ounce",Grocery & Gourmet Food > Snack Foods > Nuts & Seeds
187,408,japanese peanuts (4 pound bag),Grocery & Gourmet Food > Snack Foods > Nuts & Seeds
188,408,"blue diamond almonds bold, salt & vinegar, 1.5-ounce bags (pack of 24)",Grocery & Gourmet Food > Snack Foods > Nuts & Seeds
189,408,food to live ï¿½ pine nuts,Grocery & Gourmet Food > Snack Foods > Nuts & Seeds
190,408,"food to live certified organic cashews (whole, raw) (2 lbs)",Grocery & Gourmet Food > Snack Foods > Nuts & Seeds
191,408,2lbs of pine nuts!!!,Grocery & Gourmet Food > Snack Foods > Nuts & Seeds
192,408,watermelon slicer [bonus,Grocery & Gourmet Food > Snack Foods > Nuts & Seeds
193,408,"Now Foods Organic Brazil Nuts, 10 Ounce (Pack of 2)",Grocery & Gourmet Food > Snack Foods > Nuts & Seeds
194,408,Sincerely Nuts Sunflower Seeds Roasted & Unsalted (No Shell) 2 Lb,Grocery & Gourmet Food > Snack Foods > Nuts & Seeds
195,408,"roasted, salted, and blanched extra large virginia peanuts 10 pound bulk bag",Grocery & Gourmet Food > Snack Foods > Nuts & Seeds
196,408,healthworks chia seeds 1 pound,Grocery & Gourmet Food > Snack Foods > Nuts & Seeds
197,408,white jordan almonds 1 pound bag - oh! nuts,Grocery & Gourmet Food > Snack Foods > Nuts & Seeds
198,408,"planters roasted honey peanuts, 34.5-ounce packages (pack of 2)",Grocery & Gourmet Food > Snack Foods > Nuts & Seeds
199,408,david sunflower seed bucket - 1.75 oz. pk. - 60 ct.,Grocery & Gourmet Food > Snack Foods > Nuts & Seeds
200,408,brazil nuts - 5 pounds - we got nuts,Grocery & Gourmet Food > Snack Foods > Nuts & Seeds
201,408,"food to live ® almonds (whole, raw, shelled, unsalted) (1 pound)",Grocery & Gourmet Food > Snack Foods > Nuts & Seeds
202,408,"maisie jane's bagged dry roasted almonds, 16-ounce (pack of 3)",Grocery & Gourmet Food > Snack Foods > Nuts & Seeds
203,408,Kee Wah Bakery Yolk Custard Mooncake Box (8pc) () ...,Grocery & Gourmet Food > Snack Foods > Nuts & Seeds
204,408,"planters sweet n' crunchy peanuts, 10-ounce canisters (pack of 6)",Grocery & Gourmet Food > Snack Foods > Nuts & Seeds
205,408,flavored sunflower,Grocery & Gourmet Food > Snack Foods > Nuts & Seeds
206,408,"The Peanut Shop of Williamsburg Salt Free Handcooked Virginia Peanuts, 32 Ounce",Grocery & Gourmet Food > Snack Foods > Nuts & Seeds
207,408,"sahale snacks cashews with pomegranate plus vanilla, 18 count",Grocery & Gourmet Food > Snack Foods > Nuts & Seeds
208,408,"food to live ® pecans (raw, no shell) (6 pounds)",Grocery & Gourmet Food > Snack Foods > Nuts & Seeds
209,408,David Original Sunflower Seeds [24CT Box],Grocery & Gourmet Food > Snack Foods > Nuts & Seeds
210,408,kirkland dry roasted macadamia nuts with sea salt 680g (1.5 lb),Grocery & Gourmet Food > Snack Foods > Nuts & Seeds
211,408,"Kiva Raw Organic Chia Seeds - High Quality, Non GMO, (1 Pound Bag)",Grocery & Gourmet Food > Snack Foods > Nuts & Seeds
212,408,sheng kee 12 small moon cake (3 flavors combo),Grocery & Gourmet Food > Snack Foods > Nuts & Seeds
213,408,"food to live sunflower seeds (ingredients: organic sunflower kernels) (raw, no shell) (4 pounds)",Grocery & Gourmet Food > Snack Foods > Nuts & Seeds
214,408,"planters cocktail peanuts, unsalted, 12 ounce cans, (pack of 4)",Grocery & Gourmet Food > Snack Foods > Nuts & Seeds
215,408,"david sunflower seeds 36-bags nacho,0.8oz.",Grocery & Gourmet Food > Snack Foods > Nuts & Seeds
216,408,"planters nutrition cashews, almonds, & macadanias 9.75 oz",Grocery & Gourmet Food > Snack Foods > Nuts & Seeds
217,408,"Blue Diamond Almonds, Oven Roasted Dark Chocolate, 14 oz",Grocery & Gourmet Food > Snack Foods > Nuts & Seeds
