,category_id,description,category_path
5865,408,shoprite walnuts - jumbo - 16.00 oz,Grocery & Gourmet Food > Snack Foods > Nuts & Seeds
5866,408,shoprite honey roasted peanuts - 12.00 oz,Grocery & Gourmet Food > Snack Foods > Nuts & Seeds
5867,408,live better epsom salt - 64.00 oz,Grocery & Gourmet Food > Snack Foods > Nuts & Seeds
5868,408,"sunflower seeds, original, 1.875 oz (53.1 g)",Grocery & Gourmet Food > Snack Foods > Nuts & Seeds
5869,408,"now foods, real food, certified organic raw walnuts, unsalted, 12 oz (340 g)",Grocery & Gourmet Food > Snack Foods > Nuts & Seeds
5870,408,"now foods, healthy foods, coconut, 10 oz (283 g)",Grocery & Gourmet Food > Snack Foods > Nuts & Seeds
5871,408,"bergin fruit and nut company, whole raw cashews, 16 oz",Grocery & Gourmet Food > Snack Foods > Nuts & Seeds
5872,408,"nutiva, organic milled chia seed, 12 oz (340 g)",Grocery & Gourmet Food > Snack Foods > Nuts & Seeds
5873,408,"now foods, organic brazil nuts, unsalted, 10 oz (284 g)",Grocery & Gourmet Food > Snack Foods > Nuts & Seeds
5874,408,"blue diamond oven roasted almonds, dark chocolate - 5 oz",Grocery & Gourmet Food > Snack Foods > Nuts & Seeds
5875,408,"macfarms dry roasted macadamia nuts with sea salt, fresh from hawaii 24 oz",Grocery & Gourmet Food > Snack Foods > Nuts & Seeds
5876,408,kevala raw chia seeds 2lbs,Grocery & Gourmet Food > Snack Foods > Nuts & Seeds
5877,408,pine nuts (pignolias) 2 lb bulk bag,Grocery & Gourmet Food > Snack Foods > Nuts & Seeds
5878,408,"food to live certified organic almonds (raw, no shell, unpasteurized) (8 ounces)",Grocery & Gourmet Food > Snack Foods > Nuts & Seeds
5879,408,david sunflower seeds original 30 cents 36ct/.9-oz bags,Grocery & Gourmet Food > Snack Foods > Nuts & Seeds
5880,408,"emerald original glazed walnuts, 7-ounce pouches (pack of 6)",Grocery & Gourmet Food > Snack Foods > Nuts & Seeds
5881,408,"planters variety pack of new flavored peanuts: smoked peanuts, salted caramel peanuts, cocoa peanuts, and chipotle peanuts. 6oz each.",Grocery & Gourmet Food > Snack Foods > Nuts & Seeds
5882,408,Tokyo Banana Cake Original (8 banana),Grocery & Gourmet Food > Snack Foods > Nuts & Seeds
5883,408,navitas naturals organic,Grocery & Gourmet Food > Snack Foods > Nuts & Seeds
5884,408,planters nut 24,Grocery & Gourmet Food > Snack Foods > Nuts & Seeds
5885,408,"bergin nut company organic soynuts roasted and salted, 9-ounce bags (pack of 6)",Grocery & Gourmet Food > Snack Foods > Nuts & Seeds
5886,408,trader joe's honey roasted sliced almonds - 2 pack,Grocery & Gourmet Food > Snack Foods > Nuts & Seeds
5887,408,"the good bean sea salt flavor, 2.5 ounce (pack of 12)",Grocery & Gourmet Food > Snack Foods > Nuts & Seeds
5888,408,"food to live pepitas / pumpkin seeds (ingredients: organic pumpkin kernels) raw, no shell (2 pounds)",Grocery & Gourmet Food > Snack Foods > Nuts & Seeds
5889,408,brazil nuts ( 1 lb),Grocery & Gourmet Food > Snack Foods > Nuts & Seeds
5890,408,Blue Diamond Almonds Pumpkin Spice 6oz Qty: 1,Grocery & Gourmet Food > Snack Foods > Nuts & Seeds
5891,408,"nutiva organic chia seed, black, 6 ounce",Grocery & Gourmet Food > Snack Foods > Nuts & Seeds
5892,408,"We Got Nuts Jumbo Almonds (Whole, Raw, Shelled, Unsalted) (2 Pounds)",Grocery & Gourmet Food > Snack Foods > Nuts & Seeds
5893,408,"planters pistachio blend, pistachios, peanuts, almonds, cashews - 10 oz",Grocery & Gourmet Food > Snack Foods > Nuts & Seeds
5894,408,spectrum essentials chia seed omega-3 & fiber - 12 oz,Grocery & Gourmet Food > Snack Foods > Nuts & Seeds
5895,408,"david pumpkin seeds, 5 oz",Grocery & Gourmet Food > Snack Foods > Nuts & Seeds
5896,408,"eden foods dry roasted pumpkin seeds, original - 4 oz",Grocery & Gourmet Food > Snack Foods > Nuts & Seeds
5897,408,"blue diamond almonds, blueberry - 4 oz",Grocery & Gourmet Food > Snack Foods > Nuts & Seeds
5898,408,now foods organic chia seeds - 12 oz,Grocery & Gourmet Food > Snack Foods > Nuts & Seeds
5899,408,"good & delish colossal cashews, roasted - 9 oz",Grocery & Gourmet Food > Snack Foods > Nuts & Seeds
5900,408,"blue diamond bold almonds, habanero bbq, 1.5 oz tubes - 12 ea",Grocery & Gourmet Food > Snack Foods > Nuts & Seeds
5901,408,market pantry chopped pecans 8 oz,Grocery & Gourmet Food > Snack Foods > Nuts & Seeds
5902,408,archer farms ™ raw mixed nuts pack of 10,Grocery & Gourmet Food > Snack Foods > Nuts & Seeds
5903,408,planters honey dry roasted peanuts 16 oz,Grocery & Gourmet Food > Snack Foods > Nuts & Seeds
5904,408,wonderful natural raw almonds 7oz,Grocery & Gourmet Food > Snack Foods > Nuts & Seeds
5905,408,blue diamond almonds whole natural 12 oz,Grocery & Gourmet Food > Snack Foods > Nuts & Seeds
5906,408,market pantry cashews 8.5 oz,Grocery & Gourmet Food > Snack Foods > Nuts & Seeds
5907,408,"blue diamond smokehouse almonds, 6 oz",Grocery & Gourmet Food > Snack Foods > Nuts & Seeds
5908,408,raw jumbo cashews 9.5oz - archer farms™,Grocery & Gourmet Food > Snack Foods > Nuts & Seeds
5909,408,dark chocolate almonds 13 oz - archer farms™,Grocery & Gourmet Food > Snack Foods > Nuts & Seeds
5910,408,sunfood superfoods raw organic chia seeds - 16 oz,Grocery & Gourmet Food > Snack Foods > Nuts & Seeds
5911,408,"david roasted & salted pumpkin seeds, 5 oz",Grocery & Gourmet Food > Snack Foods > Nuts & Seeds
5912,408,"betterbody foods organic chia seeds, 32 oz",Grocery & Gourmet Food > Snack Foods > Nuts & Seeds
5913,408,diamond of california nut toppings glazed pecans 55 oz,Grocery & Gourmet Food > Snack Foods > Nuts & Seeds
5914,408,wild harvest cockatiel diet 4lb,Grocery & Gourmet Food > Snack Foods > Nuts & Seeds
5915,408,wonderful lightly salted pistachios 16 oz. bag,Grocery & Gourmet Food > Snack Foods > Nuts & Seeds
5916,408,"planters nut-rition honey nut sustaining energy mix, 1.66 oz, 5 count",Grocery & Gourmet Food > Snack Foods > Nuts & Seeds
5917,408,"planters nut-rition men's health recommended nut mix, 1.25 oz, 6 ct",Grocery & Gourmet Food > Snack Foods > Nuts & Seeds
5918,408,"great value unsalted deluxe cashews, 16 oz",Grocery & Gourmet Food > Snack Foods > Nuts & Seeds
5919,408,"great value roasted & salted almonds, 12 oz",Grocery & Gourmet Food > Snack Foods > Nuts & Seeds
5920,408,great value mixed nuts 1475 oz,Grocery & Gourmet Food > Snack Foods > Nuts & Seeds
5921,408,"david roasted & salted original all natural sunflower seeds, 1.625 oz, 12 count",Grocery & Gourmet Food > Snack Foods > Nuts & Seeds
5922,408,"great value deluxe mixed nuts, 16 oz",Grocery & Gourmet Food > Snack Foods > Nuts & Seeds
5923,408,"emerald dry roasted almonds, 9.5 oz",Grocery & Gourmet Food > Snack Foods > Nuts & Seeds
5924,408,"dakota style jumbo sunflower seeds, 16 oz",Grocery & Gourmet Food > Snack Foods > Nuts & Seeds
5925,408,emerald roasted salted cashew halves pieces 100 calorie packs 7 count,Grocery & Gourmet Food > Snack Foods > Nuts & Seeds
5926,408,almonds roasted salted blue diamond 16.0 oz.,Grocery & Gourmet Food > Snack Foods > Nuts & Seeds
5927,408,oven roasted almonds sea salt blue diamond natural 14.0 oz.,Grocery & Gourmet Food > Snack Foods > Nuts & Seeds
5928,408,nice! cashew halves & pieces unsalted 8.0 oz.,Grocery & Gourmet Food > Snack Foods > Nuts & Seeds
5929,408,pecans halves & pieces nice! 6.0 oz.,Grocery & Gourmet Food > Snack Foods > Nuts & Seeds
5930,408,a-d germack (3)16oz jars winter wonderland mix auto-delivery,Grocery & Gourmet Food > Snack Foods > Nuts & Seeds
5931,408,"planters peanuts, salted, 1 oz, 48 ct",Grocery & Gourmet Food > Snack Foods > Nuts & Seeds
5932,408,almond 32-pk,Grocery & Gourmet Food > Snack Foods > Nuts & Seeds
5933,408,"blue diamond almonds, wasabi, 1.5 oz, 12 ct",Grocery & Gourmet Food > Snack Foods > Nuts & Seeds
5934,408,kirkland signature™ mixed nuts 1-pack,Grocery & Gourmet Food > Snack Foods > Nuts & Seeds
5935,408,"blue diamond smokehouse almonds, 12/1.5 oz",Grocery & Gourmet Food > Snack Foods > Nuts & Seeds
5936,408,wonderful roasted salted pistachios 15 oz 12 packsbox,Grocery & Gourmet Food > Snack Foods > Nuts & Seeds
5937,408,glass hummingbird feeder,Grocery & Gourmet Food > Snack Foods > Nuts & Seeds
5938,408,Praline Pecan Choc Chp Blndi Mix,Grocery & Gourmet Food > Snack Foods > Nuts & Seeds
5939,408,spiced pumpkin seed brittle,Grocery & Gourmet Food > Snack Foods > Nuts & Seeds
5940,408,sprouting seeds s/3,Grocery & Gourmet Food > Snack Foods > Nuts & Seeds
5941,408,"back to nature nuts - unroasted, unsalted california almonds - 10 oz",Grocery & Gourmet Food > Snack Foods > Nuts & Seeds
5942,408,"emerald cocoa roast almonds, 100 calorie pack, 4.41 oz, 3 pk",Grocery & Gourmet Food > Snack Foods > Nuts & Seeds
5943,408,"back to nature nuts - sea salt, roasted cashew, almond & pistachio mix - 10 oz",Grocery & Gourmet Food > Snack Foods > Nuts & Seeds
5944,408,eden foods organic pumpkin seeds dry roasted spicy -- 4 oz,Grocery & Gourmet Food > Snack Foods > Nuts & Seeds
5945,408,navitas naturals organic chia seeds -- 4 oz,Grocery & Gourmet Food > Snack Foods > Nuts & Seeds
5946,408,"diamond diamond almonds, slivered, 6 ounce bags",Grocery & Gourmet Food > Snack Foods > Nuts & Seeds
5947,408,"blue diamond blue diamond almonds, bold wasabi & soy sauce 6 oz",Grocery & Gourmet Food > Snack Foods > Nuts & Seeds
5948,408,"eden foods eden foods spicy pumpkin dry roasted seeds, 4 oz",Grocery & Gourmet Food > Snack Foods > Nuts & Seeds
5949,408,"planters planters nut cashew halves & pieces, 14 ounce",Grocery & Gourmet Food > Snack Foods > Nuts & Seeds
5950,408,food to live food to live ® organic goji berries (1.5 pounds),Grocery & Gourmet Food > Snack Foods > Nuts & Seeds
5951,408,"kirkland signature kirkland signature macadamia nuts, 1.5 lb",Grocery & Gourmet Food > Snack Foods > Nuts & Seeds
5952,408,"emerald 100 calorie pack all natural almonds, .62 oz packs (inner...",Grocery & Gourmet Food > Snack Foods > Nuts & Seeds
5953,408,"blue diamond blue diamond almonds, smokehouse, 16 oz",Grocery & Gourmet Food > Snack Foods > Nuts & Seeds
5954,408,"blue diamond blue diamond almonds, honey nutthins honey mustard, 4.25 oz",Grocery & Gourmet Food > Snack Foods > Nuts & Seeds
5955,408,"nutiva nutiva organic chia seeds, 12 ounce bag",Grocery & Gourmet Food > Snack Foods > Nuts & Seeds
5956,408,"now foods now foods organic cashews, raw 10 ounce",Grocery & Gourmet Food > Snack Foods > Nuts & Seeds
5957,408,kirkland signature ks org tom paste 12/6oz,Grocery & Gourmet Food > Snack Foods > Nuts & Seeds
5958,408,organic black chia seeds,Grocery & Gourmet Food > Snack Foods > Nuts & Seeds
5959,408,"now® real food - organic pumpkin seeds, raw, unsalted - 12 oz (340 grams)",Grocery & Gourmet Food > Snack Foods > Nuts & Seeds
5960,408,blue diamond roasted salted almonds,Grocery & Gourmet Food > Snack Foods > Nuts & Seeds
5961,408,"wonderful sweet chili pistachios, 7 oz",Grocery & Gourmet Food > Snack Foods > Nuts & Seeds
5962,408,"great value garlic pistachios, 13 oz",Grocery & Gourmet Food > Snack Foods > Nuts & Seeds
5963,408,"great value rocky road trail mix, 23 oz",Grocery & Gourmet Food > Snack Foods > Nuts & Seeds
5964,408,"great value cashew halves ; pieces, 24 oz",Grocery & Gourmet Food > Snack Foods > Nuts & Seeds
5965,408,"fisher chefs naturals chopped pecans, 2 oz",Grocery & Gourmet Food > Snack Foods > Nuts & Seeds
5966,408,"hines orchard fresh roasted & salted peanuts, 10 oz",Grocery & Gourmet Food > Snack Foods > Nuts & Seeds
5967,408,"blue diamond almonds, roasted salted, value pack - 16 oz (1 lb) 454 g",Grocery & Gourmet Food > Snack Foods > Nuts & Seeds
5968,408,blue diamond lightly salted almonds - 16 oz pouch,Grocery & Gourmet Food > Snack Foods > Nuts & Seeds
5969,408,"sahale snacks sing buri cashews, 5 oz",Grocery & Gourmet Food > Snack Foods > Nuts & Seeds
5970,408,bob's red mill premium quality xanthan gum - 8 oz bag,Grocery & Gourmet Food > Snack Foods > Nuts & Seeds
5971,408,david roasted & salted pumpkin seeds 2.25 oz,Grocery & Gourmet Food > Snack Foods > Nuts & Seeds
5972,408,kind maple quinoa clusters with chia seeds - 11 oz pouch,Grocery & Gourmet Food > Snack Foods > Nuts & Seeds
5973,408,betterbody organic pbfit powder 30...,Grocery & Gourmet Food > Snack Foods > Nuts & Seeds
5974,408,"kirkland signature cashew cluster,...",Grocery & Gourmet Food > Snack Foods > Nuts & Seeds
5975,408,fairway mixed nuts- salted and roasted,Grocery & Gourmet Food > Snack Foods > Nuts & Seeds
5976,408,blue diamond natural almonds - 16 oz,Grocery & Gourmet Food > Snack Foods > Nuts & Seeds
5977,408,"blue diamond bold almonds, wasabi ...",Grocery & Gourmet Food > Snack Foods > Nuts & Seeds
5978,408,"blue diamond almonds, lightly salted - 7 pack, 0.6 oz bags",Grocery & Gourmet Food > Snack Foods > Nuts & Seeds
5979,408,"blue diamond almond sea salt nut-thin, 2/10 oz bags",Grocery & Gourmet Food > Snack Foods > Nuts & Seeds
5980,408,organic natures garden omega-3 deluxe nut mix 24 ounces,Grocery & Gourmet Food > Snack Foods > Nuts & Seeds
5981,408,"wonderful pistachios, roasted & sa...",Grocery & Gourmet Food > Snack Foods > Nuts & Seeds
5982,408,"setton farms shelled pistachios, 24 oz",Grocery & Gourmet Food > Snack Foods > Nuts & Seeds
5983,408,"wonderful almonds, mini, roasted, no salt - 10 oz",Grocery & Gourmet Food > Snack Foods > Nuts & Seeds
5984,408,"good sense sunflower nuts, honey roasted - 12 oz bag",Grocery & Gourmet Food > Snack Foods > Nuts & Seeds
5985,408,good & delish colossal cashews roasted,Grocery & Gourmet Food > Snack Foods > Nuts & Seeds
5986,408,raw almonds 11.5oz - archer farms,Grocery & Gourmet Food > Snack Foods > Nuts & Seeds
5987,408,"kirkland signature variety snacking nut, 30 x 1.6 oz",Grocery & Gourmet Food > Snack Foods > Nuts & Seeds
5988,408,"raley's almonds, whole - 6 oz bag",Grocery & Gourmet Food > Snack Foods > Nuts & Seeds
5989,408,"blue diamond natural almonds, oven roasted, dark chocolate flavor - 8 oz",Grocery & Gourmet Food > Snack Foods > Nuts & Seeds
5990,408,planters halves & pieces cashews - 8 oz canister,Grocery & Gourmet Food > Snack Foods > Nuts & Seeds
5991,408,diamond of california shelled walnuts - 1 lb bag,Grocery & Gourmet Food > Snack Foods > Nuts & Seeds
5992,408,kirkland signature variety snackin...,Grocery & Gourmet Food > Snack Foods > Nuts & Seeds
5993,408,nice! cashews halves & pieces roasted with light salt,Grocery & Gourmet Food > Snack Foods > Nuts & Seeds
5994,408,"nutiva organic chia seed, 12 oz. seeds",Grocery & Gourmet Food > Snack Foods > Nuts & Seeds
5995,408,"365 organic cashews, dry roasted & unsalted - 12 oz",Grocery & Gourmet Food > Snack Foods > Nuts & Seeds
5996,408,kind raspberry clusters with chia seeds healthy grains - 11 oz,Grocery & Gourmet Food > Snack Foods > Nuts & Seeds
5997,408,diamond nuts whole almonds - 6 oz bag,Grocery & Gourmet Food > Snack Foods > Nuts & Seeds
5998,408,"wonderful pistachios, roasted & salted - 5 oz bag",Grocery & Gourmet Food > Snack Foods > Nuts & Seeds
5999,408,blue diamond almonds roasted salte...,Grocery & Gourmet Food > Snack Foods > Nuts & Seeds
6000,408,eden foods spicy pumpkin seeds snack - 4 oz,Grocery & Gourmet Food > Snack Foods > Nuts & Seeds
6001,408,hampton farms healthy living unsalted almond butter 1.19 qty,Grocery & Gourmet Food > Snack Foods > Nuts & Seeds
6002,408,emerald salt & pepper cashews,Grocery & Gourmet Food > Snack Foods > Nuts & Seeds
6003,408,wonderful sweet chili pistachios,Grocery & Gourmet Food > Snack Foods > Nuts & Seeds
6004,408,roasted unsalted almonds 0.56 qty,Grocery & Gourmet Food > Snack Foods > Nuts & Seeds
6005,408,publix sliced almonds,Grocery & Gourmet Food > Snack Foods > Nuts & Seeds
6006,408,raw cashews from nuts near produce section.,Grocery & Gourmet Food > Snack Foods > Nuts & Seeds
6007,408,dry roasted sunflower kernels,Grocery & Gourmet Food > Snack Foods > Nuts & Seeds
6008,408,blue diamond oven roasted sea salt almonds,Grocery & Gourmet Food > Snack Foods > Nuts & Seeds
6009,408,emerald 100 calorie natural walnuts & almonds packs,Grocery & Gourmet Food > Snack Foods > Nuts & Seeds
6010,408,blue diamond smokehouse almond nut thins,Grocery & Gourmet Food > Snack Foods > Nuts & Seeds
6011,408,blue diamond honey roasted almonds,Grocery & Gourmet Food > Snack Foods > Nuts & Seeds
6012,408,mixed nuts with less than 50% peanuts,Grocery & Gourmet Food > Snack Foods > Nuts & Seeds
6013,408,"woodstock, organic whole blackberries, 10 ounce",Grocery & Gourmet Food > Snack Foods > Nuts & Seeds
6014,408,"bulk organic, large raw whole cashews, 0.5 lb",Grocery & Gourmet Food > Snack Foods > Nuts & Seeds
6015,408,"blue diamond, hint of sea salt nut thins, 4.25 ounce",Grocery & Gourmet Food > Snack Foods > Nuts & Seeds
6016,408,gourmet garage roasted mixed nuts with sea salt 9 ounce,Grocery & Gourmet Food > Snack Foods > Nuts & Seeds
6017,408,"organic pine nuts, 4 ounce",Grocery & Gourmet Food > Snack Foods > Nuts & Seeds
6018,408,"bulk foods, walnuts halves & pieces, 12 ounce",Grocery & Gourmet Food > Snack Foods > Nuts & Seeds
6019,408,"now foods, real food, certified organic, turbinado sugar, 2.5 lbs (1134 g)",Grocery & Gourmet Food > Snack Foods > Nuts & Seeds
6020,408,"earth circle organics, raw organic spirulina powder, 4 oz (113 g)",Grocery & Gourmet Food > Snack Foods > Nuts & Seeds
6021,408,"manitoba harvest, nautral raw shelled hemp seeds, 12 oz (340 g)",Grocery & Gourmet Food > Snack Foods > Nuts & Seeds
6022,408,boxed the nutbox 32-oz. natural roasted salted peanuts,Grocery & Gourmet Food > Snack Foods > Nuts & Seeds
6023,408,kirkland signature™ extra fancy unsalted whole fancy cashews 2 - 2.5 lb jar,Grocery & Gourmet Food > Snack Foods > Nuts & Seeds
6024,408,partners packing peanuts 1 each 7nutsw,Grocery & Gourmet Food > Snack Foods > Nuts & Seeds
6025,408,emerald 100 calorie pack dark chocolate cocoa roast almonds 63 oz packs 7 packsbox,Grocery & Gourmet Food > Snack Foods > Nuts & Seeds
6026,408,wonderfulreg roasted salted pistachios 125 oz 12bx,Grocery & Gourmet Food > Snack Foods > Nuts & Seeds
6027,408,red seed ball wild bird feeder,Grocery & Gourmet Food > Snack Foods > Nuts & Seeds
6028,408,mixed polished pebbles large - 40 lb. bag,Grocery & Gourmet Food > Snack Foods > Nuts & Seeds
6029,408,2.5-oz roasted salted peanuts,Grocery & Gourmet Food > Snack Foods > Nuts & Seeds
6030,408,Peanuts Gift Bag Wrapped 4oz,Grocery & Gourmet Food > Snack Foods > Nuts & Seeds
6031,408,kane raw 30,Grocery & Gourmet Food > Snack Foods > Nuts & Seeds
6032,408,unicorn poop soap,Grocery & Gourmet Food > Snack Foods > Nuts & Seeds
6033,408,royal hawaiian orchards macadamias sea salt -- 5 oz,Grocery & Gourmet Food > Snack Foods > Nuts & Seeds
6034,408,best of all brazil nuts unsalted -- 12 oz,Grocery & Gourmet Food > Snack Foods > Nuts & Seeds
6035,408,now foods real food organic sunflower seeds unsalted 16 oz,Grocery & Gourmet Food > Snack Foods > Nuts & Seeds
6036,408,bob's red mill natural raw pumpkin seeds -- 24 oz,Grocery & Gourmet Food > Snack Foods > Nuts & Seeds
6037,408,windy city organics sunbiotics organic probiotic raw chocolate bar ginger spice -- 1.25 oz,Grocery & Gourmet Food > Snack Foods > Nuts & Seeds
6038,408,natierra goji berries -- 16 oz,Grocery & Gourmet Food > Snack Foods > Nuts & Seeds
6039,408,shiloh farms organic dark chocolate covered almonds -- 8 oz,Grocery & Gourmet Food > Snack Foods > Nuts & Seeds
6040,408,royal hawaiian orchards macadamia nuts sea salt -- 5 oz,Grocery & Gourmet Food > Snack Foods > Nuts & Seeds
6041,408,vitacost organic dark chocolate covered almonds -- 7 oz (199 g),Grocery & Gourmet Food > Snack Foods > Nuts & Seeds
6042,408,nutiva organic chia seed black -- 6 oz,Grocery & Gourmet Food > Snack Foods > Nuts & Seeds
6043,408,go raw all organic sprouted seeds super simple -- 16 oz,Grocery & Gourmet Food > Snack Foods > Nuts & Seeds
6044,408,nutiva organic chia seed black -- 12 oz,Grocery & Gourmet Food > Snack Foods > Nuts & Seeds
6045,408,garden of life organic chia seed -- 12 oz,Grocery & Gourmet Food > Snack Foods > Nuts & Seeds
6046,408,living intentions sprouted nuts unsalted almonds -- 16 oz,Grocery & Gourmet Food > Snack Foods > Nuts & Seeds
6047,408,madi k's whole natural almonds nonpareil -- 5.5 oz,Grocery & Gourmet Food > Snack Foods > Nuts & Seeds
6048,408,best of all organic unsalted pre-shelled pumpkin seeds -- 12 oz,Grocery & Gourmet Food > Snack Foods > Nuts & Seeds
6049,408,now foods real food™ whole raw cashews unsalted -- 10 oz,Grocery & Gourmet Food > Snack Foods > Nuts & Seeds
6050,408,shiloh farms organic brazil nuts raw -- 11 oz,Grocery & Gourmet Food > Snack Foods > Nuts & Seeds
6051,408,woodstock farms raw almonds -- 8 oz,Grocery & Gourmet Food > Snack Foods > Nuts & Seeds
6052,408,now foods real food™ raw walnuts unsalted -- 12 oz,Grocery & Gourmet Food > Snack Foods > Nuts & Seeds
6053,408,woodstock organic sunflower seeds -- 12 oz,Grocery & Gourmet Food > Snack Foods > Nuts & Seeds
6054,408,nutiva organic shelled hempseed -- 3 lbs,Grocery & Gourmet Food > Snack Foods > Nuts & Seeds
6055,408,cvs gold emblem macadamia nuts dry roasted 6.5 oz 0.50 lbs,Grocery & Gourmet Food > Snack Foods > Nuts & Seeds
6056,408,blue diamond smokehouse almonds,Grocery & Gourmet Food > Snack Foods > Nuts & Seeds
6057,408,cvs gold emblem mixed nuts lightly salted 10.3 oz 0.79 lbs,Grocery & Gourmet Food > Snack Foods > Nuts & Seeds
6058,408,david original roasted & salted sunflower seeds 14.5 oz,Grocery & Gourmet Food > Snack Foods > Nuts & Seeds
6059,408,cvs gold emblem fancy whole cashews with sea salt 18.2 oz 1.42 lbs,Grocery & Gourmet Food > Snack Foods > Nuts & Seeds
6060,408,cvs gold emblem deluxe mixed nuts lightly salted 8.75 oz 0.41 lbs,Grocery & Gourmet Food > Snack Foods > Nuts & Seeds
6061,408,nutiva white chia seed,Grocery & Gourmet Food > Snack Foods > Nuts & Seeds
6062,408,"diamond chopped walnuts, 8 oz",Grocery & Gourmet Food > Snack Foods > Nuts & Seeds
6063,408,now foods roasted & salted cashews,Grocery & Gourmet Food > Snack Foods > Nuts & Seeds
6064,408,terrafina cashews - salted-9 oz,Grocery & Gourmet Food > Snack Foods > Nuts & Seeds
6065,408,"organic walnuts, halves & pieces 6 oz (170 grams) pkg",Grocery & Gourmet Food > Snack Foods > Nuts & Seeds
6066,408,raw pumpkin seeds - unsalted 16 oz (454 grams) pkg,Grocery & Gourmet Food > Snack Foods > Nuts & Seeds
6067,408,just freshdirect raw sunflower seeds - (16oz),Grocery & Gourmet Food > Snack Foods > Nuts & Seeds
6068,408,"just freshdirect dry-roasted, salted pistachios snack packs - (10ct, 2oz ea)",Grocery & Gourmet Food > Snack Foods > Nuts & Seeds
6069,408,just freshdirect raw cashews - (16oz),Grocery & Gourmet Food > Snack Foods > Nuts & Seeds
6070,408,"freshdirect roasted unsalted almonds, family-size tub - (32oz)",Grocery & Gourmet Food > Snack Foods > Nuts & Seeds
6071,408,"freshdirect roasted unsalted almonds, resealable bag - (resealable bag)",Grocery & Gourmet Food > Snack Foods > Nuts & Seeds
6072,408,just freshdirect dry-roasted salted pistachios - (10oz),Grocery & Gourmet Food > Snack Foods > Nuts & Seeds
6073,408,"freshdirect dry roasted, unsalted almonds snack packs - (10ct, 2oz ea)",Grocery & Gourmet Food > Snack Foods > Nuts & Seeds
6074,408,freshdirect raw walnut halves & pieces - (family tub),Grocery & Gourmet Food > Snack Foods > Nuts & Seeds
6075,408,just freshdirect roasted unsalted almonds - (7oz),Grocery & Gourmet Food > Snack Foods > Nuts & Seeds
6076,408,just freshdirect blanched almond slices (10oz),Grocery & Gourmet Food > Snack Foods > Nuts & Seeds
6077,408,"freshdirect roasted unsalted peanuts, resealable bag - (16oz)",Grocery & Gourmet Food > Snack Foods > Nuts & Seeds
6078,408,"freshdirect the queens combo mix snack packs - (10 pack, 2 oz ea)",Grocery & Gourmet Food > Snack Foods > Nuts & Seeds
6079,408,just freshdirect roasted salted mixed nuts - (7oz),Grocery & Gourmet Food > Snack Foods > Nuts & Seeds
6080,408,colossal shrimp cocktail platter - (30pc),Grocery & Gourmet Food > Snack Foods > Nuts & Seeds
6081,408,"freshdirect organic walnut halves & pieces - (5oz, container)",Grocery & Gourmet Food > Snack Foods > Nuts & Seeds
6082,408,daily chef whole almonds (3 lbs.),Grocery & Gourmet Food > Snack Foods > Nuts & Seeds
6083,408,"green giant antioxidant blend (7 oz. pks., 5 ct.)",Grocery & Gourmet Food > Snack Foods > Nuts & Seeds
6084,408,cranberries - 3 lbs,Grocery & Gourmet Food > Snack Foods > Nuts & Seeds
6085,408,"king's hawaiian twin pack original sweet rolls(32 oz., 32 ct.)",Grocery & Gourmet Food > Snack Foods > Nuts & Seeds
6086,408,sunset wild wonder tomato (2 lbs.),Grocery & Gourmet Food > Snack Foods > Nuts & Seeds
6087,408,daily chef pecan halves (2 lb.),Grocery & Gourmet Food > Snack Foods > Nuts & Seeds
6088,408,wonderful roasted and salted pistachios,Grocery & Gourmet Food > Snack Foods > Nuts & Seeds
6089,408,gourmet mixed nuts - 36 oz.,Grocery & Gourmet Food > Snack Foods > Nuts & Seeds
6090,408,fancy pecan halves,Grocery & Gourmet Food > Snack Foods > Nuts & Seeds
6091,408,whole almonds,Grocery & Gourmet Food > Snack Foods > Nuts & Seeds
6092,408,wonderful roasted almonds - 40 oz.,Grocery & Gourmet Food > Snack Foods > Nuts & Seeds
6093,408,roasted salted pepitas (pumpkin seeds),Grocery & Gourmet Food > Snack Foods > Nuts & Seeds
6094,408,sunflower seeds natural/raw shelled (8 oz bag),Grocery & Gourmet Food > Snack Foods > Nuts & Seeds
6095,408,peapod almonds roasted salted 9.5 oz tub,Grocery & Gourmet Food > Snack Foods > Nuts & Seeds
6096,408,good sense in shell roasted & salted pumpkin seeds - 4.5 oz,Grocery & Gourmet Food > Snack Foods > Nuts & Seeds
6097,408,planters salted caramel peanuts - 6 oz,Grocery & Gourmet Food > Snack Foods > Nuts & Seeds
6098,408,planters nut-rition wholesome nut mix - 9.75 oz,Grocery & Gourmet Food > Snack Foods > Nuts & Seeds
6099,408,orchard valley harvest halves & pieces walnut - 8 oz,Grocery & Gourmet Food > Snack Foods > Nuts & Seeds
6100,408,wonderful almond accents honey roasted with cranberries - 3.5 oz,Grocery & Gourmet Food > Snack Foods > Nuts & Seeds
