,category_id,description,category_path
4033,408,"wonderful salt & pepper pistachios, 7 oz",Grocery & Gourmet Food > Snack Foods > Nuts & Seeds
4034,408,"wonderful almonds roasted no salt almonds, 10 oz",Grocery & Gourmet Food > Snack Foods > Nuts & Seeds
4035,408,"pro2snax sweet gala apple with roasted & salted almonds, 2.4 oz",Grocery & Gourmet Food > Snack Foods > Nuts & Seeds
4036,408,"nature's harvest roasted & lightly salted sunflower kernels, 15 oz",Grocery & Gourmet Food > Snack Foods > Nuts & Seeds
4037,408,"munchies honey roasted peanuts, 1.375 oz",Grocery & Gourmet Food > Snack Foods > Nuts & Seeds
4038,408,"great value roasted and salted almonds, 16 oz",Grocery & Gourmet Food > Snack Foods > Nuts & Seeds
4039,408,"wonderful roasted & salted pistachios, 2.75 oz",Grocery & Gourmet Food > Snack Foods > Nuts & Seeds
4040,408,"blue diamond bold almonds, jalapeno smokehouse - 6 oz can",Grocery & Gourmet Food > Snack Foods > Nuts & Seeds
4041,408,david sunflower seeds - 60 ct,Grocery & Gourmet Food > Snack Foods > Nuts & Seeds
4042,408,"diamond of california nut toppings walnuts, glazed - 7.5 oz bag",Grocery & Gourmet Food > Snack Foods > Nuts & Seeds
4043,408,savanna orchards dry roast macadamias 1.5 pounds,Grocery & Gourmet Food > Snack Foods > Nuts & Seeds
4044,408,"spitz sunflower seeds, dill pickle flavored, big bag - 6 oz bag",Grocery & Gourmet Food > Snack Foods > Nuts & Seeds
4045,408,sahale snacks honey almonds 4 oz,Grocery & Gourmet Food > Snack Foods > Nuts & Seeds
4046,408,good & delish premium blend nut mix roasted,Grocery & Gourmet Food > Snack Foods > Nuts & Seeds
4047,408,"kirkland signature, organic nuts & berries 28 oz",Grocery & Gourmet Food > Snack Foods > Nuts & Seeds
4048,408,"blue diamond almonds, bold srirach...",Grocery & Gourmet Food > Snack Foods > Nuts & Seeds
4049,408,"hoody's organic cashews, unroasted...",Grocery & Gourmet Food > Snack Foods > Nuts & Seeds
4050,408,nice! whole natural almonds natural,Grocery & Gourmet Food > Snack Foods > Nuts & Seeds
4051,408,"navitas naturals kosher golden berries, organic - 8 oz bag",Grocery & Gourmet Food > Snack Foods > Nuts & Seeds
4052,408,"365 walnuts, halves & pieces - 16 oz pouch",Grocery & Gourmet Food > Snack Foods > Nuts & Seeds
4053,408,"blue diamond bold almonds, habaner...",Grocery & Gourmet Food > Snack Foods > Nuts & Seeds
4054,408,"wonderful pistachios, roasted & salted - 24 oz",Grocery & Gourmet Food > Snack Foods > Nuts & Seeds
4055,408,planters deluxe honey roasted whole cashews 8.25 oz,Grocery & Gourmet Food > Snack Foods > Nuts & Seeds
4056,408,nutiva organic chia seed - 12 oz bag,Grocery & Gourmet Food > Snack Foods > Nuts & Seeds
4057,408,Lightly Sea Salted Sunflower Seed Kernels by Gerbs - 2 LBS - Top 11 Food Allergen Free & Non GMO - Premium Dry Roasted Seeds - COG USA,Grocery & Gourmet Food > Snack Foods > Nuts & Seeds
4058,408,hawaiian favorites,Grocery & Gourmet Food > Snack Foods > Nuts & Seeds
4059,408,"food to live organic almonds (raw, no shell, unpasteurized) (4 lbs)",Grocery & Gourmet Food > Snack Foods > Nuts & Seeds
4060,408,planters mixed nuts,Grocery & Gourmet Food > Snack Foods > Nuts & Seeds
4061,408,"food to live ® pepitas / pumpkin seeds (raw, no shell) (2 pounds)",Grocery & Gourmet Food > Snack Foods > Nuts & Seeds
4062,408,"wonderful pistachios shelled pistachios, 6-ounce (pack of 5)",Grocery & Gourmet Food > Snack Foods > Nuts & Seeds
4063,408,"dried crystallized ginger, 3 lb - sincerely nuts",Grocery & Gourmet Food > Snack Foods > Nuts & Seeds
4064,408,Premium Sweet Raw Apricot Kernels 7 OZ (Natural),Grocery & Gourmet Food > Snack Foods > Nuts & Seeds
4065,408,"milk chocolate covered cashews, 1 lb. bag",Grocery & Gourmet Food > Snack Foods > Nuts & Seeds
4066,408,Raw Almonds - Premium Freshness & Super Crunchy - By Farm Fresh Nuts (1 LB),Grocery & Gourmet Food > Snack Foods > Nuts & Seeds
4067,408,"Anna and Sarah Shelled Walnuts, Halves & Pieces 1 Lb",Grocery & Gourmet Food > Snack Foods > Nuts & Seeds
4068,408,"food to live organic cashew (whole, raw) (4 pounds)",Grocery & Gourmet Food > Snack Foods > Nuts & Seeds
4069,408,"manitoba harvest hemp hearts shelled hemp seed, 16 ounce pouch grocery",Grocery & Gourmet Food > Snack Foods > Nuts & Seeds
4070,408,"blue diamond almonds, bold sriracha - 6 oz",Grocery & Gourmet Food > Snack Foods > Nuts & Seeds
4071,408,chosen foods chia seeds 1 pound,Grocery & Gourmet Food > Snack Foods > Nuts & Seeds
4072,408,"Planters Deluxe Mixed Nuts, 15.25 Ounce",Grocery & Gourmet Food > Snack Foods > Nuts & Seeds
4073,408,"foods alive organic toasted hemp seeds with sea salt, 14-ounce bags (pack of 3)",Grocery & Gourmet Food > Snack Foods > Nuts & Seeds
4074,408,"Spicy World Whole Cashews, 3 Pound",Grocery & Gourmet Food > Snack Foods > Nuts & Seeds
4075,408,"wasabi coated peanuts, 2 lb",Grocery & Gourmet Food > Snack Foods > Nuts & Seeds
4076,408,diamond nuts of california,Grocery & Gourmet Food > Snack Foods > Nuts & Seeds
4077,408,"manitoba harvest organic hemp hearts, 12 oz",Grocery & Gourmet Food > Snack Foods > Nuts & Seeds
4078,408,blue diamond almonds honey roasted cinnamon 6 oz can,Grocery & Gourmet Food > Snack Foods > Nuts & Seeds
4079,408,40 oz Can Unsalted Virginia Peanuts,Grocery & Gourmet Food > Snack Foods > Nuts & Seeds
4080,408,bitter almonds,Grocery & Gourmet Food > Snack Foods > Nuts & Seeds
4081,408,"mauna loa macadamias, maui onion & garlic, 4.5-ounce containers (pack of 6)",Grocery & Gourmet Food > Snack Foods > Nuts & Seeds
4082,408,honey pecan pie,Grocery & Gourmet Food > Snack Foods > Nuts & Seeds
4083,408,planters flavored peanuts,Grocery & Gourmet Food > Snack Foods > Nuts & Seeds
4084,408,grecian imports brand - jordan almonds - white - polished (shiny) 1 pound,Grocery & Gourmet Food > Snack Foods > Nuts & Seeds
4085,408,"almonds, raw, shelled, organic, 5 lbs. bulk",Grocery & Gourmet Food > Snack Foods > Nuts & Seeds
4086,408,"Emerald Cocoa Roast Almonds, Stand Up Resealable Bag, 5 Ounce",Grocery & Gourmet Food > Snack Foods > Nuts & Seeds
4087,408,"corn nuts (toasted corn, salted) 5 lbs",Grocery & Gourmet Food > Snack Foods > Nuts & Seeds
4088,408,hawaiian host maui caramacs,Grocery & Gourmet Food > Snack Foods > Nuts & Seeds
4089,408,mixed nuts in shell (5 pound bag) - oh! nuts,Grocery & Gourmet Food > Snack Foods > Nuts & Seeds
4090,408,raw natural almonds - 1 lb. bags,Grocery & Gourmet Food > Snack Foods > Nuts & Seeds
4091,408,Plantskydd All Organic Rabbit & Small Critter Granular Repellant 1lb.,Grocery & Gourmet Food > Snack Foods > Nuts & Seeds
4092,408,"Turkish ANTEP Pistachios Nuts, Roasted, Salted, In Shell (2 LB)",Grocery & Gourmet Food > Snack Foods > Nuts & Seeds
4093,408,"raw shelled georgia pecans - fresh, natural & healthy, by farm fresh nuts (2 lb)",Grocery & Gourmet Food > Snack Foods > Nuts & Seeds
4094,408,raw pecans (1 pound bag),Grocery & Gourmet Food > Snack Foods > Nuts & Seeds
4095,408,dry roasted almonds by farm fresh nuts with himalayan salt (1 lb),Grocery & Gourmet Food > Snack Foods > Nuts & Seeds
4096,408,"blue diamond almonds bold variety pack of 4 x 6oz cans lime 'n chili, habanero bbq, jalapeno smokehouse, wasabi & soy sauce",Grocery & Gourmet Food > Snack Foods > Nuts & Seeds
4097,408,"Planters Select Cashews, Almonds and Pecans, 8.25 Ounce",Grocery & Gourmet Food > Snack Foods > Nuts & Seeds
4098,408,Sincerely Nuts Sunflower Seeds Roasted & Salted (No Shell) 3 Lb,Grocery & Gourmet Food > Snack Foods > Nuts & Seeds
4099,408,"organic raw pecan halves, 2 lbs bag- green bulk",Grocery & Gourmet Food > Snack Foods > Nuts & Seeds
4100,408,emerald cocoa roast almonds dark chocolate flavor 100 calorie packs,Grocery & Gourmet Food > Snack Foods > Nuts & Seeds
4101,408,"Planters Trail Mix, Spicy Nuts & Cajun Sticks, 6 oz, 3 pk",Grocery & Gourmet Food > Snack Foods > Nuts & Seeds
4102,408,"mauna loa macadamias, kona",Grocery & Gourmet Food > Snack Foods > Nuts & Seeds
4103,408,"sliced, blanched, almonds, 3 lb - we got nuts",Grocery & Gourmet Food > Snack Foods > Nuts & Seeds
4104,408,indian pumpkin seeds,Grocery & Gourmet Food > Snack Foods > Nuts & Seeds
4105,408,himalania black chia seeds,Grocery & Gourmet Food > Snack Foods > Nuts & Seeds
4106,408,hawaiian host maui caramacs - 6 ounce box,Grocery & Gourmet Food > Snack Foods > Nuts & Seeds
4107,408,hawaiian host dark chocolate alohamacs 12 oz.,Grocery & Gourmet Food > Snack Foods > Nuts & Seeds
4108,408,mayan chili pistachios 3 oz pkg,Grocery & Gourmet Food > Snack Foods > Nuts & Seeds
4109,408,"Diamond Hazelnuts, Chopped, 8-Ounce Bags (Pack of 2)",Grocery & Gourmet Food > Snack Foods > Nuts & Seeds
4110,408,"Food To Live BRAZIL NUTS (Whole, Shelled, Raw, Unsalted, Natural) (1 Pound)",Grocery & Gourmet Food > Snack Foods > Nuts & Seeds
4111,408,food to live broccoli seeds (2 lbs) - sprouting,Grocery & Gourmet Food > Snack Foods > Nuts & Seeds
4112,408,raw whole macadamia nuts - we got nuts (2 lbs.),Grocery & Gourmet Food > Snack Foods > Nuts & Seeds
4113,408,mixed nuts in shell 2 pound bag (32 oz) - oh! nuts,Grocery & Gourmet Food > Snack Foods > Nuts & Seeds
4114,408,trader joes just a handful,Grocery & Gourmet Food > Snack Foods > Nuts & Seeds
4115,408,madi k's whole natural nonpareil almonds -- 5.5 oz,Grocery & Gourmet Food > Snack Foods > Nuts & Seeds
4116,408,"emily's roasted and salted cashews, 17-ounce",Grocery & Gourmet Food > Snack Foods > Nuts & Seeds
4117,408,"earth circle organics - raw, organic, kosher - peruvian organic golden berries, 16 oz bag",Grocery & Gourmet Food > Snack Foods > Nuts & Seeds
4118,408,soy nuts roasted unsalted 1 lb,Grocery & Gourmet Food > Snack Foods > Nuts & Seeds
4119,408,"braga organic farms nut mix, 2 pound",Grocery & Gourmet Food > Snack Foods > Nuts & Seeds
4120,408,marquis-nutra foods / get,Grocery & Gourmet Food > Snack Foods > Nuts & Seeds
4121,408,sincerely nuts organic pumpkin seeds hulled (pepitas) raw 2 lb,Grocery & Gourmet Food > Snack Foods > Nuts & Seeds
4122,408,sincerely nuts raw pecans - no shell 2 lb,Grocery & Gourmet Food > Snack Foods > Nuts & Seeds
4123,408,truvibe -2 lbs- 100,Grocery & Gourmet Food > Snack Foods > Nuts & Seeds
4124,408,truvibe 100% organic raw hemp seeds (8 ounce),Grocery & Gourmet Food > Snack Foods > Nuts & Seeds
4125,408,Food To Live ® Organic Adzuki Sprouting Beans (1 Pound),Grocery & Gourmet Food > Snack Foods > Nuts & Seeds
4126,408,eden foods organic popcorn kernels -- 20 oz,Grocery & Gourmet Food > Snack Foods > Nuts & Seeds
4127,408,"blue diamond almonds, salted caramel - 6 oz",Grocery & Gourmet Food > Snack Foods > Nuts & Seeds
4128,408,blue diamond bold honey,Grocery & Gourmet Food > Snack Foods > Nuts & Seeds
4129,408,"planters nut-rition mix (macademias, cashews and almonds), lightly salted, 9.75-ounce cans (pack of 3)",Grocery & Gourmet Food > Snack Foods > Nuts & Seeds
4130,408,"manitoba harvest organic hemp hearts shelled hemp seed, 12 ounce bags (pack of 2)",Grocery & Gourmet Food > Snack Foods > Nuts & Seeds
4131,408,"david jumbo dill pickle sunflower seeds, roasted and salted (3 pack) 5.25 oz each",Grocery & Gourmet Food > Snack Foods > Nuts & Seeds
4132,408,Sincerely Nuts Natural Sliced Almonds Raw - Three (3) Lb. Bag - Ultra Convenient- Absolutely Delish - Fresh and Crunchy- Kosher,Grocery & Gourmet Food > Snack Foods > Nuts & Seeds
4133,408,"food to live certified organic sunflower seeds (raw, no shell) (1 pound)",Grocery & Gourmet Food > Snack Foods > Nuts & Seeds
4134,408,"navitas naturals organic raw hemp seeds, 8 oz",Grocery & Gourmet Food > Snack Foods > Nuts & Seeds
4135,408,"sincerely nuts cashews pieces (raw, no shell) 5 lb",Grocery & Gourmet Food > Snack Foods > Nuts & Seeds
4136,408,Food To Live Cranberry Beans (Borlotti) (5 Pounds),Grocery & Gourmet Food > Snack Foods > Nuts & Seeds
4137,408,Unsalted Sunflower Seeds In Shell by Gerbs - 2 LBS - Top 11 Food Allergen Free & NON GMO - Premium Dry Roasted Whole Sunflower Seed - COG USA,Grocery & Gourmet Food > Snack Foods > Nuts & Seeds
4138,408,"manitoba harvest shelled hemp seed, 8 oz",Grocery & Gourmet Food > Snack Foods > Nuts & Seeds
4139,408,"blue diamond almonds, can, whole natural, 6 oz",Grocery & Gourmet Food > Snack Foods > Nuts & Seeds
4140,408,"blue diamond almonds, whole naural - 16 oz",Grocery & Gourmet Food > Snack Foods > Nuts & Seeds
4141,408,"blue diamond bold almonds, salt 'n vinegar, 1.5 oz tubes - 12 ea",Grocery & Gourmet Food > Snack Foods > Nuts & Seeds
4142,408,"blue diamond almonds, roasted coffee - 4 oz",Grocery & Gourmet Food > Snack Foods > Nuts & Seeds
4143,408,"blue diamond almonds, smokehouse - 16 oz",Grocery & Gourmet Food > Snack Foods > Nuts & Seeds
4144,408,woodstock organic pumpkin seeds - 11 oz,Grocery & Gourmet Food > Snack Foods > Nuts & Seeds
4145,408,"planters nut-rition, energy mix - 9.25 oz",Grocery & Gourmet Food > Snack Foods > Nuts & Seeds
4146,408,blue diamond lightly salted almonds 12 oz,Grocery & Gourmet Food > Snack Foods > Nuts & Seeds
4147,408,archer farms sea salt roasted almonds 32 oz,Grocery & Gourmet Food > Snack Foods > Nuts & Seeds
4148,408,emerald natural walnuts and almonds 100 calorie 7 ct,Grocery & Gourmet Food > Snack Foods > Nuts & Seeds
4149,408,mauna loa dark chocolate macadamias 6 oz,Grocery & Gourmet Food > Snack Foods > Nuts & Seeds
4150,408,archer farms® deluxe mixed nuts with seasalt 10.5 oz,Grocery & Gourmet Food > Snack Foods > Nuts & Seeds
4151,408,market pantry chopped walnuts 2.25 oz,Grocery & Gourmet Food > Snack Foods > Nuts & Seeds
4152,408,lightly salted roasted almonds 12oz - archer farms™,Grocery & Gourmet Food > Snack Foods > Nuts & Seeds
4153,408,"diamond of california shelled walnut, 16 oz",Grocery & Gourmet Food > Snack Foods > Nuts & Seeds
4154,408,"diamond of california: sliced almonds, 4 oz",Grocery & Gourmet Food > Snack Foods > Nuts & Seeds
4155,408,"blue diamond oven roasted sea salt almonds, 25 oz",Grocery & Gourmet Food > Snack Foods > Nuts & Seeds
4156,408,"planters nut-rition chocolate nut sustaining energy mix, 1.72 oz, 5 count",Grocery & Gourmet Food > Snack Foods > Nuts & Seeds
4157,408,"planters macadamias, 6.25 oz",Grocery & Gourmet Food > Snack Foods > Nuts & Seeds
4158,408,"blue diamond dark chocolate almonds, 30 oz",Grocery & Gourmet Food > Snack Foods > Nuts & Seeds
4159,408,fisher chefs naturals chopped pecans 10 oz,Grocery & Gourmet Food > Snack Foods > Nuts & Seeds
4160,408,"great value party size mixed nuts, 26 oz",Grocery & Gourmet Food > Snack Foods > Nuts & Seeds
4161,408,"emerald 100 calorie packs smoked almonds, 0.56 oz, 7 count",Grocery & Gourmet Food > Snack Foods > Nuts & Seeds
4162,408,"margaret holmes peanut patch green boiled peanuts, 27 oz",Grocery & Gourmet Food > Snack Foods > Nuts & Seeds
4163,408,diamond of california slivered almonds 10 oz,Grocery & Gourmet Food > Snack Foods > Nuts & Seeds
4164,408,"wonderful pistachios roasted no salt pistachios, 10 oz",Grocery & Gourmet Food > Snack Foods > Nuts & Seeds
4165,408,"fisher chefs naturals natural sliced almonds, 2 oz",Grocery & Gourmet Food > Snack Foods > Nuts & Seeds
4166,408,"white jordan almonds, 44 ounces/pkg",Grocery & Gourmet Food > Snack Foods > Nuts & Seeds
4167,408,"blue diamond smokehouse almonds, 16 oz",Grocery & Gourmet Food > Snack Foods > Nuts & Seeds
4168,408,fisher chefs naturals chopped pecans 24 oz,Grocery & Gourmet Food > Snack Foods > Nuts & Seeds
4169,408,sams choice mixed berry blend trail mix 23 oz,Grocery & Gourmet Food > Snack Foods > Nuts & Seeds
4170,408,"diamond of california shelled pistachios, 6 oz",Grocery & Gourmet Food > Snack Foods > Nuts & Seeds
4171,408,"diamond of california nut toppings glazed walnuts, 7.5 oz",Grocery & Gourmet Food > Snack Foods > Nuts & Seeds
4172,408,"great value party peanuts, 16 oz",Grocery & Gourmet Food > Snack Foods > Nuts & Seeds
4173,408,fisher chefs naturals walnut halves pieces 24 oz,Grocery & Gourmet Food > Snack Foods > Nuts & Seeds
4174,408,"wonderful: shelled roasted & salted pistachios, 6 oz",Grocery & Gourmet Food > Snack Foods > Nuts & Seeds
4175,408,fisher chefs naturals chopped walnuts 32 oz,Grocery & Gourmet Food > Snack Foods > Nuts & Seeds
4176,408,"diamond of california chopped macadamia nuts, 6 oz",Grocery & Gourmet Food > Snack Foods > Nuts & Seeds
4177,408,"diamond: shelled walnuts, 10 oz",Grocery & Gourmet Food > Snack Foods > Nuts & Seeds
4178,408,"smokehouse piggy slivers, 24 pack",Grocery & Gourmet Food > Snack Foods > Nuts & Seeds
4179,408,"great value cinnamon roasted almonds, 14 oz",Grocery & Gourmet Food > Snack Foods > Nuts & Seeds
4180,408,blue diamond oven roasted almonds dark chocolate 5.0 oz.,Grocery & Gourmet Food > Snack Foods > Nuts & Seeds
4181,408,almonds raw wonderful 7.0 oz.,Grocery & Gourmet Food > Snack Foods > Nuts & Seeds
4182,408,"pistachios roasted, lightly salted wonderful 16.0 oz.",Grocery & Gourmet Food > Snack Foods > Nuts & Seeds
4183,408,planters cocktail peanuts 16.0 oz.,Grocery & Gourmet Food > Snack Foods > Nuts & Seeds
4184,408,squirrel brand (3) 16 oz. cans of country honey nut mix,Grocery & Gourmet Food > Snack Foods > Nuts & Seeds
4185,408,"kirkland signature whole almonds, 3 lbs",Grocery & Gourmet Food > Snack Foods > Nuts & Seeds
4186,408,kirkland signature? extra fancy unsalted mixed nut,Grocery & Gourmet Food > Snack Foods > Nuts & Seeds
4187,408,kirkland signature? extra fancy unsalted whole fan,Grocery & Gourmet Food > Snack Foods > Nuts & Seeds
4188,408,hoody's® deep south praline pecans 4-pack,Grocery & Gourmet Food > Snack Foods > Nuts & Seeds
4189,408,"kirkland signature extra fancy unsalted mixed nuts, 40 oz",Grocery & Gourmet Food > Snack Foods > Nuts & Seeds
4190,408,"wonderful almonds, dry roasted & salted, 1.5 oz, 12/box",Grocery & Gourmet Food > Snack Foods > Nuts & Seeds
4191,408,salted caramel mocha-small,Grocery & Gourmet Food > Snack Foods > Nuts & Seeds
4192,408,Emerald Bird Feeder,Grocery & Gourmet Food > Snack Foods > Nuts & Seeds
4193,408,now foods salted pistachios-12 oz,Grocery & Gourmet Food > Snack Foods > Nuts & Seeds
4194,408,erlenmeyer flask spirit decanter,Grocery & Gourmet Food > Snack Foods > Nuts & Seeds
4195,408,archaeology soap,Grocery & Gourmet Food > Snack Foods > Nuts & Seeds
4196,408,shiloh farms organic yellow popcorn kernels -- 15 oz,Grocery & Gourmet Food > Snack Foods > Nuts & Seeds
4197,408,woodstock organic dark chocolate covered almonds -- 6.5 oz,Grocery & Gourmet Food > Snack Foods > Nuts & Seeds
4198,408,nutiva organic chia seed -- 12 oz 1 $ 7.11 $ 7.11,Grocery & Gourmet Food > Snack Foods > Nuts & Seeds
4199,408,"diamond walnuts, shelled, 16 oz",Grocery & Gourmet Food > Snack Foods > Nuts & Seeds
4200,408,kirkland in shell pistachios,Grocery & Gourmet Food > Snack Foods > Nuts & Seeds
4201,408,"Now Real Food Organic Pine Nuts, 8 oz",Grocery & Gourmet Food > Snack Foods > Nuts & Seeds
4202,408,trader joe's dry roasted and unsalted pistachios 1lb,Grocery & Gourmet Food > Snack Foods > Nuts & Seeds
4203,408,trader joe's coconut cashews,Grocery & Gourmet Food > Snack Foods > Nuts & Seeds
4204,408,"planters trail mix pack, nut and chocolate, 6 pouches, 7.5 ounce",Grocery & Gourmet Food > Snack Foods > Nuts & Seeds
4205,408,blue diamond whole natural 16oz,Grocery & Gourmet Food > Snack Foods > Nuts & Seeds
4206,408,nutiva organic black chia,Grocery & Gourmet Food > Snack Foods > Nuts & Seeds
4207,408,"spectrum essentials chia seeds, 12 ounce pouch grocery",Grocery & Gourmet Food > Snack Foods > Nuts & Seeds
4208,408,wonderful pistachios by paramount farms - 3lb. bag,Grocery & Gourmet Food > Snack Foods > Nuts & Seeds
4209,408,pink jordan almonds 2 pounds,Grocery & Gourmet Food > Snack Foods > Nuts & Seeds
4210,408,blue diamond honey roasted 6.0 oz (pack of 6),Grocery & Gourmet Food > Snack Foods > Nuts & Seeds
4211,408,"Diamond Of California Diced Walnuts (10 oz., 12 pk.)",Grocery & Gourmet Food > Snack Foods > Nuts & Seeds
4212,408,roasted california almonds (1 pound bag) (unsalted),Grocery & Gourmet Food > Snack Foods > Nuts & Seeds
4213,408,3lb fiddy fire in-shell pistachios,Grocery & Gourmet Food > Snack Foods > Nuts & Seeds
4214,408,"blue diamond flavored almonds, toasted coconut 10 ounce bag, 1 bag",Grocery & Gourmet Food > Snack Foods > Nuts & Seeds
4215,408,dried mango (1 pound bag),Grocery & Gourmet Food > Snack Foods > Nuts & Seeds
4216,408,"David Jumbo Reduced Sodium Sunflower Seeds, Roasted and Salted (3 Pack) 5.25 oz each",Grocery & Gourmet Food > Snack Foods > Nuts & Seeds
4217,408,kirkland signature supreme whole almonds 3 lbs.,Grocery & Gourmet Food > Snack Foods > Nuts & Seeds
4218,408,raw spanish peanuts - 5 lb. box,Grocery & Gourmet Food > Snack Foods > Nuts & Seeds
4219,408,now foods sunflower seeds hulled raw 1 lb new,Grocery & Gourmet Food > Snack Foods > Nuts & Seeds
4220,408,"planters heat peanuts, 1.75 oz tubes, 18 ct",Grocery & Gourmet Food > Snack Foods > Nuts & Seeds
4221,408,smokehouse almonds 4 lbs (in 4 - 1 lb reclosable bags),Grocery & Gourmet Food > Snack Foods > Nuts & Seeds
4222,408,"blue diamond almonds, honey dijon, 6-ounce",Grocery & Gourmet Food > Snack Foods > Nuts & Seeds
4223,408,planters deluxe whole,Grocery & Gourmet Food > Snack Foods > Nuts & Seeds
4224,408,"HuangFeiHong Spicy Snack Peanuts - 4x3.8 oz - with Hot Chili Pepper & Szechuan Peppercorns - Tingling, Spicy &",Grocery & Gourmet Food > Snack Foods > Nuts & Seeds
4225,408,"maisie jane cinnamon glazed almonds, 2.5 ounce package",Grocery & Gourmet Food > Snack Foods > Nuts & Seeds
4226,408,chacha sunflower roasted and salted seeds (all nature) 250g x 6 bags,Grocery & Gourmet Food > Snack Foods > Nuts & Seeds
4227,408,now foods real food natural unblanched almonds unsalted -- 16 oz,Grocery & Gourmet Food > Snack Foods > Nuts & Seeds
4228,408,planters cocoa almonds - 37 oz. (2 pack),Grocery & Gourmet Food > Snack Foods > Nuts & Seeds
4229,408,Dip N' Dunk Snack Container (Assorted Colors),Grocery & Gourmet Food > Snack Foods > Nuts & Seeds
4230,408,David Sunflower Seeds - 5.75 oz - 12 pk,Grocery & Gourmet Food > Snack Foods > Nuts & Seeds
4231,408,"BLUE DIAMOND ALMOND HONEY ROASTED, 6 OZ",Grocery & Gourmet Food > Snack Foods > Nuts & Seeds
4232,408,Bigs Sunflower Seed Flavor Variety Pack 9 bags (5.35oz each) includes bonus,Grocery & Gourmet Food > Snack Foods > Nuts & Seeds
4233,408,Sahale Snacks All Natural Glazed Nut Blend (4oz x 3 Packs) (Almonds with Cranberries Honey and Sea Salt),Grocery & Gourmet Food > Snack Foods > Nuts & Seeds
4234,408,dark chocolate peanuts 1 lb (453g),Grocery & Gourmet Food > Snack Foods > Nuts & Seeds
4235,408,Sincerely Nuts Natural Whole Raw Almonds Unsalted No Shell - Two (2) Lb. Bag - Absolutely Appetizing- Full of Healthy Nutrients - Kosher,Grocery & Gourmet Food > Snack Foods > Nuts & Seeds
4236,408,Oh! Nuts Freshly Roasted Nut Gift Tray 6-section 2 Pound Gift Tray,Grocery & Gourmet Food > Snack Foods > Nuts & Seeds
4237,408,"royal oak gourmet jumbo virginia salted peanuts, 40-ounce holiday christmas tins (pack of 2)",Grocery & Gourmet Food > Snack Foods > Nuts & Seeds
4238,408,"diamond sliced almonds, 4-ounce",Grocery & Gourmet Food > Snack Foods > Nuts & Seeds
4239,408,Braga Organic Farms 25 Lb Organic Raw Inshell Pistachios,Grocery & Gourmet Food > Snack Foods > Nuts & Seeds
4240,408,"mauna loa maui onion & garlic macadamia nuts, 11-ounce bag (pack of 12)",Grocery & Gourmet Food > Snack Foods > Nuts & Seeds
4241,408,nut roaster's reserve,Grocery & Gourmet Food > Snack Foods > Nuts & Seeds
4242,408,dark chocolate covered pistachios 1-pound bag,Grocery & Gourmet Food > Snack Foods > Nuts & Seeds
4243,408,"Organic Chlorella Powder, RAW, Vegan, Kosher, Gluten Free, NON GMO, 8oz Bag",Grocery & Gourmet Food > Snack Foods > Nuts & Seeds
4244,408,"Planters Peanuts, Chipotle, 6 Ounce (Pack of 8)",Grocery & Gourmet Food > Snack Foods > Nuts & Seeds
4245,408,sunbursts - rainbow colored chocolate covered sunflower seeds - 5 pounds,Grocery & Gourmet Food > Snack Foods > Nuts & Seeds
4246,408,"blue diamond oven roasted almonds, dark chocolate, 14-ounce container",Grocery & Gourmet Food > Snack Foods > Nuts & Seeds
4247,408,"Anna and Sarah Raw Almonds in Resealable Bag, 2 Lbs",Grocery & Gourmet Food > Snack Foods > Nuts & Seeds
4248,408,"2x blue diamond almond nut thins, 4.25 oz",Grocery & Gourmet Food > Snack Foods > Nuts & Seeds
4249,408,"planters flavored peanuts, salted caramel bag, 16 ounce",Grocery & Gourmet Food > Snack Foods > Nuts & Seeds
4250,408,"now foods certified organic walnuts, raw halves and pieces (unsalted), 12-ounce bag health and beauty",Grocery & Gourmet Food > Snack Foods > Nuts & Seeds
4251,408,blue diamond almonds 7-100 calorie packs-bold wasabi & soy sauce (pack of 2),Grocery & Gourmet Food > Snack Foods > Nuts & Seeds
4252,408,"rainbow colored chocolate sunflower seeds, 3lb bulk bag",Grocery & Gourmet Food > Snack Foods > Nuts & Seeds
4253,408,David Sunflower Seeds 5.25 oz Variety Pack (Pack of 6) 1-Bag Cracked Pepper,Grocery & Gourmet Food > Snack Foods > Nuts & Seeds
4254,408,"blue diamond bold almonds, 1.5 oz tubes, salt 'n vinegar, 12 tubes",Grocery & Gourmet Food > Snack Foods > Nuts & Seeds
4255,408,pink jordan almonds (5,Grocery & Gourmet Food > Snack Foods > Nuts & Seeds
4256,408,"nature's joy california pistachios, roasted and sea-salted, 8 ounce",Grocery & Gourmet Food > Snack Foods > Nuts & Seeds
4257,408,"food to live ® cashew (whole, raw) (1 pound)",Grocery & Gourmet Food > Snack Foods > Nuts & Seeds
4258,408,"jumbo sunflower seeds sunflower seeds, ranch, 5-ounce (pack of 12)",Grocery & Gourmet Food > Snack Foods > Nuts & Seeds
4259,408,"kirkland signature variety snacking nuts, 24 individual bags (3 lb)",Grocery & Gourmet Food > Snack Foods > Nuts & Seeds
4260,408,"Mauna Loa Macadamias, Dry Roasted with Sea Salt, 11-oz. Mauna Loa",Grocery & Gourmet Food > Snack Foods > Nuts & Seeds
4261,408,"food to live ® organic cashews (whole, raw) (1 pound)",Grocery & Gourmet Food > Snack Foods > Nuts & Seeds
