,category_id,description,category_path
2000,408,Healthworks Goji Berries 8 oz Raw Organic USDA Certified,Grocery & Gourmet Food > Snack Foods > Nuts & Seeds
2001,408,"manitoba harvest hemp hearts shelled hemp seed, organic, 5 pound pouch",Grocery & Gourmet Food > Snack Foods > Nuts & Seeds
2002,408,Blue Diamond Almonds Blueberry Oven Roasted (Box of 36 / 1.5-Ounce Tube Size Bags),Grocery & Gourmet Food > Snack Foods > Nuts & Seeds
2003,408,"wonderful almond roasted & salted, 40 oz (2.5 lbs)",Grocery & Gourmet Food > Snack Foods > Nuts & Seeds
2004,408,"Cashew Pieces, Large, Raw, Bulk - 5 Pounds - We Got Nuts",Grocery & Gourmet Food > Snack Foods > Nuts & Seeds
2005,408,organic dark chocolate covered almonds 2 lbs (in 2 - 1 lb reclosable bags),Grocery & Gourmet Food > Snack Foods > Nuts & Seeds
2006,408,"terrasoul superfoods raw unpasteurized organic almonds (sproutable), 2-pounds",Grocery & Gourmet Food > Snack Foods > Nuts & Seeds
2007,408,tic tac freshmints big pack - 12pk 12-1oz packs- net wt. 12 oz. (348 g),Grocery & Gourmet Food > Snack Foods > Nuts & Seeds
2008,408,trader joe's salt and pepper pistachios,Grocery & Gourmet Food > Snack Foods > Nuts & Seeds
2009,408,"planters deluxe whole cashews honey roasted, 8.25 oz. (count of 3)",Grocery & Gourmet Food > Snack Foods > Nuts & Seeds
2010,408,"soy nuts, roasted unsalted 5 lb",Grocery & Gourmet Food > Snack Foods > Nuts & Seeds
2011,408,"David Jumbo Sunflower Seeds - Cracked Pepper, Bar-B-Q, and Ranch Variety Bundle",Grocery & Gourmet Food > Snack Foods > Nuts & Seeds
2012,408,daily chef mountain trail mix 3lb.,Grocery & Gourmet Food > Snack Foods > Nuts & Seeds
2013,408,Sea Salted Roasted Pumpkin Seeds In Shell by Gerbs - 2 LBS - Top 11 Food Allergen,Grocery & Gourmet Food > Snack Foods > Nuts & Seeds
2014,408,"food to live certified organic sunflower kernels (raw, no shell) (8 pounds)",Grocery & Gourmet Food > Snack Foods > Nuts & Seeds
2015,408,hawaiian value pack big wave organic raw unsalted maui grown macadamia nuts 2 bags,Grocery & Gourmet Food > Snack Foods > Nuts & Seeds
2016,408,"nutiva organic black chia seeds, 12-oz. bag",Grocery & Gourmet Food > Snack Foods > Nuts & Seeds
2017,408,trader joe's raw pignolias,Grocery & Gourmet Food > Snack Foods > Nuts & Seeds
2018,408,"diamond pecans, shelled, 6 oz",Grocery & Gourmet Food > Snack Foods > Nuts & Seeds
2019,408,"organic chia seeds (raw, black), 24-ounce",Grocery & Gourmet Food > Snack Foods > Nuts & Seeds
2020,408,"blue diamond growers almond breeze original non dairy beverage, 64 ounce -- 8 per case.",Grocery & Gourmet Food > Snack Foods > Nuts & Seeds
2021,408,fast fresh nuts - whole almonds in a handy bulk-bag - 5 lbs,Grocery & Gourmet Food > Snack Foods > Nuts & Seeds
2022,408,"wonderful pistachios (1.5 oz., 12 pks. 18 total oz.)",Grocery & Gourmet Food > Snack Foods > Nuts & Seeds
2023,408,savanna orchards gourmet,Grocery & Gourmet Food > Snack Foods > Nuts & Seeds
2024,408,"California Walnuts, Shelled By Farm Fresh Nuts (1 LB)",Grocery & Gourmet Food > Snack Foods > Nuts & Seeds
2025,408,two pounds of almonds blanched - whole,Grocery & Gourmet Food > Snack Foods > Nuts & Seeds
2026,408,"Bigs Sea Salt and Black Pepper Sunflower Seeds, 5.35 Ounce (Pack of 3)",Grocery & Gourmet Food > Snack Foods > Nuts & Seeds
2027,408,blue diamond almonds 100 calories per bag - 32 grab and go bags grocery,Grocery & Gourmet Food > Snack Foods > Nuts & Seeds
2028,408,"wonderful pistachios, roasted and salted, 32-oz. bag quantity: 2",Grocery & Gourmet Food > Snack Foods > Nuts & Seeds
2029,408,"planters brittle nut medley canister, 14.438 ounce",Grocery & Gourmet Food > Snack Foods > Nuts & Seeds
2030,408,sweet passion fruit seeds (10 seeds) ***high germination rate for seeds***,Grocery & Gourmet Food > Snack Foods > Nuts & Seeds
2031,408,the swiss colony,Grocery & Gourmet Food > Snack Foods > Nuts & Seeds
2032,408,"Assorted Jordan Almonds, 2 lb Bag",Grocery & Gourmet Food > Snack Foods > Nuts & Seeds
2033,408,nuts cashew pieces raw (1x5lb ),Grocery & Gourmet Food > Snack Foods > Nuts & Seeds
2034,408,natural / raw cashews by farm fresh nuts (3 lb),Grocery & Gourmet Food > Snack Foods > Nuts & Seeds
2035,408,"mauna loa macadamias, butter candy glazed, 5.5-ounce containers (pack of 6)",Grocery & Gourmet Food > Snack Foods > Nuts & Seeds
2036,408,hawaiian value pack big wave organic raw unsalted maui grown macadamia nuts 8 bags,Grocery & Gourmet Food > Snack Foods > Nuts & Seeds
2037,408,StepUp Organic Goji Berries - 1lb - Non-GMO Kosher Gluten Free - 1lb (16oz),Grocery & Gourmet Food > Snack Foods > Nuts & Seeds
2038,408,"emerald® - 100 calorie pack dark chocolate cocoa roast almonds, .63 oz packs, 7 packs/box - sold as 1 box - a healthy and satisfying go-to snack.",Grocery & Gourmet Food > Snack Foods > Nuts & Seeds
2039,408,"signature's kirkland fancy mixed nuts, 40 ounce",Grocery & Gourmet Food > Snack Foods > Nuts & Seeds
2040,408,"jumbo raw peanuts, bulk, 2 lbs",Grocery & Gourmet Food > Snack Foods > Nuts & Seeds
2041,408,"wonderful almonds, natural raw, 1.5-oz bags (pack of 12)",Grocery & Gourmet Food > Snack Foods > Nuts & Seeds
2042,408,"superseedz pumpkin seeds, sea salt, 5 ounce package",Grocery & Gourmet Food > Snack Foods > Nuts & Seeds
2043,408,sincerely nuts large sunflower seeds roasted & unsalted ( in shell) 4 lb,Grocery & Gourmet Food > Snack Foods > Nuts & Seeds
2044,408,"lord nut levington peanuts, sweet miss keet, 8-ounce",Grocery & Gourmet Food > Snack Foods > Nuts & Seeds
2045,408,"food to live ® brazil nuts (whole, shelled, raw, unsalted, natural) (2 pounds)",Grocery & Gourmet Food > Snack Foods > Nuts & Seeds
2046,408,"Nutiva Organic Shelled Hempseed, 19 Ounce Pouch",Grocery & Gourmet Food > Snack Foods > Nuts & Seeds
2047,408,"blue diamond dark chocolate flavored oven roasted almonds, 25 oz",Grocery & Gourmet Food > Snack Foods > Nuts & Seeds
2048,408,"brazil nuts, raw, shelled, organic, 1# (1 lb.) bulk",Grocery & Gourmet Food > Snack Foods > Nuts & Seeds
2049,408,sincerely nuts hazelnuts (filberts) blanched raw 1 lb,Grocery & Gourmet Food > Snack Foods > Nuts & Seeds
2050,408,Sincerely Nuts Pumpkin Seeds - Pepitas Roasted & Salted (No Shell) 5lb Bag,Grocery & Gourmet Food > Snack Foods > Nuts & Seeds
2051,408,"trader joe's just a handful of simply the best almonds, cashews & cranberries trek mix 10 individual bags",Grocery & Gourmet Food > Snack Foods > Nuts & Seeds
2052,408,"indus organic roasted hazelnut, 1 lbx3 , sulfite free, salt free, freshly packed, premium grade",Grocery & Gourmet Food > Snack Foods > Nuts & Seeds
2053,408,"blue diamond, almonds, bold wasabi & soy, 6oz can (pack of 3)",Grocery & Gourmet Food > Snack Foods > Nuts & Seeds
2054,408,"galil roasted chestnuts, 3.5-ounce pouches (pack of 24)",Grocery & Gourmet Food > Snack Foods > Nuts & Seeds
2055,408,"signature's cashew cluster with almonds and pumpkin seeds, 32 ounce",Grocery & Gourmet Food > Snack Foods > Nuts & Seeds
2056,408,"terrasoul superfoods raw organic cashews (whole), 5 pound bulk bag",Grocery & Gourmet Food > Snack Foods > Nuts & Seeds
2057,408,"blue diamond almonds blazin buffalo wing, 6-ounce containers (pack of 6)",Grocery & Gourmet Food > Snack Foods > Nuts & Seeds
2058,408,"blue diamond almonds 100 calories per bag - 32 grab and go bags,.625 oz (individual),20 oz (net weight)",Grocery & Gourmet Food > Snack Foods > Nuts & Seeds
2059,408,food to live ® pine nuts / pignolias (8 ounces),Grocery & Gourmet Food > Snack Foods > Nuts & Seeds
2060,408,chia pet handmade,Grocery & Gourmet Food > Snack Foods > Nuts & Seeds
2061,408,whole chestnuts roasted & peeled (organic) 3 pack,Grocery & Gourmet Food > Snack Foods > Nuts & Seeds
2062,408,"beer nuts original peanuts, 12-ounce cans (pack of 6)",Grocery & Gourmet Food > Snack Foods > Nuts & Seeds
2063,408,"hoosier hill farm mini dehydrated marshmallows, 1 lb.",Grocery & Gourmet Food > Snack Foods > Nuts & Seeds
2064,408,cashews - roasted unsalted 5 lb bulk bag - by dilettante,Grocery & Gourmet Food > Snack Foods > Nuts & Seeds
2065,408,Spitz Salted Caramel Sunflower Seeds 5.35 Oz (3 Pack),Grocery & Gourmet Food > Snack Foods > Nuts & Seeds
2066,408,"blue diamond almonds 7-100 calorie packs-bold wasabi & soy sauce, 4.2-ounce",Grocery & Gourmet Food > Snack Foods > Nuts & Seeds
2067,408,pecans raw (4 pound bag),Grocery & Gourmet Food > Snack Foods > Nuts & Seeds
2068,408,"Now Foods Healthy Immune Drink Sticks, 24 Count",Grocery & Gourmet Food > Snack Foods > Nuts & Seeds
2069,408,"organic chia seeds (raw, black), 16-ounce",Grocery & Gourmet Food > Snack Foods > Nuts & Seeds
2070,408,planters roasted honey,Grocery & Gourmet Food > Snack Foods > Nuts & Seeds
2071,408,"Emerald Deluxe Mixed Nuts, 5 Ounce",Grocery & Gourmet Food > Snack Foods > Nuts & Seeds
2072,408,100% hawaiian dry roast macadamia nut (diced) 1.25 lb bag,Grocery & Gourmet Food > Snack Foods > Nuts & Seeds
2073,408,"organic hemp seeds (shelled), 8-ounce",Grocery & Gourmet Food > Snack Foods > Nuts & Seeds
2074,408,"Lord Nut Levington highly seasoned Peanuts, Spicy Bloody Mary, 8-Ounce",Grocery & Gourmet Food > Snack Foods > Nuts & Seeds
2075,408,"food to live certified organic walnuts (raw, no shell) (1 pound)",Grocery & Gourmet Food > Snack Foods > Nuts & Seeds
2076,408,braga organic farms pumpkin,Grocery & Gourmet Food > Snack Foods > Nuts & Seeds
2077,408,hawaiian host macnut crunch 6 oz,Grocery & Gourmet Food > Snack Foods > Nuts & Seeds
2078,408,savory nut gift tray 4-section - oh! nuts,Grocery & Gourmet Food > Snack Foods > Nuts & Seeds
2079,408,"planters peanuts, chipotle, 6 ounce",Grocery & Gourmet Food > Snack Foods > Nuts & Seeds
2080,408,dry roasted pecans by farm,Grocery & Gourmet Food > Snack Foods > Nuts & Seeds
2081,408,setton farms premium pistachios roasted salted - 32 oz,Grocery & Gourmet Food > Snack Foods > Nuts & Seeds
2082,408,"Blue Diamond Almonds Bold Wasabi & Soy Sauce, 14 Ounce (Pack of 3)",Grocery & Gourmet Food > Snack Foods > Nuts & Seeds
2083,408,Dark Chocolate Chips (68% Cacao) by Gerbs - 2 LB Deal - Top 11 Food Allergen Free & NON GMO - Product of Canada - Vegan & Kosher,Grocery & Gourmet Food > Snack Foods > Nuts & Seeds
2084,408,"braga organic farms pumpkin seeds, roasted and salted, 2 pound",Grocery & Gourmet Food > Snack Foods > Nuts & Seeds
2085,408,"kirkland signature supreme whole almonds, 3 pound",Grocery & Gourmet Food > Snack Foods > Nuts & Seeds
2086,408,"diamond glazed pecans, 5.5-ounce",Grocery & Gourmet Food > Snack Foods > Nuts & Seeds
2087,408,"nature?s joy california pistachios, roasted and sea-salted, 16 ounce",Grocery & Gourmet Food > Snack Foods > Nuts & Seeds
2088,408,100% Midwest Soy Container Wax by American Soy Organics (10 pound bag),Grocery & Gourmet Food > Snack Foods > Nuts & Seeds
2089,408,David Sunflower Seeds 5.25 oz Variety Pack (Pack of 6) 2 Bags of David Sunflower,Grocery & Gourmet Food > Snack Foods > Nuts & Seeds
2090,408,"Deluxe Mixed Nuts Raw, 2Lbs",Grocery & Gourmet Food > Snack Foods > Nuts & Seeds
2091,408,sincerely nuts hazelnuts (filberts) blanched raw 2 lb,Grocery & Gourmet Food > Snack Foods > Nuts & Seeds
2092,408,hines nut company orchard,Grocery & Gourmet Food > Snack Foods > Nuts & Seeds
2093,408,"manitoba harvest organic hemp hearts raw shelled hemp seeds, 12 ounce bag",Grocery & Gourmet Food > Snack Foods > Nuts & Seeds
2094,408,"Emerald Cinnamon Roast Almonds, 7 Count (Pack of 12)",Grocery & Gourmet Food > Snack Foods > Nuts & Seeds
2095,408,"planters roasted and salted sunflowers seeds, 7-oz. bags (count of 12)",Grocery & Gourmet Food > Snack Foods > Nuts & Seeds
2096,408,"terrasoul superfoods organic chia seeds (raw, black), 24-ounce",Grocery & Gourmet Food > Snack Foods > Nuts & Seeds
2097,408,wonderful pistachios roasted and salted shelled pistachios 32 ounce value bag,Grocery & Gourmet Food > Snack Foods > Nuts & Seeds
2098,408,"Sincerely Nuts Macadamia Nuts Unsalted (Roasted, No Salt) 2 LB",Grocery & Gourmet Food > Snack Foods > Nuts & Seeds
2099,408,"food to live brazil nuts (ingredients: organic brazil nuts) raw, no shell (1 pound)",Grocery & Gourmet Food > Snack Foods > Nuts & Seeds
2100,408,"Turkish ANTEP Pistachios Nuts, Roasted, Salted, In Shell (4 LB)",Grocery & Gourmet Food > Snack Foods > Nuts & Seeds
2101,408,"david sunflower seeds original flavor, 5.25-ounce bags (pack of 12)",Grocery & Gourmet Food > Snack Foods > Nuts & Seeds
2102,408,"healthworks 100% raw shelled hemp seed, 2 pound",Grocery & Gourmet Food > Snack Foods > Nuts & Seeds
2103,408,"Super 5 Seed Granola (Pumpkin, Sunflower, Chia, Hemp, Flax) - 4 LBS - Top 11 Food Allergen Free & NON GMO - Vegan & Kosher",Grocery & Gourmet Food > Snack Foods > Nuts & Seeds
2104,408,sunflower seeds - no salt / roasted ~ 2 lbs,Grocery & Gourmet Food > Snack Foods > Nuts & Seeds
2105,408,Spicy World Macadamia Nuts Halves & Pieces (Unsalted) 2 Pound Bag - Value Size,Grocery & Gourmet Food > Snack Foods > Nuts & Seeds
2106,408,"food to live certified organic sunflower seeds (raw, no shell) (2 pounds)",Grocery & Gourmet Food > Snack Foods > Nuts & Seeds
2107,408,"Blue Diamond, Lightly Salted Low Sodium Almonds, 25oz Bag (Pack of 2)",Grocery & Gourmet Food > Snack Foods > Nuts & Seeds
2108,408,"emerald vanilla roast almonds, 8.5 oz (pack of 3)",Grocery & Gourmet Food > Snack Foods > Nuts & Seeds
2109,408,certified organic pine nuts 8 ounces,Grocery & Gourmet Food > Snack Foods > Nuts & Seeds
2110,408,"Sunfood - Brazil Nuts, 1 lb, Organic",Grocery & Gourmet Food > Snack Foods > Nuts & Seeds
2111,408,hemp seeds - 1 pound bag,Grocery & Gourmet Food > Snack Foods > Nuts & Seeds
2112,408,"pistachios shelled kernels roasted unsalted, 2lbs",Grocery & Gourmet Food > Snack Foods > Nuts & Seeds
2113,408,"sincerely nuts mixed nuts unsalted (no shell) 1 lb - almonds, cashews, brazil nuts, pecans, filberts, walnuts, macadamia nuts",Grocery & Gourmet Food > Snack Foods > Nuts & Seeds
2114,408,california walnuts halves & pieces by farm fresh nuts (1 lb),Grocery & Gourmet Food > Snack Foods > Nuts & Seeds
2115,408,BetterBody Foods Organic Chia Seeds (32 oz.),Grocery & Gourmet Food > Snack Foods > Nuts & Seeds
2116,408,"planters, redskin spanish peanuts with sea salt, 12.5oz can (pack of 4)",Grocery & Gourmet Food > Snack Foods > Nuts & Seeds
2117,408,sincerely nuts pink jordan almonds 5 lb,Grocery & Gourmet Food > Snack Foods > Nuts & Seeds
2118,408,"mauna loa macadamias, maui onion & garlic, 11-ounce packages (pack of 2)",Grocery & Gourmet Food > Snack Foods > Nuts & Seeds
2119,408,green bulk's plantain,Grocery & Gourmet Food > Snack Foods > Nuts & Seeds
2120,408,emerald vanilla roast almonds 100 calorie packs (4 boxes),Grocery & Gourmet Food > Snack Foods > Nuts & Seeds
2121,408,planters dry roasted,Grocery & Gourmet Food > Snack Foods > Nuts & Seeds
2122,408,"Wonderful Pistachios, Salt & Pepper Flavor, 48 Ounce",Grocery & Gourmet Food > Snack Foods > Nuts & Seeds
2123,408,"planters nutrition almond peanut pistachio, 10.25-ounce (pack of 3)",Grocery & Gourmet Food > Snack Foods > Nuts & Seeds
2124,408,trader joe's nuts inshell,Grocery & Gourmet Food > Snack Foods > Nuts & Seeds
2125,408,sixlets ~ light purple ~ 2 lbs,Grocery & Gourmet Food > Snack Foods > Nuts & Seeds
2126,408,"Carrington Farms Ready To Eat Organic Flax Hemp Blend, 10 Ounce",Grocery & Gourmet Food > Snack Foods > Nuts & Seeds
2127,408,healthworks chia seeds 2 pounds,Grocery & Gourmet Food > Snack Foods > Nuts & Seeds
2128,408,"Doctor in the Kitchen Seedsters Sprouted Seed Snack, Sweet Onion and Garlic, 3.5 Ounce",Grocery & Gourmet Food > Snack Foods > Nuts & Seeds
2129,408,"nature's earthly choice super food of the aztecs chia ancient grains, 2 pound",Grocery & Gourmet Food > Snack Foods > Nuts & Seeds
2130,408,planters cocktail peanuts,Grocery & Gourmet Food > Snack Foods > Nuts & Seeds
2131,408,"Super Seedz - Gourmet Roasted Pumpkin Seeds, 5 oz Package (Pack of 2) Curious Curry - Non Gmo, Vegan and Gluten Free Snacks",Grocery & Gourmet Food > Snack Foods > Nuts & Seeds
2132,408,trader joe's candied pecans,Grocery & Gourmet Food > Snack Foods > Nuts & Seeds
2133,408,teal aqua blue jordan almonds 1 pound bag - oh! nuts,Grocery & Gourmet Food > Snack Foods > Nuts & Seeds
2134,408,"Dry Malt Diastatic Powder (1.5lbs) by Anthony's, Made in the USA (1.5 Pounds)",Grocery & Gourmet Food > Snack Foods > Nuts & Seeds
2135,408,"mauna loa macadamias nuts, cookies and creme, 11 ounce",Grocery & Gourmet Food > Snack Foods > Nuts & Seeds
2136,408,"madi k's roasted and salted almonds, 1-ounce bags (pack of 48) quantity: 4",Grocery & Gourmet Food > Snack Foods > Nuts & Seeds
2137,408,Sanniti Marcona Almonds 1 Pound,Grocery & Gourmet Food > Snack Foods > Nuts & Seeds
2138,408,"young pecan golden sweet pecan halves, 32 ounce",Grocery & Gourmet Food > Snack Foods > Nuts & Seeds
2139,408,"wonderful almond roasted & salted, 40 oz (2.5 lbs) misc.",Grocery & Gourmet Food > Snack Foods > Nuts & Seeds
2140,408,trader joe's raw almonds 16 oz,Grocery & Gourmet Food > Snack Foods > Nuts & Seeds
2141,408,blue diamond oven roasted almonds strawberry flavor 10 oz (pack of 2),Grocery & Gourmet Food > Snack Foods > Nuts & Seeds
2142,408,"planters nutrition sustaining energy mix, chocolate nut, 8.6 ounce",Grocery & Gourmet Food > Snack Foods > Nuts & Seeds
2143,408,sincerely nuts pumpkin seeds- pepitas (raw) (no shell) 2lb bag,Grocery & Gourmet Food > Snack Foods > Nuts & Seeds
2144,408,organic six seed super blend 16 oz,Grocery & Gourmet Food > Snack Foods > Nuts & Seeds
2145,408,BetterBody Foods Organic Raw Chia Seeds (2lbs),Grocery & Gourmet Food > Snack Foods > Nuts & Seeds
2146,408,2lb salt free pistachio kernels,Grocery & Gourmet Food > Snack Foods > Nuts & Seeds
2147,408,healthworks chia seeds 5 pounds new,Grocery & Gourmet Food > Snack Foods > Nuts & Seeds
2148,408,almonds whole natural 2lb (32 ounces),Grocery & Gourmet Food > Snack Foods > Nuts & Seeds
2149,408,raw almonds from california - 10 (1 lb) resealable packages,Grocery & Gourmet Food > Snack Foods > Nuts & Seeds
2150,408,"terrasoul superfoods organic chia seeds (raw, black), 1.5 pounds",Grocery & Gourmet Food > Snack Foods > Nuts & Seeds
2151,408,blue jordan almonds (1 pound bag),Grocery & Gourmet Food > Snack Foods > Nuts & Seeds
2152,408,nutiva organic shelled hempseed - 13 oz - hsg-634014,Grocery & Gourmet Food > Snack Foods > Nuts & Seeds
2153,408,"food to live ® almonds (whole, raw, shelled, unsalted) (4 pounds)",Grocery & Gourmet Food > Snack Foods > Nuts & Seeds
2154,408,Raw Deluxe Mixed Nuts (3 Pound Bag) - We Got Nuts,Grocery & Gourmet Food > Snack Foods > Nuts & Seeds
2155,408,Men's Health and Energy Trail Mix - Only From Farm Fresh Nuts (1 LB),Grocery & Gourmet Food > Snack Foods > Nuts & Seeds
2156,408,"planters nut-rition heart healthy mix, 9.75-ounce cans (pack of 3)",Grocery & Gourmet Food > Snack Foods > Nuts & Seeds
2157,408,"navitas naturals organic raw chia seeds, 1 pound pouches grocery",Grocery & Gourmet Food > Snack Foods > Nuts & Seeds
2158,408,"diamond almonds, sliced, 6 oz",Grocery & Gourmet Food > Snack Foods > Nuts & Seeds
2159,408,blazin' buffalo wing 3 pack,Grocery & Gourmet Food > Snack Foods > Nuts & Seeds
2160,408,"Organic Raw Apricot Kernels, 16oz",Grocery & Gourmet Food > Snack Foods > Nuts & Seeds
2161,408,David Sunflower Seeds Dash Button,Grocery & Gourmet Food > Snack Foods > Nuts & Seeds
2162,408,"Clear Path Trading, Jumbo Dry Roasted Salted Peanuts in Shell, 5 lb",Grocery & Gourmet Food > Snack Foods > Nuts & Seeds
2163,408,Roasted Turkish Hazelnuts / Filberts / Kernels - Shelled (2 LB),Grocery & Gourmet Food > Snack Foods > Nuts & Seeds
2164,408,"Blue Diamond Almonds - BOLD VARIETY FLAVORS – Sriracha, Jalapeno Smokehouse",Grocery & Gourmet Food > Snack Foods > Nuts & Seeds
2165,408,"planters harvest california almonds, 11 oz",Grocery & Gourmet Food > Snack Foods > Nuts & Seeds
2166,408,"food to live brazil nuts - 4 pounds (whole, shelled, raw, unsalted, natural)",Grocery & Gourmet Food > Snack Foods > Nuts & Seeds
2167,408,Roasted Unsalted Pumpkin Seeds In Shell by Gerbs – 4 LBS - Top 11 Food Allergen,Grocery & Gourmet Food > Snack Foods > Nuts & Seeds
2168,408,bhuja crunchy seasoned,Grocery & Gourmet Food > Snack Foods > Nuts & Seeds
2169,408,Raw Almonds - Premium Freshness & Super Crunchy - By Farm Fresh Nuts (3 LB),Grocery & Gourmet Food > Snack Foods > Nuts & Seeds
2170,408,salted marcona almonds (1 pound bag),Grocery & Gourmet Food > Snack Foods > Nuts & Seeds
2171,408,butter toffee peanuts 5lb bag bulk,Grocery & Gourmet Food > Snack Foods > Nuts & Seeds
2172,408,"Sincerely Nuts Turkish Pistachios Roasted & Salted in Shell - Five (5) Lbs. Bag - Full of Flavor, Crunchily Delicious - Control Your Calories - Kosher",Grocery & Gourmet Food > Snack Foods > Nuts & Seeds
2173,408,healthworks the finest organic raw chia seeds 32oz (2lb),Grocery & Gourmet Food > Snack Foods > Nuts & Seeds
2174,408,Sincerely Nuts Raw Almonds in Shell 1 LB,Grocery & Gourmet Food > Snack Foods > Nuts & Seeds
2175,408,perugina glacia mints (1lb,Grocery & Gourmet Food > Snack Foods > Nuts & Seeds
2176,408,nut roaster's reserve premium in-shell mixed nuts (3 pounds),Grocery & Gourmet Food > Snack Foods > Nuts & Seeds
2177,408,planters honey roasted peanuts 16 oz,Grocery & Gourmet Food > Snack Foods > Nuts & Seeds
2178,408,"Terrasoul Superfoods Organic Pumpkin Seeds, 2 Pounds",Grocery & Gourmet Food > Snack Foods > Nuts & Seeds
2179,408,hawaiian host maui caramacs 6 / 6 oz. boxes,Grocery & Gourmet Food > Snack Foods > Nuts & Seeds
2180,408,"wonderful pistachios, salt and pepper, 7 ounce quantity: 2",Grocery & Gourmet Food > Snack Foods > Nuts & Seeds
2181,408,"planters, salted caramel peanuts, 6oz canister (pack of 4)",Grocery & Gourmet Food > Snack Foods > Nuts & Seeds
2182,408,Cashew Pieces Large (Raw) - SweetGourmet (3Lb),Grocery & Gourmet Food > Snack Foods > Nuts & Seeds
2183,408,terrasoul superfoods organic raw walnuts - 1 pound new,Grocery & Gourmet Food > Snack Foods > Nuts & Seeds
2184,408,trader joe`s thai lime and chili cashew,Grocery & Gourmet Food > Snack Foods > Nuts & Seeds
2185,408,"planters peanuts, cocoa, 6 ounce (pack of 8)",Grocery & Gourmet Food > Snack Foods > Nuts & Seeds
2186,408,"pistachios in shell roasted salted, 3lbs",Grocery & Gourmet Food > Snack Foods > Nuts & Seeds
2187,408,"manitoba harvest organic hemp hearts, 7 ounce",Grocery & Gourmet Food > Snack Foods > Nuts & Seeds
2188,408,Big Raw Whole Cashew 2 Pound Bag - Oh! Nuts,Grocery & Gourmet Food > Snack Foods > Nuts & Seeds
2189,408,"emerald cinnamon roast almonds, 7 - 100 calorie packs, 0.62-ounce",Grocery & Gourmet Food > Snack Foods > Nuts & Seeds
2190,408,"terrasoul superfoods raw unpasteurized organic almonds (sproutable), 4 pounds",Grocery & Gourmet Food > Snack Foods > Nuts & Seeds
2191,408,"food to live brazil nuts (2 pounds) whole, shelled, raw, unsalted, natural",Grocery & Gourmet Food > Snack Foods > Nuts & Seeds
2192,408,pepitas roasted unsalted,Grocery & Gourmet Food > Snack Foods > Nuts & Seeds
2193,408,"manitoba harvest hemp heart snack bars, vanilla, 12 count",Grocery & Gourmet Food > Snack Foods > Nuts & Seeds
2194,408,"Blue Diamond Almonds, Smokehouse, 16 Ounce",Grocery & Gourmet Food > Snack Foods > Nuts & Seeds
2195,408,"California Natural Nuts Freshly Roasted Nut Deluxe Gift Tray 2.5 Lbs Delicious Salted Almonds, Buttery Cashews, Tasty Pistachios, Savory Mixed Nuts, Chocolate Covered Almonds, Walnuts, Pecan",Grocery & Gourmet Food > Snack Foods > Nuts & Seeds
2196,408,truenorth almond pecan cashew clusters net wt 24 oz (680g) (pack of 2),Grocery & Gourmet Food > Snack Foods > Nuts & Seeds
2197,408,sahale snacks - sahale snacks soledad blend 5 oz (pack of 6),Grocery & Gourmet Food > Snack Foods > Nuts & Seeds
2198,408,"hammons fancy large black walnuts, 8-ounce bag",Grocery & Gourmet Food > Snack Foods > Nuts & Seeds
2199,408,sincerely nuts almonds roasted & unsalted 5 lb,Grocery & Gourmet Food > Snack Foods > Nuts & Seeds
2200,408,"planters redskin spanish peanuts sea salt, 12.5 oz (pack of 6)",Grocery & Gourmet Food > Snack Foods > Nuts & Seeds
2201,408,"Planters Dry Roasted Peanuts, 16 oz Planters",Grocery & Gourmet Food > Snack Foods > Nuts & Seeds
2202,408,"viva labs organic chia seeds: raw and non-gmo, 2lb bag",Grocery & Gourmet Food > Snack Foods > Nuts & Seeds
2203,408,jim beam barbecue sunflower,Grocery & Gourmet Food > Snack Foods > Nuts & Seeds
2204,408,david roasted & salted ranch flavored sun flower seeds (3 packs),Grocery & Gourmet Food > Snack Foods > Nuts & Seeds
2205,408,"david seeds jumbo sunflower ranch flavor, 5.25-ounce bag (pack of 12)",Grocery & Gourmet Food > Snack Foods > Nuts & Seeds
2206,408,koh-kae peanuts with barbecue coated flavor snack net wt 95 g (3.35 oz) x 3 bags,Grocery & Gourmet Food > Snack Foods > Nuts & Seeds
2207,408,blue diamond almonds sea,Grocery & Gourmet Food > Snack Foods > Nuts & Seeds
2208,408,braga organic farms,Grocery & Gourmet Food > Snack Foods > Nuts & Seeds
2209,408,"planters roasted almonds with sea salt, 21.25-oz. cans (count of 2)",Grocery & Gourmet Food > Snack Foods > Nuts & Seeds
2210,408,"planters cocoa almonds, dark chocolate flavor, 37 ounce",Grocery & Gourmet Food > Snack Foods > Nuts & Seeds
2211,408,"planters nutrition omega-3 mix, 9.25 ounce canister (pack of 2)",Grocery & Gourmet Food > Snack Foods > Nuts & Seeds
2212,408,"terrasoul superfoods organic hemp seeds (shelled), 24-ounce",Grocery & Gourmet Food > Snack Foods > Nuts & Seeds
2213,408,"beer nuts original peanuts, 1.25-ounce packages (pack of 24)",Grocery & Gourmet Food > Snack Foods > Nuts & Seeds
2214,408,"planters super tube nuts, salted peanuts, 2.5-ounce, 15 count",Grocery & Gourmet Food > Snack Foods > Nuts & Seeds
2215,408,"planters peanuts, dry roasted, 16 ounce jars (pack of 2)",Grocery & Gourmet Food > Snack Foods > Nuts & Seeds
2216,408,"pistachios shelled raw unsalted, 2lbs - we got nuts",Grocery & Gourmet Food > Snack Foods > Nuts & Seeds
