,category_id,description,category_path
1560,591,"mr clean with gain original fresh scent liquid muscle multi-purpose cleaner, 30 oz",Home & Kitchen > Household Cleaning > All-Purpose Cleaners
1561,591,"mr. clean multi-surfaces spray cleaner with gain original fresh scent, 40 fl oz",Home & Kitchen > Household Cleaning > All-Purpose Cleaners
1562,591,lysol clean and fresh multisurface cleaner pourable hawaii sunset 48 oz,Home & Kitchen > Household Cleaning > All-Purpose Cleaners
1563,591,pledge multi surface antibacounterial everyday cleachner 97oz 2pk,Home & Kitchen > Household Cleaning > All-Purpose Cleaners
1564,591,"clorox clean up cleaner, citrus scent, 32 fo",Home & Kitchen > Household Cleaning > All-Purpose Cleaners
1565,591,pledge multi surface antibacterial everyday cleaner 97 ounces,Home & Kitchen > Household Cleaning > All-Purpose Cleaners
1566,591,windex antibacterial multisurface cleaner 32oz,Home & Kitchen > Household Cleaning > All-Purpose Cleaners
1567,591,"swiffer wetjet with dawn multi-purpose cleaner refill, 42.2 fl oz",Home & Kitchen > Household Cleaning > All-Purpose Cleaners
1568,591,pinesol original multisurface cleaner 144 fl oz,Home & Kitchen > Household Cleaning > All-Purpose Cleaners
1569,591,"formula 409 multi-surface cleaner, spray bottle, 32 ounces",Home & Kitchen > Household Cleaning > All-Purpose Cleaners
1570,591,"clorox 4 in one disinfecting spray, two 19 ounce spray cans",Home & Kitchen > Household Cleaning > All-Purpose Cleaners
1571,591,"formula 409 cleaner degreaser disinfectant, 32 fl oz",Home & Kitchen > Household Cleaning > All-Purpose Cleaners
1572,591,"303 30207 multi-purpose cleaner trigger sprayer, 32 fl oz",Home & Kitchen > Household Cleaning > All-Purpose Cleaners
1573,591,"tilex mold and mildew remover spray, 16 fluid ounces",Home & Kitchen > Household Cleaning > All-Purpose Cleaners
1574,591,clorox cleanup all purpose cleaner with bleach spray bottle citrus scent 32 ounces,Home & Kitchen > Household Cleaning > All-Purpose Cleaners
1575,591,simple green industrial cleaner degreaser 24 fl oz,Home & Kitchen > Household Cleaning > All-Purpose Cleaners
1576,591,mrs meyers multisurface concentrate lavender scent,Home & Kitchen > Household Cleaning > All-Purpose Cleaners
1577,591,lysol power and fresh all purpose cleaner peony blossom white peach 48 ounce,Home & Kitchen > Household Cleaning > All-Purpose Cleaners
1578,591,mr. clean summer citrus multipurpose antibacterial cleaner 24 fl oz,Home & Kitchen > Household Cleaning > All-Purpose Cleaners
1579,591,multi-surface concentrated cleaner rosemary mrs. meyer's 32.0 fl oz,Home & Kitchen > Household Cleaning > All-Purpose Cleaners
1580,591,method multi-surface all purpose cleaner spray cucumber 28.0 fl oz,Home & Kitchen > Household Cleaning > All-Purpose Cleaners
1581,591,fantastik antibacterial heavy duty all purpose cleaner 32.0 oz.,Home & Kitchen > Household Cleaning > All-Purpose Cleaners
1582,591,all purpose natural surface cleaner beach sage method,Home & Kitchen > Household Cleaning > All-Purpose Cleaners
1583,591,cleaner lemon fantastik scrubbing bubbles 32.0 oz.,Home & Kitchen > Household Cleaning > All-Purpose Cleaners
1584,591,all surface cleaner earth friendly products 22.0 fl oz,Home & Kitchen > Household Cleaning > All-Purpose Cleaners
1585,591,"Lysol I.C. Quaternary Disinfectant Cleaner Concentrate, 128 oz, Case of 4",Home & Kitchen > Household Cleaning > All-Purpose Cleaners
1586,591,lysol concentrate,Home & Kitchen > Household Cleaning > All-Purpose Cleaners
1587,591,"clorox clean-up cleaner spray with bleach and refill combo, 32 ounce spray bottle + 180 ounce refill health and beauty",Home & Kitchen > Household Cleaning > All-Purpose Cleaners
1588,591,johnson s c inc 70261 raid max roach & ant,Home & Kitchen > Household Cleaning > All-Purpose Cleaners
1589,591,sd-20 all purpose cleaner,Home & Kitchen > Household Cleaning > All-Purpose Cleaners
1590,591,"3 Pk, Ajax Oxygen Bleach Powder Cleanser, 21 Oz",Home & Kitchen > Household Cleaning > All-Purpose Cleaners
1591,591,"18"" pipe brush cleaner",Home & Kitchen > Household Cleaning > All-Purpose Cleaners
1592,591,"go-jo 7048 all-purpose vinegar cleaner, 64 oz bottle",Home & Kitchen > Household Cleaning > All-Purpose Cleaners
1593,591,caldrea all-purpose,Home & Kitchen > Household Cleaning > All-Purpose Cleaners
1594,591,"Nature's ERADICATOR Multi-Purpose Enzyme Cleaner, green safe natural cleaning",Home & Kitchen > Household Cleaning > All-Purpose Cleaners
1595,591,"Goo Gone 8 oz., 2 Pack Value Pack - Removes stickers, grease, gum, tar, crayon",Home & Kitchen > Household Cleaning > All-Purpose Cleaners
1596,591,"goo gone gghs12 goo remover spray gel 12 oz, removes chewing gum, grease, tar, stickers, labels, tape residue, oil, blood, lipstick, mascara, shoe pol new",Home & Kitchen > Household Cleaning > All-Purpose Cleaners
1597,591,Bar Keepers Friend Soft Cleanser for Stainless Steel / Porcelain / Ceramic / Tile / Copper - 13 Oz. Each - 4 Pack,Home & Kitchen > Household Cleaning > All-Purpose Cleaners
1598,591,method all purpose natural surface cleaning spray - ginger yuzu - 28 oz - 2 pk,Home & Kitchen > Household Cleaning > All-Purpose Cleaners
1599,591,"DiverseyTM 4277285 - OXIVIR TB ONE-STEP DISINFECTANT CLEANER, 32 OZ BOTTLE, 12/CARTON",Home & Kitchen > Household Cleaning > All-Purpose Cleaners
1600,591,"green works® all-purpose cleaner, spray, 32 oz.",Home & Kitchen > Household Cleaning > All-Purpose Cleaners
1601,591,la's all purpose cleaner concentrated totally awesome 16 oz,Home & Kitchen > Household Cleaning > All-Purpose Cleaners
1602,591,"CitraSolv Natural Cleaner and Degreaser Concentrate Valencia Orange, 16 Fluid Ounce",Home & Kitchen > Household Cleaning > All-Purpose Cleaners
1603,591,"Mrs. Meyer's 17540 Multi-surface Concentrate Cleaner, 32 Oz, Honeysuckle",Home & Kitchen > Household Cleaning > All-Purpose Cleaners
1604,591,the masters paint brush cleaner and preserver - 24 ounce tub - lemon scented,Home & Kitchen > Household Cleaning > All-Purpose Cleaners
1605,591,"Music Nomad MN103 Guitar ONE All-in-1 Cleaner, Polish, and Wax, 4 oz.",Home & Kitchen > Household Cleaning > All-Purpose Cleaners
1606,591,"seventh generation, free & clear all-purpose cleaner 32 ounces",Home & Kitchen > Household Cleaning > All-Purpose Cleaners
1607,591,"Better Life What-Ever All-Purpose Scent Free Cleaner, 32 Ounce",Home & Kitchen > Household Cleaning > All-Purpose Cleaners
1608,591,clorox clo 04690 no-splash,Home & Kitchen > Household Cleaning > All-Purpose Cleaners
1609,591,"green works all purpose cleaner, lemon, 32 oz, 2 pk",Home & Kitchen > Household Cleaning > All-Purpose Cleaners
1610,591,orange chronic cleaner - 16 oz - pack of 2,Home & Kitchen > Household Cleaning > All-Purpose Cleaners
1611,591,"green works all purpose cleaner spray, original fresh, 32 ounces (pack of 3) (packaging may vary)",Home & Kitchen > Household Cleaning > All-Purpose Cleaners
1612,591,"better life what-ever! clary sage and citrus, 32 ounce (pack of 2)",Home & Kitchen > Household Cleaning > All-Purpose Cleaners
1613,591,"goo gone 128 oz. (1 gallon) - removes stickers, grease, gum, tar, crayon & tape",Home & Kitchen > Household Cleaning > All-Purpose Cleaners
1614,591,"soft scrub with bleach cleanser, 36-ounce (pack of 3)",Home & Kitchen > Household Cleaning > All-Purpose Cleaners
1615,591,"lysol brand concentrate disinfectant, cleaner, and deodorizer, original scent, 12 oz. (case of 6)",Home & Kitchen > Household Cleaning > All-Purpose Cleaners
1616,591,citra solv natural cleaner & degreaser 16 oz,Home & Kitchen > Household Cleaning > All-Purpose Cleaners
1617,591,odoban 11062-g disinfectant,Home & Kitchen > Household Cleaning > All-Purpose Cleaners
1618,591,"method all purpose cleaning spray, pink grapefruit, 28 fluid ounce, pack of 4",Home & Kitchen > Household Cleaning > All-Purpose Cleaners
1619,591,clorox clo 01698 32-ounce anywhere hard surface sanitizing spray bottle (case of 12),Home & Kitchen > Household Cleaning > All-Purpose Cleaners
1620,591,Super Iron Out All-Purpose Rust and Stain Remover,Home & Kitchen > Household Cleaning > All-Purpose Cleaners
1621,591,"bwk7048 - boardwalk vinegar cleaner, 64oz bottle, 8/carton",Home & Kitchen > Household Cleaning > All-Purpose Cleaners
1622,591,"Mrs. Meyer's Multi-Surface Everyday Cleaner Honeysuckle, 16 Fluid Ounce (Pack of 3)",Home & Kitchen > Household Cleaning > All-Purpose Cleaners
1623,591,soft scrub with bleach,Home & Kitchen > Household Cleaning > All-Purpose Cleaners
1624,591,"green works all purpose cleaner spray, original, 32 ounces (pack of 3)",Home & Kitchen > Household Cleaning > All-Purpose Cleaners
1625,591,"earth friendly products rtu orange plus cleaner, 22-ounce (pack of 2)",Home & Kitchen > Household Cleaning > All-Purpose Cleaners
1626,591,"Soft Scrub Cleanser with Bleach, 24 oz",Home & Kitchen > Household Cleaning > All-Purpose Cleaners
1627,591,"lysol all purpose cleaner, lemon breeze, 32 ounce",Home & Kitchen > Household Cleaning > All-Purpose Cleaners
1628,591,"rejuvenate rj24ssr scrub free soap scum remover, 24-ounce",Home & Kitchen > Household Cleaning > All-Purpose Cleaners
1629,591,j.r. watkins all-purpose,Home & Kitchen > Household Cleaning > All-Purpose Cleaners
1630,591,"Green Works All Purpose Cleaner Spray, Lemon, 32 Ounces (Pack of 3) (Packaging",Home & Kitchen > Household Cleaning > All-Purpose Cleaners
1631,591,"formula 409 all purpose cleaner spray bottle, 32 fluid ounces (pack of 3)",Home & Kitchen > Household Cleaning > All-Purpose Cleaners
1632,591,discovery products nu-view concession & food equipment cleaner-triple pack,Home & Kitchen > Household Cleaning > All-Purpose Cleaners
1633,591,"formula 409(r) heavy-duty cleaner/degreaser, 32 oz. spray bottle",Home & Kitchen > Household Cleaning > All-Purpose Cleaners
1634,591,"la's totally awesome all-purpose concentrated cleaner refills, 32 oz. 2pk",Home & Kitchen > Household Cleaning > All-Purpose Cleaners
1635,591,"karcher 9.558-120.0 20x multi purpose pressure washer detergent cleaner, 1-quart",Home & Kitchen > Household Cleaning > All-Purpose Cleaners
1636,591,goo gone goo gone,Home & Kitchen > Household Cleaning > All-Purpose Cleaners
1637,591,"mrs. meyer's clean day all purpose cleaner, lavender, 32 oz.",Home & Kitchen > Household Cleaning > All-Purpose Cleaners
1638,591,Fiebings All Purpose Cleaner And Leather Conditioner 8 Oz,Home & Kitchen > Household Cleaning > All-Purpose Cleaners
1639,591,"spic and span antibacterial spray cleaner, 22 oz.",Home & Kitchen > Household Cleaning > All-Purpose Cleaners
1640,591,"pine sol cleanecleaner, original, 40 oz",Home & Kitchen > Household Cleaning > All-Purpose Cleaners
1641,591,"Filbur FC-6350 Pure n' Clean Cartridge and DE Filter Cleaner, 32-Ounce",Home & Kitchen > Household Cleaning > All-Purpose Cleaners
1642,591,sal suds liquid cleanser 128 ounces,Home & Kitchen > Household Cleaning > All-Purpose Cleaners
1643,591,2 Ink-B-Gone Stain Remover,Home & Kitchen > Household Cleaning > All-Purpose Cleaners
1644,591,sal suds liquid cleanser 32 ounces,Home & Kitchen > Household Cleaning > All-Purpose Cleaners
1645,591,"caldrea ginger pomelo counter-top cleanser, 16 oz.",Home & Kitchen > Household Cleaning > All-Purpose Cleaners
1646,591,"bar keepers friend cleanser and polish (12 oz. each, 4 pack)",Home & Kitchen > Household Cleaning > All-Purpose Cleaners
1647,591,"windex multi-surface cleaner, vinegar, 26 oz (pack of 2) health and beauty",Home & Kitchen > Household Cleaning > All-Purpose Cleaners
1648,591,"seventh generation free and clear all purpose cleaner, 32 fluid ounce new",Home & Kitchen > Household Cleaning > All-Purpose Cleaners
1649,591,"Lysol 74392 Professional Antibacterial All Purpose Cleaner, 128 oz (Pack of 4)",Home & Kitchen > Household Cleaning > All-Purpose Cleaners
1650,591,"soft scrub gel cleanser with bleach, 28.6 oz-2 pk",Home & Kitchen > Household Cleaning > All-Purpose Cleaners
1651,591,mr. clean multipurpose,Home & Kitchen > Household Cleaning > All-Purpose Cleaners
1652,591,Award Winning Fizzion Cleaner 23 Oz Reusable Trigger Spray Bottle w/ 2 Cleaning Tablets Attached | Best Cleaner,Home & Kitchen > Household Cleaning > All-Purpose Cleaners
1653,591,Fiberlock 8310 1 Gallon Shockwave Concentrate Cleaner,Home & Kitchen > Household Cleaning > All-Purpose Cleaners
1654,591,clorox green works all-purpose cleaner - 64 oz. new,Home & Kitchen > Household Cleaning > All-Purpose Cleaners
1655,591,"clorox anywhere hard surface daily sanitizing spray, 22 fluid ounce (pack of 9)",Home & Kitchen > Household Cleaning > All-Purpose Cleaners
1656,591,"super iron out io65n rust stain remover, 4 lbs. 12 oz.",Home & Kitchen > Household Cleaning > All-Purpose Cleaners
1657,591,"Shark Skimmer Net with Ez Clip Handle, Pool Leaf Skimmer Used for Cleaning Swimming Pools, Hot Tubs, Spas and",Home & Kitchen > Household Cleaning > All-Purpose Cleaners
1658,591,"Formula 409 All Purpose Cleaner Refill Bottle, 64 Fluid Ounces",Home & Kitchen > Household Cleaning > All-Purpose Cleaners
1659,591,"mrs. meyer's clean day surface scrub, geranium - 11 oz",Home & Kitchen > Household Cleaning > All-Purpose Cleaners
1660,591,"j.r. watkins all purpose cleaner, lemon - 24 fl oz",Home & Kitchen > Household Cleaning > All-Purpose Cleaners
1661,591,fantastik antibacterial heavy duty all purpose cleaner - 32 oz,Home & Kitchen > Household Cleaning > All-Purpose Cleaners
1662,591,ology all purpose cleaner - 26 oz,Home & Kitchen > Household Cleaning > All-Purpose Cleaners
1663,591,"clorox clean-up cleaner with bleach spray, fresh scent - 32 fl oz",Home & Kitchen > Household Cleaning > All-Purpose Cleaners
1664,591,damprid mildew stain remover plus blocker - 32 oz,Home & Kitchen > Household Cleaning > All-Purpose Cleaners
1665,591,mrs. meyer's clean day® all purpose cleaner geranium -- 32 fl oz,Home & Kitchen > Household Cleaning > All-Purpose Cleaners
1666,591,soft scrub total with bleach cleaner - 25.04 fl oz,Home & Kitchen > Household Cleaning > All-Purpose Cleaners
1667,591,pledge® multi-surface everyday cleaner 99% natural with clean citrus scent - 16 oz,Home & Kitchen > Household Cleaning > All-Purpose Cleaners
1668,591,mrs. meyer's multi-surface concentrate lavender 32oz,Home & Kitchen > Household Cleaning > All-Purpose Cleaners
1669,591,lime-a-way coffeemaker descaler and cleaner -7 oz,Home & Kitchen > Household Cleaning > All-Purpose Cleaners
1670,591,mrs. meyer's multi-surface everyday cleaner lilac 16oz,Home & Kitchen > Household Cleaning > All-Purpose Cleaners
1671,591,pine-sol multi-surface cleaner lavender 60 oz,Home & Kitchen > Household Cleaning > All-Purpose Cleaners
1672,591,mr. clean multi-purpose cleaner gain 40 oz,Home & Kitchen > Household Cleaning > All-Purpose Cleaners
1673,591,green works simply lemon all purpose cleaner spray - 32 oz,Home & Kitchen > Household Cleaning > All-Purpose Cleaners
1674,591,method lime & sea salt all purpose cleaner 28 oz - 3 pack,Home & Kitchen > Household Cleaning > All-Purpose Cleaners
1675,591,method all purpose cleaner pomegranate 28oz,Home & Kitchen > Household Cleaning > All-Purpose Cleaners
1676,591,better life naturally scum-slamming tub and tile cleaner 32oz,Home & Kitchen > Household Cleaning > All-Purpose Cleaners
1677,591,dapple household cleaners and disinfectants,Home & Kitchen > Household Cleaning > All-Purpose Cleaners
1678,591,"lysol power & free citrus sparkle zest scent multi-purpose cleaner, 32 fl oz",Home & Kitchen > Household Cleaning > All-Purpose Cleaners
1679,591,mrs. meyers multisurface everyday cleaner,Home & Kitchen > Household Cleaning > All-Purpose Cleaners
1680,591,"fabuloso multi purpose cleaner, lavender, 128 fluid ounce",Home & Kitchen > Household Cleaning > All-Purpose Cleaners
1681,591,windex multisurface cleaner with glade lavender and peach blossom 26 ounces,Home & Kitchen > Household Cleaning > All-Purpose Cleaners
1682,591,goo gone remover citrus power,Home & Kitchen > Household Cleaning > All-Purpose Cleaners
1683,591,"formula 409 all-purpose cleaner spray, 32 fl oz",Home & Kitchen > Household Cleaning > All-Purpose Cleaners
1684,591,fabuloso commercial strength lavender multiuse cleaner 1 gal,Home & Kitchen > Household Cleaning > All-Purpose Cleaners
1685,591,"goo gone sticker lifter, 2 oz",Home & Kitchen > Household Cleaning > All-Purpose Cleaners
1686,591,homax gg44 4oz. goo gone,Home & Kitchen > Household Cleaning > All-Purpose Cleaners
1687,591,"mr. clean meadows & rain multi-surface cleaner with febreze freshness, 128 fl oz",Home & Kitchen > Household Cleaning > All-Purpose Cleaners
1688,591,mr. clean meadows rain multisurface cleaner with febreze 128 fl oz,Home & Kitchen > Household Cleaning > All-Purpose Cleaners
1689,591,"lysol power & free oxygen splash scent multi-purpose cleaner, 40 fl oz",Home & Kitchen > Household Cleaning > All-Purpose Cleaners
1690,591,"mr. clean liquid muscle crisp lemon multi-purpose cleaner, 16 fl oz",Home & Kitchen > Household Cleaning > All-Purpose Cleaners
1691,591,windex vinegar multisurface cleaner refill 2 l,Home & Kitchen > Household Cleaning > All-Purpose Cleaners
1692,591,windex multisurface disinfectant all purpose cleaner 32 fl oz,Home & Kitchen > Household Cleaning > All-Purpose Cleaners
1693,591,"formula 409 multi-surface cleaner, spray bottle, lemon, 32 ounces",Home & Kitchen > Household Cleaning > All-Purpose Cleaners
1694,591,"lysol power & free oxygen splash scent taptop multi-purpose cleaner, 14 fl oz",Home & Kitchen > Household Cleaning > All-Purpose Cleaners
1695,591,"kids 'n' pets instant all-purpose stain and odor remover, 16 fl oz",Home & Kitchen > Household Cleaning > All-Purpose Cleaners
1696,591,lysol mold mildew blaster spray 28 fl oz,Home & Kitchen > Household Cleaning > All-Purpose Cleaners
1697,591,"mr. clean multi-surface cleaning spray with lavender scent, 32 oz",Home & Kitchen > Household Cleaning > All-Purpose Cleaners
1698,591,"tilex mildew root penetrator and remover spray, 32 fluid ounces",Home & Kitchen > Household Cleaning > All-Purpose Cleaners
1699,591,pinesol orange energy allpurpose cleaner 144 fl oz,Home & Kitchen > Household Cleaning > All-Purpose Cleaners
1700,591,"clorox fraganzia multi-purpose cleaner, spring, 40 fluid ounces",Home & Kitchen > Household Cleaning > All-Purpose Cleaners
1701,591,anywhere hard surface spray clorox,Home & Kitchen > Household Cleaning > All-Purpose Cleaners
1702,591,cleaner lemon fantastik scrubbing bubbles,Home & Kitchen > Household Cleaning > All-Purpose Cleaners
1703,591,disinfectant all purpose cleaner 4 in 1 spray lemon breeze lysol,Home & Kitchen > Household Cleaning > All-Purpose Cleaners
1704,591,web.mrs meyers liquid dsh sp 16oz,Home & Kitchen > Household Cleaning > All-Purpose Cleaners
1705,591,total with bleach cleaner soft scrub 25.04 fl oz,Home & Kitchen > Household Cleaning > All-Purpose Cleaners
1706,591,disinfecting multi-surface cleaner lemongrass citrus seventh generation,Home & Kitchen > Household Cleaning > All-Purpose Cleaners
1707,591,"pine-sol® lemon fresh cleaner, 144 oz.",Home & Kitchen > Household Cleaning > All-Purpose Cleaners
1708,591,bio cleaner (3) multi-purpose cleaning clay & 2 cloths /lavender,Home & Kitchen > Household Cleaning > All-Purpose Cleaners
1709,591,bio cleaner multi-purpose cleaner & microfiber 4-piece kit,Home & Kitchen > Household Cleaning > All-Purpose Cleaners
1710,591,dazz whole-house starter cleaning kit with spray bottles,Home & Kitchen > Household Cleaning > All-Purpose Cleaners
1711,591,"Lysol Concentrate Disinfectant, Original Scent, 12 oz, Case of 6",Home & Kitchen > Household Cleaning > All-Purpose Cleaners
1712,591,"Windex Multi-Surface Cleaner Spray, Lavender and Peach Blossom, 26 Ounce",Home & Kitchen > Household Cleaning > All-Purpose Cleaners
1713,591,"super iron out li0624pn rust stain remover-24 fluid ounces-multi purpose rust stain remover for toilets, white laundry, sinks, tubs, tile and more",Home & Kitchen > Household Cleaning > All-Purpose Cleaners
1714,591,"mrs. meyer's clean day multi-surface concentrated cleaner, basil, 32 fluid ounce (pack of 2)",Home & Kitchen > Household Cleaning > All-Purpose Cleaners
1715,591,j. r. watkins all purpose cleaner-orange citrus-24 oz.,Home & Kitchen > Household Cleaning > All-Purpose Cleaners
1716,591,ProOptic Complete Optics Care and Cleaning Kit,Home & Kitchen > Household Cleaning > All-Purpose Cleaners
1717,591,"clorox clean-up cleaner with bleach spray bottle, 32 fluid ounces (pack of 3)",Home & Kitchen > Household Cleaning > All-Purpose Cleaners
1718,591,whip-it earth friendly miracle cleaner multi-purpose pre-mixed spray - 32 fl oz,Home & Kitchen > Household Cleaning > All-Purpose Cleaners
1719,591,"eco-me all purpose cleaner, lemon fresh, 32 fluid ounce",Home & Kitchen > Household Cleaning > All-Purpose Cleaners
1720,591,Caldrea All-Purpose Cleanser - 32 oz - Lavender Pine - 2 pk,Home & Kitchen > Household Cleaning > All-Purpose Cleaners
1721,591,"pine-sol cleaner disinfectant deodorizer, 144 oz. bottle, 3/carton",Home & Kitchen > Household Cleaning > All-Purpose Cleaners
1722,591,johnson s c inc 70790 sc johnson pledge multi-surface spray cleaner,Home & Kitchen > Household Cleaning > All-Purpose Cleaners
1723,591,"fabuloso 153041 lavender fragrance all purpose cleaner, 56 oz bottle (case of 6)",Home & Kitchen > Household Cleaning > All-Purpose Cleaners
1724,591,puracy natural all purpose,Home & Kitchen > Household Cleaning > All-Purpose Cleaners
1725,591,clean day all purpose cleaner- basil mrs meyers 32 oz liquid new,Home & Kitchen > Household Cleaning > All-Purpose Cleaners
1726,591,"simple green 11001 clean building all-purpose concentrate cleaner, 1 gallon bottle",Home & Kitchen > Household Cleaning > All-Purpose Cleaners
1727,591,"better life all-purpose cleaner, unscented, 32 ounces (pack of 2)",Home & Kitchen > Household Cleaning > All-Purpose Cleaners
1728,591,the honest company - honest multi-surface cleaner white grapefruit - 26 oz.,Home & Kitchen > Household Cleaning > All-Purpose Cleaners
1729,591,sc johnson windex outdoor starter kit 70117,Home & Kitchen > Household Cleaning > All-Purpose Cleaners
1730,591,MILLIARD Borax Powder - Multi-Purpose Cleaner 1 lb. Bag,Home & Kitchen > Household Cleaning > All-Purpose Cleaners
1731,591,ettore 17066 all-purpose,Home & Kitchen > Household Cleaning > All-Purpose Cleaners
1732,591,"32oz concentrate fresh scent- kleen free naturally, natural, non-toxic, enzyme solution and multi-purpose product, cleaner, laundry additive and more.",Home & Kitchen > Household Cleaning > All-Purpose Cleaners
1733,591,clorox 35419 pine-sol 144-ounce all-purpose cleaner bottle (case of 3),Home & Kitchen > Household Cleaning > All-Purpose Cleaners
1734,591,"pine-sol 97301 commercial solutions liquid cleaner, 144 fl oz bottle, lavender",Home & Kitchen > Household Cleaning > All-Purpose Cleaners
1735,591,Shaklee® Basic-G® Concentrated Germicide (1 Quart),Home & Kitchen > Household Cleaning > All-Purpose Cleaners
1736,591,"CrystalClear, D-Solv9 Pond Cleaner, 64 Ounces",Home & Kitchen > Household Cleaning > All-Purpose Cleaners
1737,591,"krud kutter rc32 red clay stain remover, 32-ounce",Home & Kitchen > Household Cleaning > All-Purpose Cleaners
1738,591,bgb incubation disinfectant,Home & Kitchen > Household Cleaning > All-Purpose Cleaners
1739,591,"dapple all purpose cleaner spray, lavender, 30 fluid ounce",Home & Kitchen > Household Cleaning > All-Purpose Cleaners
1740,591,"2 pk, lysol all-purpose cleaner trigger, lemon breeze scent, 32 fl. oz",Home & Kitchen > Household Cleaning > All-Purpose Cleaners
1741,591,"greenworks all purpose cleaner, 32 fluid ounce spray bottle (pack of 3)",Home & Kitchen > Household Cleaning > All-Purpose Cleaners
1742,591,"comet cleanser with bleach, 25 oz. (pack of 2)",Home & Kitchen > Household Cleaning > All-Purpose Cleaners
1743,591,"Pine-Sol 35418 Multi-Surface Cleaner, Pine Scent, 144-Ounce Bottle (Case of 3)",Home & Kitchen > Household Cleaning > All-Purpose Cleaners
1744,591,"general electric wx10x320 cerama bryte grease remover, 2 ounce bottle",Home & Kitchen > Household Cleaning > All-Purpose Cleaners
1745,591,m30 amazing stain remover (soft citrus scent)- 14 oz,Home & Kitchen > Household Cleaning > All-Purpose Cleaners
1746,591,"goo gone, two 3oz bottles",Home & Kitchen > Household Cleaning > All-Purpose Cleaners
1747,591,mill wax pinball machine playfield cleaner and polish,Home & Kitchen > Household Cleaning > All-Purpose Cleaners
1748,591,"MRS MEYERS Room Freshener, Geranium, 8 Fluid Ounce",Home & Kitchen > Household Cleaning > All-Purpose Cleaners
1749,591,petsafe wee care enzyme cleaning solution,Home & Kitchen > Household Cleaning > All-Purpose Cleaners
1750,591,30 oz. Liquid Muscle All Purpose Surface Cleaner with Dawn Lavender Scent,Home & Kitchen > Household Cleaning > All-Purpose Cleaners
1751,591,Bio-clean Hard Water Stain Remover 20 Oz,Home & Kitchen > Household Cleaning > All-Purpose Cleaners
1752,591,"soft scrub with bleach cleanser, 24-ounce (pack of 3) health and beauty",Home & Kitchen > Household Cleaning > All-Purpose Cleaners
1753,591,"Fabuloso 4307 Long Lasting Fragrance, 1 gallon, Lavender",Home & Kitchen > Household Cleaning > All-Purpose Cleaners
1754,591,"Mrs. Meyer's Clean Day Multi Surface Everyday Cleaner, Radish Scent, 16 Ounce (Pack of 3)",Home & Kitchen > Household Cleaning > All-Purpose Cleaners
1755,591,MILLIARD Borax Powder - Multi-Purpose Cleaner 5 lb. Bag,Home & Kitchen > Household Cleaning > All-Purpose Cleaners
1756,591,Pledge Multi Surface Cleaner Spray with Glade Shimmering Spruce 9.7 OZ (6 Pack),Home & Kitchen > Household Cleaning > All-Purpose Cleaners
1757,591,"Endust Multi-Surface Dusting and Cleaning Spray, 10 Ounce",Home & Kitchen > Household Cleaning > All-Purpose Cleaners
1758,591,soft scrub cleanser with bleach-36 oz.,Home & Kitchen > Household Cleaning > All-Purpose Cleaners
