,category_id,description,category_path
2970,591,"method all purpose cleaning spray, pink grapefruit, 28 fluid ounce, pack of 4 health and beauty",Home & Kitchen > Household Cleaning > All-Purpose Cleaners
2971,591,thymes frasier fir all purpose cleaner 16 oz,Home & Kitchen > Household Cleaning > All-Purpose Cleaners
2972,591,"3 pack, soft scrub gel with bleach 20 ounce ea.",Home & Kitchen > Household Cleaning > All-Purpose Cleaners
2973,591,"bar keepers friend spray + foam cleaner, 25.4 fl oz pump spray bottle, for most hard surfaces, 1 bottle",Home & Kitchen > Household Cleaning > All-Purpose Cleaners
2974,591,"lysol power and free multipurpose cleaner, oxy scent, 22 ounce",Home & Kitchen > Household Cleaning > All-Purpose Cleaners
2975,591,barkeeper's friend liquid cleanser-26 oz,Home & Kitchen > Household Cleaning > All-Purpose Cleaners
2976,591,"formula 409 all purpose cleaner spray bottle, lemon, 22 fluid ounces",Home & Kitchen > Household Cleaning > All-Purpose Cleaners
2977,591,windex multi-surface cleaner vinegar trigger - 26 oz,Home & Kitchen > Household Cleaning > All-Purpose Cleaners
2978,591,"super iron out io30n rust stain remover-1 pound 12 ounces-multi purpose rust stain remover for toilets, sinks, tubs, tile, showers, washers and more",Home & Kitchen > Household Cleaning > All-Purpose Cleaners
2979,591,endust lens cleaner 26200,Home & Kitchen > Household Cleaning > All-Purpose Cleaners
2980,591,"mr clean with febreze fresh scent multipurpose liquid, lavender vanilla & comfort, 32-ounce",Home & Kitchen > Household Cleaning > All-Purpose Cleaners
2981,591,surfy 32 oz : all surface cleaner,Home & Kitchen > Household Cleaning > All-Purpose Cleaners
2982,591,procter & gamble 16352 mr. clean with febreze all-purpose cleaner,Home & Kitchen > Household Cleaning > All-Purpose Cleaners
2983,591,clorox green works natural all purpose cleaner 132oz,Home & Kitchen > Household Cleaning > All-Purpose Cleaners
2984,591,j. r. watkins room spray - aloe & green tea - 4 oz,Home & Kitchen > Household Cleaning > All-Purpose Cleaners
2985,591,"simple green 19024 crystal industrial cleaner/degreaser, 24oz trigger spray",Home & Kitchen > Household Cleaning > All-Purpose Cleaners
2986,591,stain solver oxygen bleach cleaner (2.2 pounds),Home & Kitchen > Household Cleaning > All-Purpose Cleaners
2987,591,"2 pack swiffer wet jet multi purpose cleaner with febreze, lavendar vanilla & comfort new",Home & Kitchen > Household Cleaning > All-Purpose Cleaners
2988,591,"Formula 409 00889-2pack Antibacterial All-Purpose Cleaner, 32 oz (Pack of 2) by Formula 409",Home & Kitchen > Household Cleaning > All-Purpose Cleaners
2989,591,pinesol multisurface cleaner original 40 fluid ounce bottle,Home & Kitchen > Household Cleaning > All-Purpose Cleaners
2990,591,"seventh generation disinfecting multi-surface cleaner, lemongrass citrus 26 fl oz (768 ml)",Home & Kitchen > Household Cleaning > All-Purpose Cleaners
2991,591,Pine-Sol COX41772EA All Purpose Cleaner,Home & Kitchen > Household Cleaning > All-Purpose Cleaners
2992,591,"mrs. meyers clean day all purpose cleaner, 32 oz,,32 oz 2 pack",Home & Kitchen > Household Cleaning > All-Purpose Cleaners
2993,591,the honest company kids,Home & Kitchen > Household Cleaning > All-Purpose Cleaners
2994,591,"Citra Solv Natural Cleaner and Degreaser Concentrate Valencia Orange, 8 Fluid",Home & Kitchen > Household Cleaning > All-Purpose Cleaners
2995,591,"soft scrub with bleach cleanser, 36-ounce (pack of 3) health and beauty",Home & Kitchen > Household Cleaning > All-Purpose Cleaners
2996,591,"24oz read to use spray original kleen free naturally, natural, non-toxic, enzyme solution and multi-purpose product, cleaner, laundry additive and more.",Home & Kitchen > Household Cleaning > All-Purpose Cleaners
2997,591,bar keepers friend® cleanser & polish: 15 oz,Home & Kitchen > Household Cleaning > All-Purpose Cleaners
2998,591,"greenworks all purpose cleaner spray, 32 ounce",Home & Kitchen > Household Cleaning > All-Purpose Cleaners
2999,591,"mrs. meyer's clean day all purpose cleaner, basil, 32 fluid ounce (pack of 2)",Home & Kitchen > Household Cleaning > All-Purpose Cleaners
3000,591,"better life what-ever! unscented, 32 ounce (pack of 2) health and beauty",Home & Kitchen > Household Cleaning > All-Purpose Cleaners
3001,591,summit brands to06n softener cleaner citric acid 1.5 lb,Home & Kitchen > Household Cleaning > All-Purpose Cleaners
3002,591,Legacy of Clean® L.O.C.® Multi-Purpose Cleaner - The world's most versatile,Home & Kitchen > Household Cleaning > All-Purpose Cleaners
3003,591,j. r. watkins all purpose cleaner-lavender-24 oz.,Home & Kitchen > Household Cleaning > All-Purpose Cleaners
3004,591,windex ammonia streak-free 2 l,Home & Kitchen > Household Cleaning > All-Purpose Cleaners
3005,591,"soft scrub with bleach cleanser mountain breeze, 24 ounce (pack of 3)",Home & Kitchen > Household Cleaning > All-Purpose Cleaners
3006,591,"Tilex Mildew Root Penetrator & Remover, 32 Ounce (CLO00263) Category: Insect Control",Home & Kitchen > Household Cleaning > All-Purpose Cleaners
3007,591,simple green 13005 all-purpose cleaner - gallon,Home & Kitchen > Household Cleaning > All-Purpose Cleaners
3008,591,lucasol tanning bed cleaner disinfectant 4 oz concentrate,Home & Kitchen > Household Cleaning > All-Purpose Cleaners
3009,591,earth friendly products ice,Home & Kitchen > Household Cleaning > All-Purpose Cleaners
3010,591,"mrs. meyer's clean day counter top spray, lemon verbena, 16 ounce bottle",Home & Kitchen > Household Cleaning > All-Purpose Cleaners
3011,591,"mr. clean liquid all purpose cleaner with summer citrus, 24 oz",Home & Kitchen > Household Cleaning > All-Purpose Cleaners
3012,591,mr. clean multi-surfaces liquid with febreze freshness lavender and vanilla 40-fluid ounces bottles (pack of 6),Home & Kitchen > Household Cleaning > All-Purpose Cleaners
3013,591,"Lysol Power and Free Tap Top Multi-Purpose Cleaner Pump, Citrus Sparkle, 14 Ounce",Home & Kitchen > Household Cleaning > All-Purpose Cleaners
3014,591,windex® antibacterial multi-surface cleaner,Home & Kitchen > Household Cleaning > All-Purpose Cleaners
3015,591,goo gone - 2oz bottle,Home & Kitchen > Household Cleaning > All-Purpose Cleaners
3016,591,"Puracy 100% Natural All Purpose Cleaner (2 Pack), #1 Customer Rated All-Purpose Household Cleaner, Streak-Free",Home & Kitchen > Household Cleaning > All-Purpose Cleaners
3017,591,"Windex CB704336 Multi-Surface Disinfectant Cleaner, Citrus, 1 gal Bottle (Pack of 4)",Home & Kitchen > Household Cleaning > All-Purpose Cleaners
3018,591,Bugs N All - Professional Strength Multi Surface Vehicle Cleaner. 4oz. Concentrate Makes 2 Quarts. Includes an,Home & Kitchen > Household Cleaning > All-Purpose Cleaners
3019,591,"bi-o-kleen all purpose cleaner spray and wipe, 32 ounce",Home & Kitchen > Household Cleaning > All-Purpose Cleaners
3020,591,Legacy Of Clean L.O.C. Multi-Purpose Cleaner New Formula 33.8 fl. oz,Home & Kitchen > Household Cleaning > All-Purpose Cleaners
3021,591,clorox 35419 pine-sol,Home & Kitchen > Household Cleaning > All-Purpose Cleaners
3022,591,"mrs. meyer's clean day all purpose cleaner, lemon verbena, 32 fluid ounce (pack of 2)",Home & Kitchen > Household Cleaning > All-Purpose Cleaners
3023,591,ettore 17050 all purpose,Home & Kitchen > Household Cleaning > All-Purpose Cleaners
3024,591,"goo gone 8 oz. - removes stickers, grease, gum, tar, crayon & tape",Home & Kitchen > Household Cleaning > All-Purpose Cleaners
3025,591,simple green all-purpose; cleaner 32oz bottle [price is per bottle] new,Home & Kitchen > Household Cleaning > All-Purpose Cleaners
3026,591,"soft scrub with bleach cleanser, 24 ounce",Home & Kitchen > Household Cleaning > All-Purpose Cleaners
3027,591,formula 409 all-purpose,Home & Kitchen > Household Cleaning > All-Purpose Cleaners
3028,591,simple green 30501 d pro 5,Home & Kitchen > Household Cleaning > All-Purpose Cleaners
3029,591,"better life what-ever! unscented, 32 ounce (pack of 2) new",Home & Kitchen > Household Cleaning > All-Purpose Cleaners
3030,591,"simple green 13421 pro hd heavy duty cleaner, 1 gallon bottle",Home & Kitchen > Household Cleaning > All-Purpose Cleaners
3031,591,"Compressed Air Duster Can Cleaner 1229 Non-toxic & No Bitternt 3.5oz. Stop the Build-up of Dust in Your Electronics, Clogging up the Cooling Fan.",Home & Kitchen > Household Cleaning > All-Purpose Cleaners
3032,591,"SALE Moisture Absorber, Odorless, Rid of Damp Air, Dehumidifying Bag 18oz absorbs 36oz Water. Perfect for Automobile, Basement, Car",Home & Kitchen > Household Cleaning > All-Purpose Cleaners
3033,591,"Sun & Earth Natural All- purpose Cleaner, Light Citrus 22 fl. Oz (pack of 6)",Home & Kitchen > Household Cleaning > All-Purpose Cleaners
3034,591,"Formula 409 All Purpose Cleaner Spray and S.O.S All Surface Scrubber Sponge Value Pack, 5.01 Pound",Home & Kitchen > Household Cleaning > All-Purpose Cleaners
3035,591,"Star brite Rust Stain Remover, 22 oz",Home & Kitchen > Household Cleaning > All-Purpose Cleaners
3036,591,jo toy cleaner 7 oz,Home & Kitchen > Household Cleaning > All-Purpose Cleaners
3037,591,"mrs. meyer's clean day multi-surface concentrated cleaner, lemon verbena, 32 fluid ounce (pack of 2) health and beauty",Home & Kitchen > Household Cleaning > All-Purpose Cleaners
3038,591,"method all purpose natural surface cleaner, white rosemary, 28 fluid ounce (pack of 8)",Home & Kitchen > Household Cleaning > All-Purpose Cleaners
3039,591,gel-gloss cleaner & polish acrylic aerosol 12 oz,Home & Kitchen > Household Cleaning > All-Purpose Cleaners
3040,591,"earth friendly products proline pl9706/04 orange plus rtu all-purpose cleaner-degreaser, 1 gallon bottles (case of 4)",Home & Kitchen > Household Cleaning > All-Purpose Cleaners
3041,591,"Better Life Kitchen and Bath Scrubber, 16 Ounces (Pack of 2)",Home & Kitchen > Household Cleaning > All-Purpose Cleaners
3042,591,HOMEBASIX 40138GRL Home Care Labs Greased Lightning,Home & Kitchen > Household Cleaning > All-Purpose Cleaners
3043,591,"mrs. meyer's clean day all purpose cleaner, basil, 32-ounce bottles (case of 6)",Home & Kitchen > Household Cleaning > All-Purpose Cleaners
3044,591,"Lysol Disinfectant Clean and Fresh, Multi-Surface Cleaner,Sparkling Lemon & Sunflower Essence Scent, 144 Ounce",Home & Kitchen > Household Cleaning > All-Purpose Cleaners
3045,591,"lysol concentrate disinfectant, 12 ounce",Home & Kitchen > Household Cleaning > All-Purpose Cleaners
3046,591,clorox clo 30772,Home & Kitchen > Household Cleaning > All-Purpose Cleaners
3047,591,"dap 63004 tsp all purpose cleaner, 4-pound",Home & Kitchen > Household Cleaning > All-Purpose Cleaners
3048,591,"more spray + foam cleaner, 25.4oz spray bottle",Home & Kitchen > Household Cleaning > All-Purpose Cleaners
3049,591,"lysol power & fresh multi-surface cleaner, sparking lemon sunflower essence scent, 52 ounce",Home & Kitchen > Household Cleaning > All-Purpose Cleaners
3050,591,dr. bronner's sal suds liquid -- 1 gallon,Home & Kitchen > Household Cleaning > All-Purpose Cleaners
3051,591,natural homelogic - all-purpose cleaner citrus grove - 16 oz.,Home & Kitchen > Household Cleaning > All-Purpose Cleaners
3052,591,johnson s c inc 70790 sc johnson pledge multi-surface spray cleaner new,Home & Kitchen > Household Cleaning > All-Purpose Cleaners
3053,591,fantastik heavy duty all purpose cleaner - 32 oz - 2 pk,Home & Kitchen > Household Cleaning > All-Purpose Cleaners
3054,591,clorox® hydrogen peroxide,Home & Kitchen > Household Cleaning > All-Purpose Cleaners
3055,591,tilex 00263 mildew root,Home & Kitchen > Household Cleaning > All-Purpose Cleaners
3056,591,"Lysol Clean & Fresh Multi-Surface Cleaner, Sparkling Lemon and Sunflower Essence",Home & Kitchen > Household Cleaning > All-Purpose Cleaners
3057,591,biokleen super concentrated all purpose cleaner -- 32 fl oz,Home & Kitchen > Household Cleaning > All-Purpose Cleaners
3058,591,citra solv - cleaner & degreaser natural concentrate lavender bergamot - 8 oz.,Home & Kitchen > Household Cleaning > All-Purpose Cleaners
3059,591,"Scotts All Purpose Flower and Vegetable Continuous Release Plant Food, 3-Pound",Home & Kitchen > Household Cleaning > All-Purpose Cleaners
3060,591,multipurpose microfiber fast drying travel gym towels 3pack 13x29320gsm1green1purple1light blue,Home & Kitchen > Household Cleaning > All-Purpose Cleaners
3061,591,Johnson S C Inc 12565 Raid Max Fogger SOLD BY Prefectmart THANK YOU,Home & Kitchen > Household Cleaning > All-Purpose Cleaners
3062,591,clorox/home cleaning 01683 hard surface cleaner,Home & Kitchen > Household Cleaning > All-Purpose Cleaners
3063,591,"J.R. Watkins Cleaner, All Purpose, White Tea and Bamboo, 24 Fluid Ounce",Home & Kitchen > Household Cleaning > All-Purpose Cleaners
3064,591,"EasyCare 20064 Scaletec Plus Descaler and Stain Remover, 64 oz. Bottle by EasyCare",Home & Kitchen > Household Cleaning > All-Purpose Cleaners
3065,591,Record Cleaning Velvet Brush and Stylus Cleaner with Anti Static Solution Fluid for Removing Dust from Record-Happy,Home & Kitchen > Household Cleaning > All-Purpose Cleaners
3066,591,Mrs. Meyer's Clean Day Multi-Surface Concentrate - 32 oz - Honeysuckle,Home & Kitchen > Household Cleaning > All-Purpose Cleaners
3067,591,Enforcer Prod. ZUMARB32 Zep Commercial Marble Cleaner 32 OZ,Home & Kitchen > Household Cleaning > All-Purpose Cleaners
3068,591,bar keepers friendâ® cleanser & polish 12 oz (pack of 4),Home & Kitchen > Household Cleaning > All-Purpose Cleaners
3069,591,"method all purpose cleaning spray,french lavender, 28 fluid ounce (pack of 4)",Home & Kitchen > Household Cleaning > All-Purpose Cleaners
3070,591,"urine-off multi-purpose odor and stain remover, 32 oz spray",Home & Kitchen > Household Cleaning > All-Purpose Cleaners
3071,591,dr. bronner's sal suds all purpose liquid cleaner 16 oz,Home & Kitchen > Household Cleaning > All-Purpose Cleaners
3072,591,"Hexol Concentrated General Household Cleaner and Deodorant, 128 oz.",Home & Kitchen > Household Cleaning > All-Purpose Cleaners
3073,591,"mr. clean multi surfaces antibacterial liquid cleaner, summer citrus, 128 oz",Home & Kitchen > Household Cleaning > All-Purpose Cleaners
3074,591,"Boardwalk 513155 Clear/Red HDPE Trigger Spray Bottle, 32 oz. (Pack of 3)",Home & Kitchen > Household Cleaning > All-Purpose Cleaners
3075,591,mr. clean with febreze freshness meadows & rain multi-surface cleaner 40 oz,Home & Kitchen > Household Cleaning > All-Purpose Cleaners
3076,591,"Lysol Max Cover Disinfectant Mist, Garden After Rain, 15 Ounce",Home & Kitchen > Household Cleaning > All-Purpose Cleaners
3077,591,Mrs. Meyer's Clean Day Surface Scrub - Lemon Verbana - 11 oz - 2 pk,Home & Kitchen > Household Cleaning > All-Purpose Cleaners
3078,591,red devil #0261 tsp/90 heavy duty cleaner 1 lb.,Home & Kitchen > Household Cleaning > All-Purpose Cleaners
3079,591,Pledge Multi-Surface 9.7oz - Lavender and Peach Blossom (Pack of 6),Home & Kitchen > Household Cleaning > All-Purpose Cleaners
3080,591,melaleuca sol-u-mel 3-in-1 cleaner - original scent - 8oz,Home & Kitchen > Household Cleaning > All-Purpose Cleaners
3081,591,pine-sol multi-surface,Home & Kitchen > Household Cleaning > All-Purpose Cleaners
3082,591,"mr. clean with febreze fresh scent lavender and vanilla, 32-fluid ounces bottles (pack of 6)",Home & Kitchen > Household Cleaning > All-Purpose Cleaners
3083,591,camco 40207 tastepure spring fresh water system cleaner and deodorizer - 1 gallon,Home & Kitchen > Household Cleaning > All-Purpose Cleaners
3084,591,johnson s c inc - deep wds off mini spritz,Home & Kitchen > Household Cleaning > All-Purpose Cleaners
3085,591,clorox healthcare bleach,Home & Kitchen > Household Cleaning > All-Purpose Cleaners
3086,591,multi-purpose kitchen,Home & Kitchen > Household Cleaning > All-Purpose Cleaners
3087,591,"PURELL Professional Surface Disinfectant 1 Gallon, Fresh Citrus, RTU (Pack of 4)",Home & Kitchen > Household Cleaning > All-Purpose Cleaners
3088,591,6 pack 28oz comet powder cleanser with bleach,Home & Kitchen > Household Cleaning > All-Purpose Cleaners
3089,591,marrywindix multipurpose,Home & Kitchen > Household Cleaning > All-Purpose Cleaners
3090,591,"clorox/home cleaning 04587 stain remover, 22 oz",Home & Kitchen > Household Cleaning > All-Purpose Cleaners
3091,591,odoban 958902-12 bio bowl non para urinal block (12 per case),Home & Kitchen > Household Cleaning > All-Purpose Cleaners
3092,591,Set of 3 ALAZCO All Purpose Stainless Steel Fine Mesh Strainer Colander Sieve with Handle,Home & Kitchen > Household Cleaning > All-Purpose Cleaners
3093,591,johnson s c inc 51528,Home & Kitchen > Household Cleaning > All-Purpose Cleaners
3094,591,"Simple Green 14010 Industrial Cleaner & Degreaser, Concentrated, Lemon, 1 gal Bottle",Home & Kitchen > Household Cleaning > All-Purpose Cleaners
3095,591,"j.r. watkins natural all purpose cleaner, grapefruit, 24 ounce (pack of 6)",Home & Kitchen > Household Cleaning > All-Purpose Cleaners
3096,591,"pine-sol sparkling wave multi-surface cleaner, 48-fluid ounce bottles (pack of 8)",Home & Kitchen > Household Cleaning > All-Purpose Cleaners
3097,591,"poolstone pool and spa cleaning block, 3-pack",Home & Kitchen > Household Cleaning > All-Purpose Cleaners
3098,591,simple green all-purpose; cleaner 32oz bottle [price is per bottle],Home & Kitchen > Household Cleaning > All-Purpose Cleaners
3099,591,"DiverseyTM 4277285 - OXIVIR TB ONE-STEP DISINFECTANT CLEANER, 32 OZ BOTTLE,",Home & Kitchen > Household Cleaning > All-Purpose Cleaners
3100,591,Dunn E-Z All Purpose Cleaner - Starter Set - Concentrated Formula - 32 ounce,Home & Kitchen > Household Cleaning > All-Purpose Cleaners
3101,591,biokleen all purpose,Home & Kitchen > Household Cleaning > All-Purpose Cleaners
3102,591,"24oz read to use spray original kleen free naturally, natural, non-toxic, enzyme solution and multi-purpose product, cleaner, laundry additive and mor",Home & Kitchen > Household Cleaning > All-Purpose Cleaners
3103,591,"babyganics multi surface cleaner, fragrance free, 32 oz (pack of 3), packaging may vary",Home & Kitchen > Household Cleaning > All-Purpose Cleaners
3104,591,comet cleanser with bleach 25 oz can - 2 pack,Home & Kitchen > Household Cleaning > All-Purpose Cleaners
3105,591,terracycle all purpose plant food (2l),Home & Kitchen > Household Cleaning > All-Purpose Cleaners
3106,591,Method All Purpose Natural Surface Cleaning Spray - 28 oz - Lemon Mint - 2 pk,Home & Kitchen > Household Cleaning > All-Purpose Cleaners
3107,591,lysol power and fresh all purpose cleaner - pourable lavender orchid 40 oz,Home & Kitchen > Household Cleaning > All-Purpose Cleaners
3108,591,b-brite cleaner,Home & Kitchen > Household Cleaning > All-Purpose Cleaners
3109,591,zardoz notwax 600ml super z natural citrus base cleaner,Home & Kitchen > Household Cleaning > All-Purpose Cleaners
3110,591,bon ami 04030 powder cleaner (pack of 2),Home & Kitchen > Household Cleaning > All-Purpose Cleaners
3111,591,"mrs. meyer's clean day multi-surface everday cleaner, geranium, 16 fluid ounce",Home & Kitchen > Household Cleaning > All-Purpose Cleaners
3112,591,multi-surface mr. clean spray,Home & Kitchen > Household Cleaning > All-Purpose Cleaners
3113,591,"KRUD KUTTER ES32H Exterior Siding Cleaner, 32-Ounce",Home & Kitchen > Household Cleaning > All-Purpose Cleaners
3114,591,"16oz concentrate- kleen free naturally, natural, non-toxic, enzyme solution and multi-purpose product, cleaner, laundry additive and more. many people",Home & Kitchen > Household Cleaning > All-Purpose Cleaners
3115,591,"mr. clean multi-surfaces summer citrus antibacterial liquid cleaner, 128 fluid ounce bottle",Home & Kitchen > Household Cleaning > All-Purpose Cleaners
3116,591,"method all purpose natural surface cleaning spray, cucumber, 28 oz, 2 pk",Home & Kitchen > Household Cleaning > All-Purpose Cleaners
3117,591,"64oz ready to use refill. kleen free naturally, natural, non-toxic, enzyme solution and multi-purpose product, cleaner, laundry additive and more. new",Home & Kitchen > Household Cleaning > All-Purpose Cleaners
3118,591,"spray nine 26810 multi-purpose cleaner and disinfectant, 32 oz.",Home & Kitchen > Household Cleaning > All-Purpose Cleaners
3119,591,"Ettore 17018 All-Purpose Squeegee, 18-Inch",Home & Kitchen > Household Cleaning > All-Purpose Cleaners
3120,591,"Windex Outdoor All-In-One Window Cleaner Pads Refill, 2 Count (Pack of 1)",Home & Kitchen > Household Cleaning > All-Purpose Cleaners
3121,591,phoenix record cleaning spray for vinyl (8 oz.),Home & Kitchen > Household Cleaning > All-Purpose Cleaners
3122,591,lestoil concentrated heavy duty cleaner-48 oz,Home & Kitchen > Household Cleaning > All-Purpose Cleaners
3123,591,"Mrs. Meyer's Clean Day All Purpose Cleaner, Lemon Verbena, 32 Fluid Ounce (Pack of 3)",Home & Kitchen > Household Cleaning > All-Purpose Cleaners
3124,591,mrs. meyer's multi-surface,Home & Kitchen > Household Cleaning > All-Purpose Cleaners
3125,591,Protect All 62016 All Surface Cleaner with 16 oz. Trigger Pump Bottle,Home & Kitchen > Household Cleaning > All-Purpose Cleaners
3126,591,"method all purpose natural surface cleaner limited edition, white rosemary, 28 ounce (pack of 8)",Home & Kitchen > Household Cleaning > All-Purpose Cleaners
3127,591,goo gone remover cleaner bottle 32 oz,Home & Kitchen > Household Cleaning > All-Purpose Cleaners
3128,591,"Mrs. Meyer's Clean Day Multi-Purpose Spray, Lavender,16 Oz(2 Pack)",Home & Kitchen > Household Cleaning > All-Purpose Cleaners
3129,591,"mrs. meyer's clean day multi-surface concentrated cleaner, lemon verbena, 32 fluid ounce (pack of 2)",Home & Kitchen > Household Cleaning > All-Purpose Cleaners
3130,591,"Spic and Span 58775 Disinfecting All-Purpose Cleaner, Fresh Scent, 32 oz. Spray Bottle (Pack of 8)",Home & Kitchen > Household Cleaning > All-Purpose Cleaners
3131,591,"star brite instant hull cleaner, 32 ounce",Home & Kitchen > Household Cleaning > All-Purpose Cleaners
3132,591,mr. clean liquid all purpose cleaner with febreze hawaiian aloha 40 oz(pack of 3),Home & Kitchen > Household Cleaning > All-Purpose Cleaners
3133,591,fabuloso 153300 lavender,Home & Kitchen > Household Cleaning > All-Purpose Cleaners
3134,591,"Bar Keepers Friend 11727 MORE Spray and Foam Cleanser, 25.4-Ounce Spray Bottle (Case of 6)",Home & Kitchen > Household Cleaning > All-Purpose Cleaners
3135,591,"murphy's all purpose, multi-surface cleaner, 32 ounce (pack of 6)",Home & Kitchen > Household Cleaning > All-Purpose Cleaners
3136,591,Dr. Bronner's - Fair Trade and Organic Sal Suds Liquid Cleaner - 16 oz,Home & Kitchen > Household Cleaning > All-Purpose Cleaners
3137,591,j. r. watkins all purpose cleaner-aloe & green tea-24 oz.,Home & Kitchen > Household Cleaning > All-Purpose Cleaners
3138,591,"ClearMax Steam Cleaning and Sanitizing System - Best for Cleaning Hard Areas, Bathroom & counters -Tough on Bacteria",Home & Kitchen > Household Cleaning > All-Purpose Cleaners
3139,591,"128oz fresh and clean scent ready to use refill. kleen free naturally, natural, non-toxic, enzyme solution and multi-purpose product, cleaner, laundry",Home & Kitchen > Household Cleaning > All-Purpose Cleaners
3140,591,"sunnyside 64216 tsp tri-sodium phosphate all purpose cleaner, 1-pound",Home & Kitchen > Household Cleaning > All-Purpose Cleaners
3141,591,Pine Sol Pine Sol Cleaner - Original - 100 oz - 2 pk,Home & Kitchen > Household Cleaning > All-Purpose Cleaners
3142,591,"Clorox Pine-Sol All-Purpose Cleaner, Lemon Scent, 144oz. Bottle, 3/carton",Home & Kitchen > Household Cleaning > All-Purpose Cleaners
3143,591,"babyganics all purpose multi-surface cleaner, citrus, 32 fl. oz. (pack of 3), packaging may vary",Home & Kitchen > Household Cleaning > All-Purpose Cleaners
3144,591,"EcoScraps LS14IN3201 Natural Lawn Saver Urine Spot Treatment, 32-Ounce",Home & Kitchen > Household Cleaning > All-Purpose Cleaners
3145,591,"Mr. Clean Multipurpose Liquid with Febreze Freshness, Hawaiian Aloha Scent,",Home & Kitchen > Household Cleaning > All-Purpose Cleaners
3146,591,"2 pack swiffer wet jet multi purpose cleaner with febreze, lavendar vanilla & comfort health and beauty new",Home & Kitchen > Household Cleaning > All-Purpose Cleaners
3147,591,"Grease Monkey Wipes Heavy Duty Multi Purpose Cleaning Wipes, 25 Count Canister, Model: 602067653, Sport & Outdoor",Home & Kitchen > Household Cleaning > All-Purpose Cleaners
3148,591,Pyoure 7% Hydrogen Peroxide Cleaning Concentrate All Purpose Cleaner & Pet Stain Remover Makes 80 fl. oz. of 1.5% H2O2 Cleaning Spray (White Tea & Gin,Home & Kitchen > Household Cleaning > All-Purpose Cleaners
3149,591,"clorox anywhere hard surface daily sanitizing spray, 22 fluid ounces",Home & Kitchen > Household Cleaning > All-Purpose Cleaners
3150,591,Dreft All Purpose Cleaner - 22 oz - 2 pk,Home & Kitchen > Household Cleaning > All-Purpose Cleaners
3151,591,simple green all-purpose cleaner - 140 oz.,Home & Kitchen > Household Cleaning > All-Purpose Cleaners
3152,591,"simple green 13412 extreme aircraft and precision cleaner, 32oz trigger spray",Home & Kitchen > Household Cleaning > All-Purpose Cleaners
3153,591,instagone stain remover,Home & Kitchen > Household Cleaning > All-Purpose Cleaners
3154,591,simple green all-purpose,Home & Kitchen > Household Cleaning > All-Purpose Cleaners
3155,591,"Goo Gone Pro Power, 24 fl oz.",Home & Kitchen > Household Cleaning > All-Purpose Cleaners
3156,591,ajax cleaner (pack of 2),Home & Kitchen > Household Cleaning > All-Purpose Cleaners
3157,591,"fabuloso 04373 ocean cool scent all purpose cleaner, 1 gallon",Home & Kitchen > Household Cleaning > All-Purpose Cleaners
3158,591,mrs meyer's clean day all-purpose cleaner (1 bottle 32 oz),Home & Kitchen > Household Cleaning > All-Purpose Cleaners
3159,591,"odoban 927062-q, 1 quart bioodor bacteria digester",Home & Kitchen > Household Cleaning > All-Purpose Cleaners
