,category_id,description,category_path
4379,591,method all purpose natural surface cleaning spray-cucumber-28 oz,Home & Kitchen > Household Cleaning > All-Purpose Cleaners
4380,591,"pledge multi-surface trigger spray, clean citrus scent-16 oz.",Home & Kitchen > Household Cleaning > All-Purpose Cleaners
4381,591,windex multi-surface cleaner - 23 oz - vinegar,Home & Kitchen > Household Cleaning > All-Purpose Cleaners
4382,591,scrub free mold & mildew stain remover - 32 oz,Home & Kitchen > Household Cleaning > All-Purpose Cleaners
4383,591,mrs. meyer's clean day multi-surface concentrated cleaner - 32 oz - lavender -,Home & Kitchen > Household Cleaning > All-Purpose Cleaners
4384,591,biokleen all purpose cleaner super concentrated-32 oz.,Home & Kitchen > Household Cleaning > All-Purpose Cleaners
4385,591,the laundress surface cleaner - 16 oz,Home & Kitchen > Household Cleaning > All-Purpose Cleaners
4386,591,"method orla keily limited edition all purpose cleaner, tomato vine, 28oz",Home & Kitchen > Household Cleaning > All-Purpose Cleaners
4387,591,the laundress all purpose cleaning concentrate - 16 oz,Home & Kitchen > Household Cleaning > All-Purpose Cleaners
4388,591,greenworks outdoor power,Home & Kitchen > Household Cleaning > All-Purpose Cleaners
4389,591,ecoscraps 64 oz all-purpose lawn organic liquid,Home & Kitchen > Household Cleaning > All-Purpose Cleaners
4390,591,multi-purpose & multi-surface cleaner,Home & Kitchen > Household Cleaning > All-Purpose Cleaners
4391,591,dr. bronner's sal suds all purpose cleaner liquid 32 oz liquid,Home & Kitchen > Household Cleaning > All-Purpose Cleaners
4392,591,comet powder with bleach - (14oz),Home & Kitchen > Household Cleaning > All-Purpose Cleaners
4393,591,mr. clean summer citrus all purpose liquid cleaner - (40fl oz),Home & Kitchen > Household Cleaning > All-Purpose Cleaners
4394,591,"clorox clean-up cleaner + bleach spray, fresh scent - (32fl oz)",Home & Kitchen > Household Cleaning > All-Purpose Cleaners
4395,591,seventh generation baby natural nursery & toy cleaner - (18oz),Home & Kitchen > Household Cleaning > All-Purpose Cleaners
4396,591,pine-sol original disinfectant cleaner - (40fl oz),Home & Kitchen > Household Cleaning > All-Purpose Cleaners
4397,591,"mr. clean multi-purpose spray with febreze, meadows & rain scent - (32oz)",Home & Kitchen > Household Cleaning > All-Purpose Cleaners
4398,591,"lysol power & free multi-surface cleaner, citrus spray - (22fl oz)",Home & Kitchen > Household Cleaning > All-Purpose Cleaners
4399,591,"lysol all-purpose cleaner spray, lemon breeze scent, case - (12ct, 32fl oz ea)",Home & Kitchen > Household Cleaning > All-Purpose Cleaners
4400,591,soft scrub liquid cleanser with bleach - (24fl oz),Home & Kitchen > Household Cleaning > All-Purpose Cleaners
4401,591,"windex multi-surface spray, vinegar - (26fl oz)",Home & Kitchen > Household Cleaning > All-Purpose Cleaners
4402,591,sanitizer,Home & Kitchen > Household Cleaning > All-Purpose Cleaners
4403,591,formula 409 cleanerdegreaser 1 gal 4 ct,Home & Kitchen > Household Cleaning > All-Purpose Cleaners
4404,591,"mr. clean - multi-surface antibacterial cleaner, summer citrus scent, 24 oz bottle - 9/carton",Home & Kitchen > Household Cleaning > All-Purpose Cleaners
4405,591,"flash multi-purpose cleaner (lavender scent, 9l)",Home & Kitchen > Household Cleaning > All-Purpose Cleaners
4406,591,formula 409 all-purpose cleaner value pack - 32 fl. oz. spray bottle + 180 fl. oz. refill,Home & Kitchen > Household Cleaning > All-Purpose Cleaners
4407,591,lysol power & fresh multi surface cleaner lavender & orchid essence 40 oz btl,Home & Kitchen > Household Cleaning > All-Purpose Cleaners
4408,591,lysol multi-purpose cleaner with hydrogen peroxide 32 oz btl,Home & Kitchen > Household Cleaning > All-Purpose Cleaners
4409,591,soft scrub bleach clean gel cleanser trigger spray 23 oz btl,Home & Kitchen > Household Cleaning > All-Purpose Cleaners
4410,591,pine-sol all-purpose liquid cleaner original 40 oz btl,Home & Kitchen > Household Cleaning > All-Purpose Cleaners
4411,591,method all-purpose surface cleaner pink grapefruit natural trigger spray 28 oz btl,Home & Kitchen > Household Cleaning > All-Purpose Cleaners
4412,591,nature's promise free from all-purpose cleaner lime grapefruit 32 oz btl,Home & Kitchen > Household Cleaning > All-Purpose Cleaners
4413,591,nature's promise free from all-purpose cleaner scented 32 oz btl,Home & Kitchen > Household Cleaning > All-Purpose Cleaners
4414,591,windex 2l disinfectant refill - 67.6 fl. oz.,Home & Kitchen > Household Cleaning > All-Purpose Cleaners
4415,591,fantastik multi purpose cleaner - 32 fl. oz.,Home & Kitchen > Household Cleaning > All-Purpose Cleaners
4416,591,swiffer wetjet cleaner refill multi purpose open window fresh scent - liter,Home & Kitchen > Household Cleaning > All-Purpose Cleaners
4417,591,method all purpose natural surface cleaner french lavender spray - 28 fl. oz.,Home & Kitchen > Household Cleaning > All-Purpose Cleaners
4418,591,bundle: ultimate powerhouse,Home & Kitchen > Household Cleaning > All-Purpose Cleaners
4419,591,honest 26-ounce multi-surface cleaner,Home & Kitchen > Household Cleaning > All-Purpose Cleaners
4420,591,"pledge pledge multi surface spray, hawaiian breeze, 9.1 fl oz",Home & Kitchen > Household Cleaning > All-Purpose Cleaners
4421,591,"pine-sol pine-sol all purpose cleaner pine, 144 fl oz",Home & Kitchen > Household Cleaning > All-Purpose Cleaners
4422,591,mrs. meyer's clean day mrs meyers clean day multi surface cleaner spray lavender... lavender 16 fz,Home & Kitchen > Household Cleaning > All-Purpose Cleaners
4423,591,"formula 409 formula 409 all purpose cleaner, 22 oz",Home & Kitchen > Household Cleaning > All-Purpose Cleaners
4424,591,"biokleen biokleen all purpose cleaner concentrate, grapefruit seed...",Home & Kitchen > Household Cleaning > All-Purpose Cleaners
4425,591,spic and span comet cleanser 14oz pwdr cleaner (pack of 4),Home & Kitchen > Household Cleaning > All-Purpose Cleaners
4426,591,formula 409 formula 409 antibacterial all purpose cleaner concentrate...,Home & Kitchen > Household Cleaning > All-Purpose Cleaners
4427,591,"seventh generation seventh generation concentrate all purpose cleaner, free ...",Home & Kitchen > Household Cleaning > All-Purpose Cleaners
4428,591,lysol lysol power white & shine multi purpose cleaner with blea...,Home & Kitchen > Household Cleaning > All-Purpose Cleaners
4429,591,"lysol lysol all purpose cleaner, trigger fresh mountain, 32 fl oz",Home & Kitchen > Household Cleaning > All-Purpose Cleaners
4430,591,"mr. clean mr. clean antibacterial multi surface cleaner spray, 32 f...",Home & Kitchen > Household Cleaning > All-Purpose Cleaners
4431,591,lysol lysol clean & fresh multi-surface cleaner - pourable cher...,Home & Kitchen > Household Cleaning > All-Purpose Cleaners
4432,591,"dr. bronner's dr. bronner's sal suds, 32 ounce - liquid cleaner",Home & Kitchen > Household Cleaning > All-Purpose Cleaners
4433,591,"pledge pledge multi surface cleaner spray citrus, 16 fl oz",Home & Kitchen > Household Cleaning > All-Purpose Cleaners
4434,591,lysol lysol clean & fresh multi-surface cleaner waterfall splas...,Home & Kitchen > Household Cleaning > All-Purpose Cleaners
4435,591,"Home Armor FG502 Instant Mold and Mildew Stain Remover, Trigger Spray 32-Ounce",Home & Kitchen > Household Cleaning > All-Purpose Cleaners
4436,591,basic h organic super cleaning concentrate,Home & Kitchen > Household Cleaning > All-Purpose Cleaners
4437,591,"karcher t300 hard surface cleaner for electric power pressure washers (deck, driveway, patio, tool accessory)",Home & Kitchen > Household Cleaning > All-Purpose Cleaners
4438,591,"simple green 73434010 all purpose cleaner with lemon fragrance, 1 gallon bottle",Home & Kitchen > Household Cleaning > All-Purpose Cleaners
4439,591,"soft scrub gel with bleach, 28.60 ounce",Home & Kitchen > Household Cleaning > All-Purpose Cleaners
4440,591,method all purpose cleaning,Home & Kitchen > Household Cleaning > All-Purpose Cleaners
4441,591,offex white board cleaner,Home & Kitchen > Household Cleaning > All-Purpose Cleaners
4442,591,"bar keepers friendâ® cleanser & polish: 12 oz, pk-3",Home & Kitchen > Household Cleaning > All-Purpose Cleaners
4443,591,Clorox Pine-Sol 40174,Home & Kitchen > Household Cleaning > All-Purpose Cleaners
4444,591,Fantastik Heavy Duty All Purpose Cleaner -1 Gal and 1 32 oz - 2 pk,Home & Kitchen > Household Cleaning > All-Purpose Cleaners
4445,591,"mrs. meyer's clean day multi-surface everyday cleaner, lemon verbena, 16 fluid ounce (pack of 3)",Home & Kitchen > Household Cleaning > All-Purpose Cleaners
4446,591,fantastik scrubbing bubbles with bleach spray - 32 oz - 2 pk,Home & Kitchen > Household Cleaning > All-Purpose Cleaners
4447,591,earth friendly parsley plus all surface cleaner -- 22 fl oz,Home & Kitchen > Household Cleaning > All-Purpose Cleaners
4448,591,"mr. clean with gain multi surface cleaner, original fresh scent, 40 ounce",Home & Kitchen > Household Cleaning > All-Purpose Cleaners
4449,591,"FloraCraft Floral Accessories Silk Floral Cleaner, 22-Ounce Spray Bottle",Home & Kitchen > Household Cleaning > All-Purpose Cleaners
4450,591,"finish line multi-degreaser bicycle cleaner & degreaser, 1 gallon jug",Home & Kitchen > Household Cleaning > All-Purpose Cleaners
4451,591,bar keepers friend® cleanser & polish: 15 oz new,Home & Kitchen > Household Cleaning > All-Purpose Cleaners
4452,591,rust stain remover,Home & Kitchen > Household Cleaning > All-Purpose Cleaners
4453,591,"sierra dawn campsuds nalgene all purpose cleaner, 4-ounce",Home & Kitchen > Household Cleaning > All-Purpose Cleaners
4454,591,"star brite bilge cleaner, 32-ounce",Home & Kitchen > Household Cleaning > All-Purpose Cleaners
4455,591,"Bar Keepers Friend All-Purpose Cleaner, Stain Remover and Polish, Powder, 12-Ounces (Pack of 4)",Home & Kitchen > Household Cleaning > All-Purpose Cleaners
4456,591,"Spic and Span PGC 58773 Disinfecting All-Purpose Spray and Glass Cleaner, Fresh Scent, 1 gal Bottle",Home & Kitchen > Household Cleaning > All-Purpose Cleaners
4457,591,"LA's Totally Awesome All Purpose Concentrated Cleaner, 32 oz",Home & Kitchen > Household Cleaning > All-Purpose Cleaners
4458,591,"Diversey Oxivir Tb Cleaner (RTU, 32-Ounce, Case of 12)",Home & Kitchen > Household Cleaning > All-Purpose Cleaners
4459,591,Method All Purpose Natural Surface Cleaning Spray - 28 oz - Pink Grapefruit,Home & Kitchen > Household Cleaning > All-Purpose Cleaners
4460,591,better life all-purpose,Home & Kitchen > Household Cleaning > All-Purpose Cleaners
4461,591,"goo gone painter's pal, 24",Home & Kitchen > Household Cleaning > All-Purpose Cleaners
4462,591,"pine-sol all purpose liquid cleaner, lavender, 28 oz",Home & Kitchen > Household Cleaning > All-Purpose Cleaners
4463,591,2-pack goop multi purpose hand cleaner- orange power (5 oz tube),Home & Kitchen > Household Cleaning > All-Purpose Cleaners
4464,591,germicidal cleaner concentrate,Home & Kitchen > Household Cleaning > All-Purpose Cleaners
4465,591,Steel Glo Stainless Steel and Copper Cleaner 14 oz (Pack of 12),Home & Kitchen > Household Cleaning > All-Purpose Cleaners
4466,591,"Diversey Virex Tb Ready-To-Use Disinfectant Cleaner, (32-Ounce, 12-Pack)",Home & Kitchen > Household Cleaning > All-Purpose Cleaners
4467,591,"soft scrub total all purpose bath and kitchen cleanser, 24 oz",Home & Kitchen > Household Cleaning > All-Purpose Cleaners
4468,591,Static Schmatic Solution,Home & Kitchen > Household Cleaning > All-Purpose Cleaners
4469,591,"3 Pk, Clorox Fraganzia Multi-Purpose Cleaner, Lavendeer w/ Eucalyptus & Mint, 28 Fl. Oz.",Home & Kitchen > Household Cleaning > All-Purpose Cleaners
4470,591,fantastik scrubbing bubbles,Home & Kitchen > Household Cleaning > All-Purpose Cleaners
4471,591,kids'n pets all-purpose stain & odor remover - ...,Home & Kitchen > Household Cleaning > All-Purpose Cleaners
4472,591,planet all-purpose spray cleaner - 22 oz,Home & Kitchen > Household Cleaning > All-Purpose Cleaners
4473,591,"de-luxe maison all-purpose spray cleaner, lavender spruce - 17 fl oz",Home & Kitchen > Household Cleaning > All-Purpose Cleaners
4474,591,20 mule team borax natural laundry booster & multi-purpose household cleaner - 76 oz,Home & Kitchen > Household Cleaning > All-Purpose Cleaners
4475,591,"fantastik scrubbing bubbles cleaner, lemon - 32 oz",Home & Kitchen > Household Cleaning > All-Purpose Cleaners
4476,591,"swiffer wet jet multi-purpose cleaner solution, open window fresh - 42.2 oz",Home & Kitchen > Household Cleaning > All-Purpose Cleaners
4477,591,"clorox clean-up cleaner spray, fresh scent - 32 fl oz",Home & Kitchen > Household Cleaning > All-Purpose Cleaners
4478,591,"biokleen soy cream cleaner for kitchen & bathroom, fresh lime - 32 fl oz",Home & Kitchen > Household Cleaning > All-Purpose Cleaners
4479,591,pledge® multi surface glade® rainshower scent everyday cleaner 9.7 oz,Home & Kitchen > Household Cleaning > All-Purpose Cleaners
4480,591,method all purpose cleaner pink grapefruit 28 oz,Home & Kitchen > Household Cleaning > All-Purpose Cleaners
4481,591,lysol 14 floz tap top citrus,Home & Kitchen > Household Cleaning > All-Purpose Cleaners
4482,591,bar keepers friend multipurpose household cleanser & polish 21 oz,Home & Kitchen > Household Cleaning > All-Purpose Cleaners
4483,591,mule team borax all natural detergent booster & multi-purpose household cleaner 65 oz,Home & Kitchen > Household Cleaning > All-Purpose Cleaners
4484,591,soft scrub total all purpose bath and kitchen cleanser lemon scent 36 oz,Home & Kitchen > Household Cleaning > All-Purpose Cleaners
4485,591,lysol power & free multi-purpose cleaner with hydrogen peroxide 22 oz,Home & Kitchen > Household Cleaning > All-Purpose Cleaners
4486,591,goo gone citrus household cleaners - 8 oz,Home & Kitchen > Household Cleaning > All-Purpose Cleaners
4487,591,method lime & sea salt all purpose cleaner 28 oz - 3 pack ecom,Home & Kitchen > Household Cleaning > All-Purpose Cleaners
4488,591,"mr. clean magic eraser extra power household cleaning pads, 4 count",Home & Kitchen > Household Cleaning > All-Purpose Cleaners
4489,591,"kids 'n' pets instant all-purpose stain and odor remover, 27 fl oz 9.5"" x 3.3"" x 3.2"" 2.35",Home & Kitchen > Household Cleaning > All-Purpose Cleaners
4490,591,"clorox fraganzia forest dew multi-purpose cleaner, 40 fl oz",Home & Kitchen > Household Cleaning > All-Purpose Cleaners
4491,591,johnson s c inc 20510 freshforce shoe freshener-2.2oz shoe freshener,Home & Kitchen > Household Cleaning > All-Purpose Cleaners
4492,591,fabuloso spring in bloom multipurpose cleaner 56 fl oz,Home & Kitchen > Household Cleaning > All-Purpose Cleaners
4493,591,sonic wave ultrasonic 16 oz polishing jewelry eyeglass cleaner cd2800,Home & Kitchen > Household Cleaning > All-Purpose Cleaners
4494,591,ajax oxygen bleach powder cleanser cpm14278ea,Home & Kitchen > Household Cleaning > All-Purpose Cleaners
4495,591,mr. clean meadows rain multisurface cleaner with febreze freshness 48 fl oz,Home & Kitchen > Household Cleaning > All-Purpose Cleaners
4496,591,"swiffer wetjet gain original scent multi-purpose cleaner, 42.2 oz",Home & Kitchen > Household Cleaning > All-Purpose Cleaners
4497,591,mr. clean summer citrus multisurfaces antibacterial liquid cleaner 40 oz,Home & Kitchen > Household Cleaning > All-Purpose Cleaners
4498,591,zep commercial allaround oxy cleaner 32 oz rtu,Home & Kitchen > Household Cleaning > All-Purpose Cleaners
4499,591,"pine-sol multi-surface cleaner, original, 40 ounce bottle",Home & Kitchen > Household Cleaning > All-Purpose Cleaners
4500,591,lysol clean and fresh multisurface cleaner lavender orchid scent 48 ounce,Home & Kitchen > Household Cleaning > All-Purpose Cleaners
4501,591,pinesol multisurface cleaner original 100 ounce bottle,Home & Kitchen > Household Cleaning > All-Purpose Cleaners
4502,591,babyganics the grime fighter all purpose cleaner 32 oz. - lavender one color,Home & Kitchen > Household Cleaning > All-Purpose Cleaners
4503,591,wetjet multi-purpose solution refill with febreze lavender & vanilla swiffer 42.2 fl oz,Home & Kitchen > Household Cleaning > All-Purpose Cleaners
4504,591,multi-purpose cleaner oxygen splash lysol power & free 22.0 fl oz,Home & Kitchen > Household Cleaning > All-Purpose Cleaners
4505,591,multi-purpose cleaner citrus sparkle zest lysol power & free,Home & Kitchen > Household Cleaning > All-Purpose Cleaners
4506,591,all purpose cleaner basil mrs. meyer's clean day 32.0 fl oz,Home & Kitchen > Household Cleaning > All-Purpose Cleaners
4507,591,"pine-sol(reg) commercial solutions, 60 oz.",Home & Kitchen > Household Cleaning > All-Purpose Cleaners
4508,591,instagone s/4 multipurpose stain remover & (1) 22 oz. spray bo,Home & Kitchen > Household Cleaning > All-Purpose Cleaners
4509,591,earth brite 18.5 oz. natural all-purpose cleaner 2-pack with 6 sponges and supreme cloth - lavender,Home & Kitchen > Household Cleaning > All-Purpose Cleaners
4510,591,professor amos bom home and auto 4-piece cleaning and polishing kit,Home & Kitchen > Household Cleaning > All-Purpose Cleaners
4511,591,professor amos shock it clean extreme 96 fl. oz. lavender mint concentrate kit,Home & Kitchen > Household Cleaning > All-Purpose Cleaners
4512,591,"pine-sol® cleaner disinfectant and deodorizer, pin",Home & Kitchen > Household Cleaning > All-Purpose Cleaners
4513,591,pakit botlle with trigger 32oz trigger spray orange,Home & Kitchen > Household Cleaning > All-Purpose Cleaners
4514,591,formula 409reg cleaner degreaser disinfectant 128 oz refill,Home & Kitchen > Household Cleaning > All-Purpose Cleaners
4515,591,"green works® all-purpose cleaner, refill, 64 oz.",Home & Kitchen > Household Cleaning > All-Purpose Cleaners
4516,591,swifferreg wet jet multipurpose refill solution with gain,Home & Kitchen > Household Cleaning > All-Purpose Cleaners
4517,591,"diversey™ stride® all purpose neutral concentrated cleaner, citrus scent, 5 gallon bib",Home & Kitchen > Household Cleaning > All-Purpose Cleaners
4518,591,dc cleaner fantastik 3.8l,Home & Kitchen > Household Cleaning > All-Purpose Cleaners
4519,591,clorox green worksreg naturally derived allpurpose cleaner 32 oz,Home & Kitchen > Household Cleaning > All-Purpose Cleaners
4520,591,dansk the burbs collection melamine grass green all-purpose bowl green,Home & Kitchen > Household Cleaning > All-Purpose Cleaners
4521,591,84.4 oz. multipurpose wetjet solution bundle,Home & Kitchen > Household Cleaning > All-Purpose Cleaners
4522,591,26 oz. liquid cleanser,Home & Kitchen > Household Cleaning > All-Purpose Cleaners
4523,591,1-gal. safer limestone cleaner,Home & Kitchen > Household Cleaning > All-Purpose Cleaners
4524,591,1-gal. concentrated no rinse eco-friendly roof and exterior surface cleaner,Home & Kitchen > Household Cleaning > All-Purpose Cleaners
4525,591,pro hd 128 oz. professional-grade heavy-duty cleaner,Home & Kitchen > Household Cleaning > All-Purpose Cleaners
4526,591,32 oz. concentrated all-purpose cleaner,Home & Kitchen > Household Cleaning > All-Purpose Cleaners
4527,591,8.5 oz. perfect sink fresh and clean cleaner and polish,Home & Kitchen > Household Cleaning > All-Purpose Cleaners
4528,591,5-count febreeze spring & renewal all-purpose cleaner,Home & Kitchen > Household Cleaning > All-Purpose Cleaners
4529,591,128-ozlavender all-purpose cleaner,Home & Kitchen > Household Cleaning > All-Purpose Cleaners
4530,591,urine remover stain & odor 32-fl oz all-purpose cleaner,Home & Kitchen > Household Cleaning > All-Purpose Cleaners
4531,591,outdoor pro 22-oz regular all-purpose cleaner,Home & Kitchen > Household Cleaning > All-Purpose Cleaners
4532,591,1.5-lb all purpose flower and vegetable food water-soluble granules (24-8-16),Home & Kitchen > Household Cleaning > All-Purpose Cleaners
4533,591,goo gone spray gel,Home & Kitchen > Household Cleaning > All-Purpose Cleaners
4534,591,mrs. meyer's® clean day 16 oz. aromatherapeutic multi-surface spray in geranium clear 16 oz,Home & Kitchen > Household Cleaning > All-Purpose Cleaners
4535,591,bissellï¿½ steam shot(tm) hard surface cleaner black/grey,Home & Kitchen > Household Cleaning > All-Purpose Cleaners
4536,591,babyganics® 32 oz. citrus multi surface cleaner clear 32 oz,Home & Kitchen > Household Cleaning > All-Purpose Cleaners
4537,591,isonic® ultrasonic cleaning solution concentrate csgj01 blue,Home & Kitchen > Household Cleaning > All-Purpose Cleaners
4538,591,"fantastik scented spray cleaner, lemon - 32 oz",Home & Kitchen > Household Cleaning > All-Purpose Cleaners
4539,591,pine sol pine sol cleaner - sparkling wave - 60 oz,Home & Kitchen > Household Cleaning > All-Purpose Cleaners
4540,591,"pine sol pine sol cleaner, original - 24 oz - 2 pk",Home & Kitchen > Household Cleaning > All-Purpose Cleaners
4541,591,"barkeeper's friend liquid cleanser, 26 oz-2 pack",Home & Kitchen > Household Cleaning > All-Purpose Cleaners
4542,591,"better life all purpose cleaner, clary sage & citrus - 32 oz",Home & Kitchen > Household Cleaning > All-Purpose Cleaners
4543,591,babyganics grime fighter all purpose cleaner - fragrance free,Home & Kitchen > Household Cleaning > All-Purpose Cleaners
4544,591,babyganics all purpose cleaner - fragrance free - 32 oz - 2 pk,Home & Kitchen > Household Cleaning > All-Purpose Cleaners
4545,591,mrs. meyer's clean day multi-surface everyday cleaner - geranium - 16 oz - 3 pk,Home & Kitchen > Household Cleaning > All-Purpose Cleaners
4546,591,mrs. meyer's clean day multi-surface everyday cleaner - 16 oz - mum,Home & Kitchen > Household Cleaning > All-Purpose Cleaners
4547,591,"pine sol pine sol cleaner, original - 100 oz - 100 ct",Home & Kitchen > Household Cleaning > All-Purpose Cleaners
4548,591,lysol all purpose cleaner + bleach spray-32 oz,Home & Kitchen > Household Cleaning > All-Purpose Cleaners
4549,591,pine sol cleaner-wildflower blast-48 oz,Home & Kitchen > Household Cleaning > All-Purpose Cleaners
4550,591,dapple baby all purpose wipes - fragrance-free - 75 ct - 2 pk,Home & Kitchen > Household Cleaning > All-Purpose Cleaners
4551,591,fantastik scrubbing bubbles with bleach spray cleaner-32 oz.,Home & Kitchen > Household Cleaning > All-Purpose Cleaners
4552,591,formula 409 all purpose cleaner spray - 32 oz - original,Home & Kitchen > Household Cleaning > All-Purpose Cleaners
4553,591,natures miracle disinfectant multisurface cleaner spray 32 fl oz,Home & Kitchen > Household Cleaning > All-Purpose Cleaners
4554,591,mrs. meyer's clean day multi-surface concentrate honeysuckle -- 32 fl oz,Home & Kitchen > Household Cleaning > All-Purpose Cleaners
4555,591,greenshield organic all-purpose cleaner lemon -- 32 fl oz,Home & Kitchen > Household Cleaning > All-Purpose Cleaners
4556,591,dr. bronner's sal suds all purpose cleaner -- 16 fl oz,Home & Kitchen > Household Cleaning > All-Purpose Cleaners
4557,591,formula 409 antibacterial all purpose cleaner 1.0 qt 0.66 lbs,Home & Kitchen > Household Cleaning > All-Purpose Cleaners
4558,591,fantastik scrubbing bubbles heavy duty cleaner 32.0 oz 1.00 lbs,Home & Kitchen > Household Cleaning > All-Purpose Cleaners
4559,591,"lysol all purpose cleaner lemon breeze, 32 oz 32.0 oz 2.40 lbs",Home & Kitchen > Household Cleaning > All-Purpose Cleaners
4560,591,"method all purpose cleaner spray, lime + sea salt-28 oz",Home & Kitchen > Household Cleaning > All-Purpose Cleaners
4561,591,"ecover all purpose cleaner, 32 oz",Home & Kitchen > Household Cleaning > All-Purpose Cleaners
4562,591,"mrs. meyer's clean day multi-surface everyday cleaner, peppermint - (16fl oz)",Home & Kitchen > Household Cleaning > All-Purpose Cleaners
4563,591,windex multi-surface antibacterial spray - (26fl oz),Home & Kitchen > Household Cleaning > All-Purpose Cleaners
4564,591,"lysol power & free multi-surface cleaner, citrus spray - (22oz)",Home & Kitchen > Household Cleaning > All-Purpose Cleaners
4565,591,"method multi-surface all purpose cleaner, french lavender - (28fl oz)",Home & Kitchen > Household Cleaning > All-Purpose Cleaners
4566,591,"method all purpose cleaner, pink grapefruit - (28fl oz)",Home & Kitchen > Household Cleaning > All-Purpose Cleaners
4567,591,soft scrub lemon liquid cleanser - (24fl oz),Home & Kitchen > Household Cleaning > All-Purpose Cleaners
4568,591,"lysol all-purpose cleaner spray, lemon breeze scent - (32oz)",Home & Kitchen > Household Cleaning > All-Purpose Cleaners
4569,591,pine-sol 175 oz,Home & Kitchen > Household Cleaning > All-Purpose Cleaners
4570,591,fabuloso all-purpose cleaner - lavender scent - 1 gal. - 4 pk.,Home & Kitchen > Household Cleaning > All-Purpose Cleaners
4571,591,fabuloso,Home & Kitchen > Household Cleaning > All-Purpose Cleaners
4572,591,lysol disinfectant lemon breeze aerosol spray 19 oz can,Home & Kitchen > Household Cleaning > All-Purpose Cleaners
4573,591,swiffer wetjet multi-purpose cleaner open window fresh scent 42.2 oz btl,Home & Kitchen > Household Cleaning > All-Purpose Cleaners
4574,591,mr. clean antibacterial multipurpose liquid cleaner summer citrus 40 oz btl,Home & Kitchen > Household Cleaning > All-Purpose Cleaners
4575,591,guaranteed value scouring cleanser with bleach 21 oz can,Home & Kitchen > Household Cleaning > All-Purpose Cleaners
4576,591,comet with bleach cleanser lemon fresh scratch free 17 oz btl,Home & Kitchen > Household Cleaning > All-Purpose Cleaners
4577,591,mrs. meyer's clean day multi-surface everyday cleaner lavender scent 16 oz btl,Home & Kitchen > Household Cleaning > All-Purpose Cleaners
4578,591,febreze unstopables air freshener shimmer aerosol spray 9.7 oz can,Home & Kitchen > Household Cleaning > All-Purpose Cleaners
4579,591,soft scrub cleanser with bleach squeeze 12 oz btl,Home & Kitchen > Household Cleaning > All-Purpose Cleaners
4580,591,mr. clean multi-surface cleaner with gain original fresh spray 32 oz btl,Home & Kitchen > Household Cleaning > All-Purpose Cleaners
