,category_id,description,category_path
0,591,bar keepers friend 11510 12,Home & Kitchen > Household Cleaning > All-Purpose Cleaners
1,591,Lysol 80313 32 Oz. Fresh Mountain All Purpose Cleaner with Trigger (Case of 12),Home & Kitchen > Household Cleaning > All-Purpose Cleaners
2,591,Mrs. Meyer's - Clean Day Room Freshener Lavender - 8 oz.,Home & Kitchen > Household Cleaning > All-Purpose Cleaners
3,591,"soft scrub with baking soda cleanser, 24 ounce health and beauty",Home & Kitchen > Household Cleaning > All-Purpose Cleaners
4,591,windex multi-surface,Home & Kitchen > Household Cleaning > All-Purpose Cleaners
5,591,comet cleanser with bleach 21oz,Home & Kitchen > Household Cleaning > All-Purpose Cleaners
6,591,mr. clean all purpose cleaner summer citrus scent bottle 40 oz,Home & Kitchen > Household Cleaning > All-Purpose Cleaners
7,591,"murphy's multi surface all-purpose cleaner, 32 ounce",Home & Kitchen > Household Cleaning > All-Purpose Cleaners
8,591,discovery products carbon off cleaner (16-ounce pint),Home & Kitchen > Household Cleaning > All-Purpose Cleaners
9,591,"multipurpose disinfectant spray for cleaning & killing bacteria, fungus & virus - 32 oz",Home & Kitchen > Household Cleaning > All-Purpose Cleaners
10,591,"multi-purpose microfiber fast drying travel gym towels 3-pack 13""x29"" 350gsm(1slate grey+1grape+1 blue orichil)",Home & Kitchen > Household Cleaning > All-Purpose Cleaners
11,591,lysol 40001-202-0033,Home & Kitchen > Household Cleaning > All-Purpose Cleaners
12,591,"Professional All-Purpose Solid Color Chef's Knife, 12.75-Inch Long",Home & Kitchen > Household Cleaning > All-Purpose Cleaners
13,591,stonetech all-purpose daily,Home & Kitchen > Household Cleaning > All-Purpose Cleaners
14,591,"Meltonian All Purpose Cleaner (Liquid), 5 Oz",Home & Kitchen > Household Cleaning > All-Purpose Cleaners
15,591,precious liquid jewelry cleaner - spray on & rinse - 4 ounce bottle,Home & Kitchen > Household Cleaning > All-Purpose Cleaners
16,591,"Holly Suede & Nubuck Care Kit - Cleaner, Protector & Freshener",Home & Kitchen > Household Cleaning > All-Purpose Cleaners
17,591,"swiffer wetjet multi purpose solution, open window fresh scent-42.2 oz., 1.25liter",Home & Kitchen > Household Cleaning > All-Purpose Cleaners
18,591,32oz fantastik/bleach,Home & Kitchen > Household Cleaning > All-Purpose Cleaners
19,591,Clorox Pool&Spa 70050CLX 6-Way Test Strips,Home & Kitchen > Household Cleaning > All-Purpose Cleaners
20,591,mrs. meyer's clean day surface scrub geranium -- 11 oz,Home & Kitchen > Household Cleaning > All-Purpose Cleaners
21,591,mold killertm - quart in stock. all natural plant extract & mineral. winner of the 2013' health education award. made in usa.,Home & Kitchen > Household Cleaning > All-Purpose Cleaners
22,591,dr. bronner's sal suds all purpose liquid cleaner 32 oz,Home & Kitchen > Household Cleaning > All-Purpose Cleaners
23,591,Formula 88 Cleaner & Degreaser (1 Gallon),Home & Kitchen > Household Cleaning > All-Purpose Cleaners
24,591,"Hexol Concentrated General Household Cleaner and Deodorant, 16 oz.",Home & Kitchen > Household Cleaning > All-Purpose Cleaners
25,591,"Professional Lysol Brand III, Disinfectant Spray, Fresh Scent, 19 Ounces (Case of 12)",Home & Kitchen > Household Cleaning > All-Purpose Cleaners
26,591,j. r. watkins all purpose cleaner - 24 oz - lavender,Home & Kitchen > Household Cleaning > All-Purpose Cleaners
27,591,Basic H2 Organic Super Cleaning Concentrate 16oz 473mL Makes 48 Gallons,Home & Kitchen > Household Cleaning > All-Purpose Cleaners
28,591,fabuloso 153041 lavender,Home & Kitchen > Household Cleaning > All-Purpose Cleaners
29,591,"frosch natural lavender universal all purpose cleaner concentrate, 750 ml (pack of 2)",Home & Kitchen > Household Cleaning > All-Purpose Cleaners
30,591,clorox/home cleaning 01100 tilex mold & mildew remover 16 fl oz. health and beauty,Home & Kitchen > Household Cleaning > All-Purpose Cleaners
31,591,"Gear Aid ReviveX Outerwear Pro Cleaner, 12 Ounce",Home & Kitchen > Household Cleaning > All-Purpose Cleaners
32,591,Hot Tub Things Surface & Cover Cleaner 32 Oz - All-Purpose Cleaner for All Your Backyard Accessories,Home & Kitchen > Household Cleaning > All-Purpose Cleaners
33,591,"EasyCare 22064 BeauTec Salt Cell and Tile Cleaner, 64 oz. Bottle by EasyCare",Home & Kitchen > Household Cleaning > All-Purpose Cleaners
34,591,grabgreen all purpose cleaner thyme with fig leaf -- 16 fl oz,Home & Kitchen > Household Cleaning > All-Purpose Cleaners
35,591,"Soft Scrub Advanced Surface Cleanser, 20 Ounce",Home & Kitchen > Household Cleaning > All-Purpose Cleaners
36,591,concrobium mold control bottle 1 gal,Home & Kitchen > Household Cleaning > All-Purpose Cleaners
37,591,"seventh generation disinfecting multi-surface cleaner, lemongrass citrus 26 fl oz (768 ml) health and beauty",Home & Kitchen > Household Cleaning > All-Purpose Cleaners
38,591,"fantastik dra94369ct all-purpose cleaner 1 gal. bottle 4 count, n/a",Home & Kitchen > Household Cleaning > All-Purpose Cleaners
39,591,mrs. meyer's multi surface spray cleaner - orange clove - 16 fl oz,Home & Kitchen > Household Cleaning > All-Purpose Cleaners
40,591,green works natural all-purpose cleaner,Home & Kitchen > Household Cleaning > All-Purpose Cleaners
41,591,goo gone remover citrus,Home & Kitchen > Household Cleaning > All-Purpose Cleaners
42,591,methodã'â® all surface cleaner - mth00005,Home & Kitchen > Household Cleaning > All-Purpose Cleaners
43,591,silk shine plant cleaner 32oz,Home & Kitchen > Household Cleaning > All-Purpose Cleaners
44,591,WATER STAIN REMOVER 14OZ by AMAZ MfrPartNo 11107,Home & Kitchen > Household Cleaning > All-Purpose Cleaners
45,591,ABR Waterless Fireplace Cleaner,Home & Kitchen > Household Cleaning > All-Purpose Cleaners
46,591,"Pine-Sol 35418 Original Scent Cleaner, 144 fl oz Bottle",Home & Kitchen > Household Cleaning > All-Purpose Cleaners
47,591,Babyganics All Purpose Cleaner - Fragrance Free - 32 oz - 2 pk,Home & Kitchen > Household Cleaning > All-Purpose Cleaners
48,591,armor all multipurpose,Home & Kitchen > Household Cleaning > All-Purpose Cleaners
49,591,"Insta Lift QEP-IL12OZSBBX Adhesive Paint Marker Remover and Cleaner, 12-Ounce",Home & Kitchen > Household Cleaning > All-Purpose Cleaners
50,591,mint instant sneaker cleaner 9 oz,Home & Kitchen > Household Cleaning > All-Purpose Cleaners
51,591,"Mrs. Meyer's Multi Surface Spray Cleaner, Honeysuckle scent, 16 Fluid Ounce",Home & Kitchen > Household Cleaning > All-Purpose Cleaners
52,591,method all purpose natural surface cleaner pink grapefruit 28 oz,Home & Kitchen > Household Cleaning > All-Purpose Cleaners
53,591,citra solv - cleaner & degreaser natural concentrate valencia orange - 32 oz.,Home & Kitchen > Household Cleaning > All-Purpose Cleaners
54,591,"the laundress all purpose cleaning concentrate-247 home scent, 16-ounce",Home & Kitchen > Household Cleaning > All-Purpose Cleaners
55,591,"mrs. meyer's clean day multi-surface concentrated cleaner, geranium, 32 fluid ounce",Home & Kitchen > Household Cleaning > All-Purpose Cleaners
56,591,"quick n brite 00032 all purpose cleaning paste, 30 ounce health and beauty",Home & Kitchen > Household Cleaning > All-Purpose Cleaners
57,591,ultra clorox 02490 96-ounce germicidal bleach bottle (case of 6),Home & Kitchen > Household Cleaning > All-Purpose Cleaners
58,591,johnson s c inc 71478 ant baits,Home & Kitchen > Household Cleaning > All-Purpose Cleaners
59,591,"EcoSMART Organic Mosquito Fogger, 14 Oz. (Pack Of 6)",Home & Kitchen > Household Cleaning > All-Purpose Cleaners
60,591,Natural HomeLogic All Purpose Cleaner - Citrus Grove - 16 fl oz,Home & Kitchen > Household Cleaning > All-Purpose Cleaners
61,591,Chapin 1002 48-Ounce Multi-Purpose Sprayer,Home & Kitchen > Household Cleaning > All-Purpose Cleaners
62,591,Dissolve All-Purpose Extra Strength Styling Iron Cleaner,Home & Kitchen > Household Cleaning > All-Purpose Cleaners
63,591,"2 Pk, Lysol Clean & Fresh Multi-Surface Cleaner, Lavender & Orchid Essence Scent, 40 Fl. Oz",Home & Kitchen > Household Cleaning > All-Purpose Cleaners
64,591,"dapple natural based toy and surface cleaner spray, 16.9-fluid ounces, 3 pack",Home & Kitchen > Household Cleaning > All-Purpose Cleaners
65,591,GreenWorks 30012 Surface Cleaner,Home & Kitchen > Household Cleaning > All-Purpose Cleaners
66,591,"mrs. meyer's clean day multi-surface everyday cleaner, basil 16 fluid ounce (pack of 3)",Home & Kitchen > Household Cleaning > All-Purpose Cleaners
67,591,fantastik all purpose cleaner 32oz (pack of 2) new,Home & Kitchen > Household Cleaning > All-Purpose Cleaners
68,591,"mrs. meyer's clean day all purpose cleaner, geranium, 32 ounce bottle",Home & Kitchen > Household Cleaning > All-Purpose Cleaners
69,591,formula 409 antibacterial all-purpose cleaner 32 oz (2 pack),Home & Kitchen > Household Cleaning > All-Purpose Cleaners
70,591,clorox clean up refill,Home & Kitchen > Household Cleaning > All-Purpose Cleaners
71,591,Ettore 45000 All Purpose Pole 5-Feet Interlock 2 Section Pole with Click-Lock Tip,Home & Kitchen > Household Cleaning > All-Purpose Cleaners
72,591,dr. bronner's sal suds all purpose liquid cleaner 16 oz new,Home & Kitchen > Household Cleaning > All-Purpose Cleaners
73,591,Pledge Multi Surface Everyday Cleaner - 9.7 oz - Rainshower,Home & Kitchen > Household Cleaning > All-Purpose Cleaners
74,591,"303 (30202) Multi-Surface Cleaner Trigger Sprayer, 32 Fl. oz.",Home & Kitchen > Household Cleaning > All-Purpose Cleaners
75,591,Formula 409 ALL Purpose Cleaner 32 Oz+180 Oz Refill,Home & Kitchen > Household Cleaning > All-Purpose Cleaners
76,591,"Lysol Clean & Fresh Multi-Surface Cleaner, Sparkling Lemon and Sunflower Essence, 40 oz, Pack of 3",Home & Kitchen > Household Cleaning > All-Purpose Cleaners
77,591,"kaboom stainbuster mold and mildew stain remover, 32 oz",Home & Kitchen > Household Cleaning > All-Purpose Cleaners
78,591,lysol all-purpose cleaner,Home & Kitchen > Household Cleaning > All-Purpose Cleaners
79,591,"JohnsonDiversey Products - Shout Instant Stain Remover Wipes, Individually Wrapped, 80/CT - Sold as 1 CT - Wipes",Home & Kitchen > Household Cleaning > All-Purpose Cleaners
80,591,"meds omg (hos-cs) multi-purpose odor and moisture extractor - 2 lb. bottle, (pack of 12)",Home & Kitchen > Household Cleaning > All-Purpose Cleaners
81,591,Faultless Starch 05108 Bon Ami Liquid Cleanser - 25 Oz.,Home & Kitchen > Household Cleaning > All-Purpose Cleaners
82,591,fabuloso all purpose,Home & Kitchen > Household Cleaning > All-Purpose Cleaners
83,591,simple green 19024 crystal,Home & Kitchen > Household Cleaning > All-Purpose Cleaners
84,591,Greenwald's All Purpose Cleaner Kit - Fresh Citrus Scent - Includes Professional 32-ounce Spray Bottle and Pre-Measured,Home & Kitchen > Household Cleaning > All-Purpose Cleaners
85,591,"greenworks all purpose cleaner, 32-fl. ounces spray bottle (pack of 12)",Home & Kitchen > Household Cleaning > All-Purpose Cleaners
86,591,"greenshield organic, usda organic all-purpose cleaner, 32-ounces (pack of 6)",Home & Kitchen > Household Cleaning > All-Purpose Cleaners
87,591,"j.r. watkins all purpose cleaner, grapefruit, 24 fluid ounce (pack of 6)",Home & Kitchen > Household Cleaning > All-Purpose Cleaners
88,591,Clorox Clean-Up Bleach Cleaner Spray and S.O.S All Surface Scrubber Sponge Value Pack,Home & Kitchen > Household Cleaning > All-Purpose Cleaners
89,591,"soft scrub with bleach, 36",Home & Kitchen > Household Cleaning > All-Purpose Cleaners
90,591,biokleen all purpose cleaner super concentrated-64 oz.,Home & Kitchen > Household Cleaning > All-Purpose Cleaners
91,591,"citra-solv, natural cleaner & degreaser concentrate, valencia orange, 8 fl oz (236 ml)",Home & Kitchen > Household Cleaning > All-Purpose Cleaners
92,591,"mold armor fg532 instant mold and mildew stain remover, trigger spray 16-ounce",Home & Kitchen > Household Cleaning > All-Purpose Cleaners
93,591,Sporicidin Enzyme Mold Stain Cleaner Quart (32oz / 946ml) bottle of concentrate,Home & Kitchen > Household Cleaning > All-Purpose Cleaners
94,591,Thrust-Out Industrial Multi-Purpose Cleaner and Degreaser (KIT),Home & Kitchen > Household Cleaning > All-Purpose Cleaners
95,591,pine sol pine sol cleaner - 40 oz - original - 2 pk,Home & Kitchen > Household Cleaning > All-Purpose Cleaners
96,591,simple green spg14002,Home & Kitchen > Household Cleaning > All-Purpose Cleaners
97,591,"X-14 Professional Instant Mildew Stain Remover, Trigger Spray 32 oz",Home & Kitchen > Household Cleaning > All-Purpose Cleaners
98,591,"simple green 30320 d pro 3 disinfectant/virucidal/fungicidal cleaner, 1 gallon bottle",Home & Kitchen > Household Cleaning > All-Purpose Cleaners
99,591,Bar Keepers Friend 13 Oz Bar Keepers Friend Soft Cleanser,Home & Kitchen > Household Cleaning > All-Purpose Cleaners
100,591,spray & forget super concentrated roof cleaner bottle 32 oz,Home & Kitchen > Household Cleaning > All-Purpose Cleaners
101,591,"Pine-Sol 40125 Liquid Cleaner, 40 fl oz Bottle",Home & Kitchen > Household Cleaning > All-Purpose Cleaners
102,591,a-maz cleaning package - includes 3 items,Home & Kitchen > Household Cleaning > All-Purpose Cleaners
103,591,"wd40 x14 mildew stain remover, gallon - 260240",Home & Kitchen > Household Cleaning > All-Purpose Cleaners
104,591,Meguiar's D10101 Detailer All Purpose Cleaner Gallon,Home & Kitchen > Household Cleaning > All-Purpose Cleaners
105,591,"zud heavy duty cleanser, 6-ounce (pack of 6)",Home & Kitchen > Household Cleaning > All-Purpose Cleaners
106,591,dreft multi surface cleaner,Home & Kitchen > Household Cleaning > All-Purpose Cleaners
107,591,Mrs Meyers Bar Soap Hard 5.3oz Lavender Scent (12 pack),Home & Kitchen > Household Cleaning > All-Purpose Cleaners
108,591,MRS MEYERS - Clean Day Air Freshener - New Improved Style - LEMON VERBENA - 8OZ,Home & Kitchen > Household Cleaning > All-Purpose Cleaners
109,591,walex toi-61776 elemonate grey water deodorizer and cleaner,Home & Kitchen > Household Cleaning > All-Purpose Cleaners
110,591,"formula 409 all purpose cleaner refill bottle, 64 fluid ounces (pack of 6)",Home & Kitchen > Household Cleaning > All-Purpose Cleaners
111,591,natural homelogic all purpose cleaner - citrus grove,Home & Kitchen > Household Cleaning > All-Purpose Cleaners
112,591,"mrs. meyer's multi-surface concentrate basil, 32 fluid ounce (pack of 2)",Home & Kitchen > Household Cleaning > All-Purpose Cleaners
113,591,Multi-purpose Microfibre Fast Drying Travel Gym Towels 3-pack 13 Inch X 29 Inch,Home & Kitchen > Household Cleaning > All-Purpose Cleaners
114,591,"Soft Scrub with Bleach, 36 Fluid Ounce",Home & Kitchen > Household Cleaning > All-Purpose Cleaners
115,591,"Hope's Premium Home Care, Wax Free Counter Top Polish, 8 oz, 1 count",Home & Kitchen > Household Cleaning > All-Purpose Cleaners
116,591,ettore 17014 all-purpose,Home & Kitchen > Household Cleaning > All-Purpose Cleaners
117,591,pine-sol 40125 liquid,Home & Kitchen > Household Cleaning > All-Purpose Cleaners
118,591,Clorox CLO 35600 Tilex 32-Ounce Instant Mildew Remover Bottle (Case of 9),Home & Kitchen > Household Cleaning > All-Purpose Cleaners
119,591,"puracy 100% natural all purpose cleaner (2 pack), #1 customer rated all-purpose household cleaner, streak-free & non-toxic - developed by doctors, saf health and beauty",Home & Kitchen > Household Cleaning > All-Purpose Cleaners
120,591,mrs. meyer's multi-surface cleaner 32 oz,Home & Kitchen > Household Cleaning > All-Purpose Cleaners
121,591,"clorox company 35419 pine sol solution, 180-ounce, lemon fresh",Home & Kitchen > Household Cleaning > All-Purpose Cleaners
122,591,"Frosch Natural Lavender Multi-Surface Sanitizing Cleaner Spray Bottle, 500ml (Pack of 2)",Home & Kitchen > Household Cleaning > All-Purpose Cleaners
123,591,all purpose cleaner -- gallon,Home & Kitchen > Household Cleaning > All-Purpose Cleaners
124,591,"full circle come clean natural cleaning set, fc10111",Home & Kitchen > Household Cleaning > All-Purpose Cleaners
125,591,Lysol Multi-Purpose Cleaner w/ Hydrogen Peroxide - 22 oz - Citrus Sparkle Zest,Home & Kitchen > Household Cleaning > All-Purpose Cleaners
126,591,ettore 17016 all-purpose,Home & Kitchen > Household Cleaning > All-Purpose Cleaners
127,591,seventh generation disinfecting multi-surface cleaner - 26 oz - lemongrass & citrus - 2 pk,Home & Kitchen > Household Cleaning > All-Purpose Cleaners
128,591,Simple Green All-Purpose Cleaner 4 oz. Concentrated - Pack of 3,Home & Kitchen > Household Cleaning > All-Purpose Cleaners
129,591,spic & span 56844 comet mildew stain remover,Home & Kitchen > Household Cleaning > All-Purpose Cleaners
130,591,greased lightning multi purpose cleaner trigger spray 32 oz,Home & Kitchen > Household Cleaning > All-Purpose Cleaners
131,591,"mrs. meyer's clean day all purpose cleaner, lemon verbena, 32 oz-2 pack",Home & Kitchen > Household Cleaning > All-Purpose Cleaners
132,591,"3 Pk, Pine-Sol Multi-Surface Cleaner, Mandarin Sunrise Scent, 28 Fl. Oz",Home & Kitchen > Household Cleaning > All-Purpose Cleaners
133,591,pledge multi surface antibacterial cleaner,Home & Kitchen > Household Cleaning > All-Purpose Cleaners
134,591,Original Pine-Sol All-Purpose Cleaner (Pack of 3),Home & Kitchen > Household Cleaning > All-Purpose Cleaners
135,591,"fantastik with scrubbing bubbles bleach spray cleaner, 32 oz (2 pack)",Home & Kitchen > Household Cleaning > All-Purpose Cleaners
136,591,misty beauty,Home & Kitchen > Household Cleaning > All-Purpose Cleaners
137,591,"Clorox Anywhere Hard Surface Daily Sanitizing Spray, 22 Fluid Ounces (Pack",Home & Kitchen > Household Cleaning > All-Purpose Cleaners
138,591,citrasolv natural cleaner and degreaser lavender bergamont -- 8 fl oz,Home & Kitchen > Household Cleaning > All-Purpose Cleaners
139,591,Mrs Meyers Clean Day Mmcd Rm Freshner Lemon Vrbna 8 Oz (Pack Of 6),Home & Kitchen > Household Cleaning > All-Purpose Cleaners
140,591,renz e-z all purpose window washer sprayer refill boxed 16 oz,Home & Kitchen > Household Cleaning > All-Purpose Cleaners
141,591,thymes frasier fir all purpose cleaner,Home & Kitchen > Household Cleaning > All-Purpose Cleaners
142,591,bar keepers friend liquid soft cleaner - 26 oz - 26 oz - pack of 2,Home & Kitchen > Household Cleaning > All-Purpose Cleaners
143,591,Lysol Multi-Purpose Cleaner w/ Hydrogen Peroxide - 22 oz - Oxygen Splash - 2 pk,Home & Kitchen > Household Cleaning > All-Purpose Cleaners
144,591,"method all purpose natural surface cleaner, french lavender, 28 ounce (pack of 4)",Home & Kitchen > Household Cleaning > All-Purpose Cleaners
145,591,Puracy 100% Natural All Purpose Cleaner - THE BEST Household Cleaner - Streak-Free Multi-Surface Spray - Superior Results on Glass & Stainless Steel -,Home & Kitchen > Household Cleaning > All-Purpose Cleaners
146,591,la's totally awesome all purpose concentrated cleaner degreaser spot remover cleans everything washable as seen on tv (64 oz refills) (1 64oz bottle),Home & Kitchen > Household Cleaning > All-Purpose Cleaners
147,591,"formula 409 all-purpose cleaner, antibacterial, 1 qt (32 fl oz) 946 ml",Home & Kitchen > Household Cleaning > All-Purpose Cleaners
148,591,clorox 35300 formula 409 1 gallon cleaner degreaser and disinfectant bottle (case of 4),Home & Kitchen > Household Cleaning > All-Purpose Cleaners
149,591,"the laundress surface cleaner -247 home scent,16- ounce",Home & Kitchen > Household Cleaning > All-Purpose Cleaners
150,591,"Lysol Power & Fresh All Purpose Multi-surface Cleaner - Pourable Lavender and Orchid, 40 Ounces (3 Pack)",Home & Kitchen > Household Cleaning > All-Purpose Cleaners
151,591,pelindaba organic lavender hydrosol - all purpose cleaner - 16 fl oz,Home & Kitchen > Household Cleaning > All-Purpose Cleaners
152,591,doterra onguard cleaner concentrate kitchen,Home & Kitchen > Household Cleaning > All-Purpose Cleaners
153,591,"mr clean all purpose antibacterial cleaner, summer citrus, 40 oz",Home & Kitchen > Household Cleaning > All-Purpose Cleaners
154,591,"mrs. meyer's clean day all purpose cleaner, lavender, 32 ounce bottle",Home & Kitchen > Household Cleaning > All-Purpose Cleaners
155,591,"Clorox Clean-Up Cleaner with Bleach Refill Bottle, 64 Fluid Ounces (Pack of 6)",Home & Kitchen > Household Cleaning > All-Purpose Cleaners
156,591,spic and span all purpose wet wipes - 40 count container,Home & Kitchen > Household Cleaning > All-Purpose Cleaners
157,591,"Frosch Natural Vinegar Universal All Purpose Cleaner, 1000 ml (Pack of 2)",Home & Kitchen > Household Cleaning > All-Purpose Cleaners
158,591,earth friendly product pl974632 parsley plus all purpose cleaner 32 oz.,Home & Kitchen > Household Cleaning > All-Purpose Cleaners
159,591,scotts all purpose flower,Home & Kitchen > Household Cleaning > All-Purpose Cleaners
160,591,"goof off fg653 professional strength remover, pourable 16-ounce",Home & Kitchen > Household Cleaning > All-Purpose Cleaners
161,591,"mr. clean multi-surfaces liquid cleaner, summer citrus, 40 oz-2 pack - 2 pk.",Home & Kitchen > Household Cleaning > All-Purpose Cleaners
162,591,mrs. meyer's clean home,Home & Kitchen > Household Cleaning > All-Purpose Cleaners
163,591,Envirocide Surface Disinfectant Cleaner Gallon,Home & Kitchen > Household Cleaning > All-Purpose Cleaners
164,591,"seventh generation disinfecting multi surface cleaner - spray - 26 fl oz - lemongrass, thyme scent",Home & Kitchen > Household Cleaning > All-Purpose Cleaners
165,591,"j.r. watkins grapefruit bundle: foaming hand soap, 9 floz + all purpose cleaner, 24 floz",Home & Kitchen > Household Cleaning > All-Purpose Cleaners
166,591,Great as a Natural Yoga Mat Cleaner 16 oz Spray Wash Deodorize & Disinfect. Sage & Citrus. Clean Yoga Mat Brands,Home & Kitchen > Household Cleaning > All-Purpose Cleaners
167,591,"Fantastik Heavy Duty All Purpose Cleaner, One Gal and One 32 oz., 2 Piece",Home & Kitchen > Household Cleaning > All-Purpose Cleaners
168,591,Star brite Non-Skid Deck Cleaner With PTEF - 22 oz,Home & Kitchen > Household Cleaning > All-Purpose Cleaners
169,591,"Mrs. Meyer's Clean Day Vinegar Gel Cleaner, Lemon Verbena, 12.0 Fluid Ounce",Home & Kitchen > Household Cleaning > All-Purpose Cleaners
170,591,"Black Diamond Granite Cleaner Combo Qt & Gallon : Natural Stone, Marble, Travertine",Home & Kitchen > Household Cleaning > All-Purpose Cleaners
171,591,"simple green 18203 heavy duty cleaner and degreaser, 1 gallon bottle",Home & Kitchen > Household Cleaning > All-Purpose Cleaners
172,591,Dutch Glow Cleaning Tonic,Home & Kitchen > Household Cleaning > All-Purpose Cleaners
173,591,"method all purpose cleaning spray,french lavender, 28 fluid ounce (pack of 4) health and beauty",Home & Kitchen > Household Cleaning > All-Purpose Cleaners
174,591,bar keeper's friend soft cleanser 13 oz bottle (set of 4) new,Home & Kitchen > Household Cleaning > All-Purpose Cleaners
175,591,"mrs. meyer's clean day counter top spray, lemon verbena, 16 ounce bottle pack of 3",Home & Kitchen > Household Cleaning > All-Purpose Cleaners
176,591,young living thieves household cleaner - 14.4 fl. oz. new,Home & Kitchen > Household Cleaning > All-Purpose Cleaners
177,591,"BAR KEEPERS FRIEND Soft Cleanser Liquid (13 OZ) and Non Scratch Scouring Scrubber Kit | Multipurpose, Stainless Steel, Rust, Soft Cleaner with Heavy Duty Non Scratch DishCloth",Home & Kitchen > Household Cleaning > All-Purpose Cleaners
178,591,j. r. watkins all purpose cleaner - 24 oz - aloe & green tea,Home & Kitchen > Household Cleaning > All-Purpose Cleaners
179,591,Sno Bol Scrub Free Cleaner - 24 oz - 2 pk,Home & Kitchen > Household Cleaning > All-Purpose Cleaners
180,591,2x bar keepers friend® cleanser & polish: 12 oz,Home & Kitchen > Household Cleaning > All-Purpose Cleaners
181,591,hygenall leadoff surface decontamination spray cleaner,Home & Kitchen > Household Cleaning > All-Purpose Cleaners
182,591,Nu-View Concession & Food Equipment Cleaner (1),Home & Kitchen > Household Cleaning > All-Purpose Cleaners
183,591,32OZ Fantastik/Bleach (Pack of 3),Home & Kitchen > Household Cleaning > All-Purpose Cleaners
184,591,"gojo 0958-04 64-ounce hand cleaner, natural orange (discontinued by manufacturer)",Home & Kitchen > Household Cleaning > All-Purpose Cleaners
185,591,"J.R. Watkins - Room Spray,Lavender, 1 x 4 FZ",Home & Kitchen > Household Cleaning > All-Purpose Cleaners
186,591,star brite instant hull cleaner 32 oz,Home & Kitchen > Household Cleaning > All-Purpose Cleaners
187,591,"seventh generation free and clear all purpose cleaner, 32 fl oz",Home & Kitchen > Household Cleaning > All-Purpose Cleaners
188,591,Star brite Non-Skid Deck Cleaner with PTEF,Home & Kitchen > Household Cleaning > All-Purpose Cleaners
189,591,mr. clean antibacterial summer citrus multi-surface cleaner 40 oz,Home & Kitchen > Household Cleaning > All-Purpose Cleaners
190,591,"clorox clean-up cleaner with bleach refill bottle, 32 fluid ounces (pack of 9)",Home & Kitchen > Household Cleaning > All-Purpose Cleaners
191,591,Clorox 35419 Pine-Sol Lemon Fresh Scent Multi-Purpose Cleaner Bottle 28 Oz,Home & Kitchen > Household Cleaning > All-Purpose Cleaners
192,591,greenwalds all purpose cleaner  bonus refill pack makes 5 additional 32ounce spray bottles  citrus,Home & Kitchen > Household Cleaning > All-Purpose Cleaners
193,591,"method all-purpose natural surface cleaner, french lavender, 28 ounce (3 count)",Home & Kitchen > Household Cleaning > All-Purpose Cleaners
194,591,citra solve cleaner & degreaser natural concentrate valencia orange - 32 oz,Home & Kitchen > Household Cleaning > All-Purpose Cleaners
195,591,(2 pack) 28 oz. large plastic multi-purpose spray bottle (900 ml),Home & Kitchen > Household Cleaning > All-Purpose Cleaners
196,591,clorox/home cleaning 01151 clorox 64 oz. all-purpose cleaner refill,Home & Kitchen > Household Cleaning > All-Purpose Cleaners
197,591,"Hard Water Stain Remover, Mineral Deposit, Soap Scum Bathroom Power Brush and Scour Pad Kit",Home & Kitchen > Household Cleaning > All-Purpose Cleaners
